Identification;EshopId;EshopName;ManagerClassName;ProductItemId;Name;Description;SearchCategoryKey;CategoryId;CategoryDesc
153||MK_000000193744;153;Monclick;TD_MANAGER;MK_000000193744;Monitor LED Tuf gaming vg279q1r - monitor a led - full hd (1080p) - 27'' 90lm05s1-b01e70;"Tipo display: Monitor LCD con retroilluminazione a LED; Pollici: 27 ''; Risoluzione: 1920 x 1080 Pixel; Formato: 16:9; Tecnologia pannello: IPS; Touchscreen: No; Uscita audio: Altoparlanti; Regolazione posizione: Inclinazione; Wi-Fi: Nessuna; Luminosità: 250 cd/m; Tempo di risposta: 1 ms;";Monitor e Periferiche PC > Monitor PC;[113,191];Dispositivi elettronici > accessori computer e tablet
153||MK_000000193748;153;Monclick;TD_MANAGER;MK_000000193748;Workstation Dell 5550 - 15.6'' - core i7 10875h - vpro - 32 gb ram - 1 tb ssd x4w19;"Tipologia: Mobile; Processore: Core i7; RAM installata: 32 GB; Modello processore: I7-10875H; RAM massima: 64 GB; Scheda grafica: NVIDIA Quadro T2000; Sistema operativo: Windows 10 Pro Edizione a 64 bit; Capacità hard disk: 1 TB; Tipologia unità ottica installata: Nessuna unità ottica; Velocità clock processore: 2.3 GHz; Tipo hard disk: SSD;";PC Notebook e Tablet > Workstation;[113,197];Dispositivi elettronici > computer e tablet
153||MK_000000193754;153;Monclick;TD_MANAGER;MK_000000193754;Monitor LED Rog strix xg27wq - monitor a led - curvato - 27'' - hdr 90lm05i0-b01970;"Tipo display: Monitor curvo; Pollici: 27 ''; Risoluzione: 2560 x 1440 Pixel; Formato: 16:9; Tecnologia pannello: VA; Touchscreen: No; Uscita audio: Nessuno; Regolazione posizione: Altezza, Inclinazione, Piano girevole; Wi-Fi: Nessuna; Luminosità: 450 cd/m; Tempo di risposta: 1 ms;";Monitor e Periferiche PC > Monitor PC;[113,191];Dispositivi elettronici > accessori computer e tablet
153||MK_000000193333;153;Monclick;TD_MANAGER;MK_000000193333;Borsa Citygear topload laptop case - borsa trasporto notebook tcg470gl;"Tipologia: Borsa trasporto notebook; Adatta per: Notebook; Dimensione monitor: 17.3 pollici; Colore: Nero;";Accessori > Borse e custodie;[113,190];Dispositivi elettronici > accessori
153||MK_000000193778;153;Monclick;TD_MANAGER;MK_000000193778;Lavastoviglie da incasso HIE 2B19 C N A scomparsa totale 13 Coperti Classe F;"Tipologia Incasso: A scomparsa totale; N coperti: 13; Efficienza energetica: Classe F; Larghezza prodotto: 59.8 cm; Larghezza incasso: 60 cm; Livello rumorosità: 49 dB; Consumo acqua: 12 litri; Altezza prodotto: 82 cm; Profondità prodotto: 55.5 cm; Altezza incasso: 82 cm; Profondità incasso: 56 cm; Colore: Grigio; Modello: HIE 2B19 C N;";Elettrodomestici da incasso > Lavastoviglie da incasso;[114,209];Elettrodomestici > Grandi elettrodomestici
153||MK_000000193356;153;Monclick;TD_MANAGER;MK_000000193356;Custodia Citygear 3 - custodia per notebook tss931gl;"Tipologia: Custodia per notebook; Adatta per: Notebook; Dimensione monitor: 14 pollici; Colore: Nero;";Accessori > Borse e custodie;[113,190];Dispositivi elettronici > accessori
153||MK_000000193781;153;Monclick;TD_MANAGER;MK_000000193781;Bicicletta Be Comfort - 25 km/h - Autonomia 45Km - Bianco;"Tipologia: Bicicletta elettrica; Dimensione ruote: 26; Tipo freni: Freno a V; Materiale telaio: Acciaio; Colore: Bianco;";Tempo libero > Biciclette;[126];Veicoli elettrici
153||MK_000000193376;153;Monclick;TD_MANAGER;MK_000000193376;Cover posteriore Pro-tek - flip cover per tablet thz695gl;"Tipologia: Cover posteriore; Adatta per: Tablet; Dimensione monitor: Non applicabile; Colore: Nero;";Accessori > Borse e custodie;[113,190];Dispositivi elettronici > accessori
153||MK_000000193791;153;Monclick;TD_MANAGER;MK_000000193791;Bicicletta F2-L1S6-K 25Km/h Autonomia 22 Km Nero;"Tipologia: Bicicletta elettrica; Dimensione ruote: 20''; Tipo freni: Freno a V; Materiale telaio: Acciaio; Colore: Nero;";Tempo libero > Biciclette;[126];Veicoli elettrici
153||MK_000000193383;153;Monclick;TD_MANAGER;MK_000000193383;Chill mat - supporto notebook awe81eu;"Compatibilità: Tablet; Tipologia: Supporto notebook; Dimensione schermo: Non presente;";Accessori > Staffe e supporti;[113,193];Dispositivi elettronici > accessori telefoni cellulari
153||MK_000000193793;153;Monclick;TD_MANAGER;MK_000000193793;Bicicletta F2-L1S6-G 25Km/h - Autonomia 22 Km - Grigio;"Tipologia: Bicicletta elettrica; Dimensione ruote: 20''; Tipo freni: Freno a V; Materiale telaio: Acciaio; Colore: Grigio;";Tempo libero > Biciclette;[126];Veicoli elettrici
153||MK_000000193416;153;Monclick;TD_MANAGER;MK_000000193416;Zaino Campus - zaino porta computer teb01;"Tipologia: Zaino; Adatta per: Notebook; Dimensione monitor: 16 pollici; Colore: Nero;";Accessori > Borse e custodie;[113,190];Dispositivi elettronici > accessori
153||MK_000000193795;153;Monclick;TD_MANAGER;MK_000000193795;Bicicletta F3-L1S6-G - Ruote 20'' - Velocità massima 23 km/h - Autonomia 22 km - Grigio;"Tipologia: Bicicletta elettrica; Dimensione ruote: 20''; Tipo freni: Freno a V; Materiale telaio: Acciaio; Colore: Grigio;";Tempo libero > Biciclette;[126];Veicoli elettrici
153||MK_000000193428;153;Monclick;TD_MANAGER;MK_000000193428;Switch Powered - hub - 7 porte ach225eu;"N porte LAN: 7; Gestibile: n.d.; Standard: USB; PoE: No; Formato: Desktop;";Networking e Wireless > Switch;[111,189];Casa e giardino > Sistemi di allarme
153||MK_000000193797;153;Monclick;TD_MANAGER;MK_000000193797;Bicicletta elettrica MONSTER BIKE PIEGHEVOLE M1 - ruote 20'' - Autonomia 40km- MATT BLACK;"Tipologia: Bicicletta elettrica; Dimensione ruote: 20''; Tipo freni: A disco; Materiale telaio: Acciaio; Colore: Nero;";Tempo libero > Biciclette;[126];Veicoli elettrici
153||MK_000000193433;153;Monclick;TD_MANAGER;MK_000000193433;Zaino Cypress hero backpack with ecosmart - zaino porta computer tbb586gl;"Tipologia: Zaino; Adatta per: Notebook; Dimensione monitor: 15.6 pollici; Colore: Nero;";Accessori > Borse e custodie;[113,190];Dispositivi elettronici > accessori
153||MK_000000193799;153;Monclick;TD_MANAGER;MK_000000193799;Bicicletta M1PLUS Ruote 20'' Velocità max 25 km/h - Autonomia 40Km - Titanio;"Tipologia: Bicicletta elettrica; Dimensione ruote: 20''; Tipo freni: A disco; Materiale telaio: Acciaio; Colore: Titanio;";Tempo libero > Biciclette;[126];Veicoli elettrici
153||MK_000000193447;153;Monclick;TD_MANAGER;MK_000000193447;Videogioco Need for Speed Hot Pursuit Remastered PS4;"Piattaforma: Sony PlayStation 4; Genere: Corsa / guida - GT/strada; PEGI rating >: 7; Publisher: Electronic Arts;";Giochi e Console > Videogiochi;[113,206];Dispositivi elettronici > videogiochi
153||MK_000000193830;153;Monclick;TD_MANAGER;MK_000000193830;SSD Wd black sn850 nvme ssd - ssd - 500 gb - pcie 4.0 x4 (nvme) wds500g1xhe;"Tipologia: Disco fisso interno; Capacità: 500 GB; Formato: M.2 2280; Interfaccia: PCI Express 4.0 x4 (NVMe);";HDD e Componenti PC > SSD;[113,191];Dispositivi elettronici > accessori computer e tablet
153||MK_000000193450;153;Monclick;TD_MANAGER;MK_000000193450;Cavo applicazione diretta 10gbase - 1.5 m cab-dac15m-sfpp;"Tipologia: Cavo applicazione diretta 10GBase;";Accessori > Accessori server e networking;[113,191];Dispositivi elettronici > accessori computer e tablet
153||MK_000000193834;153;Monclick;TD_MANAGER;MK_000000193834;Micro SD Wd purple sc qd101 - scheda di memoria flash - 32 gb - microsdhc wdd032g1p0c;"Tipologia: microSDHC; Capacità: 32 GB; Classe: UHS-I U1 / Class10; Velocità di lettura: n.d.;";Accessori > SD e Memory Card;[113,191];Dispositivi elettronici > accessori computer e tablet
153||MK_000000193456;153;Monclick;TD_MANAGER;MK_000000193456;Videoproiettore EB-W06 1280 x 800 pixels Proiettore 3LCD 3700 Lumen;"Risoluzione nativa: 1280 x 800 pixels; Tecnologia: Proiettore 3LCD; 3D: No; Luminosità: 3700 lumen; Durata lampada: 6000 ore; Colore: Bianco; Modello: EB-W06;";TV LED e Video > Videoproiettori;[113,205];Dispositivi elettronici > video
153||MK_000000193858;153;Monclick;TD_MANAGER;MK_000000193858;Micro SD Wd purple sc qd101 - scheda di memoria flash - 64 gb wdd064g1p0c;"Tipologia: Scheda di Memoria UHS-I microSDXC; Capacità: 64 GB; Classe: UHS-I U1 / Class10; Velocità di lettura: n.d.;";Accessori > SD e Memory Card;[113,191];Dispositivi elettronici > accessori computer e tablet
153||MK_000000193461;153;Monclick;TD_MANAGER;MK_000000193461;Videogioco Need for Speed Hot Pursuit Remastered Xbox One;"Piattaforma: Microsoft Xbox One, Microsoft Xbox Series X; Genere: Corsa / guida - GT/strada; PEGI rating >: 7; Publisher: Electronic Arts;";Giochi e Console > Videogiochi;[113,206];Dispositivi elettronici > videogiochi
153||MK_000000193869;153;Monclick;TD_MANAGER;MK_000000193869;Webcam Webcam amdis04b;"Tipologia: Webcam; Risoluzione: 1920 x 1080; Interfaccia: USB 2.0; Compatibilità: n.d.;";Monitor e Periferiche PC > Webcam e Videoconferenza;[113,191];Dispositivi elettronici > accessori computer e tablet
153||MK_000000193473;153;Monclick;TD_MANAGER;MK_000000193473;Router LINK ZONE 4G LTE Router Wi-Fi;"Tipologia: Router 4G; Tecnologia di connessione: Wireless; Velocità di trasferimento: 300 Mbps; Formato: Desktop; Modem: Sì; Funzioni aggiuntive: Nessuna;";Networking e Wireless > Router e Access point;[111,189];Casa e giardino > Sistemi di allarme
153||MK_000000193875;153;Monclick;TD_MANAGER;MK_000000193875;Nerf ultra two e7921u500;"Età minima: n.d.; Linea prodotto: n.d.; Personaggio/Tema: n.d.; Numero pezzi: n.d.;";Giochi e Console > Giocattoli e Costruzioni;[113,206];Dispositivi elettronici > videogiochi
153||MK_000000193479;153;Monclick;TD_MANAGER;MK_000000193479;Lavatrice CS1282DE-11 Smart 8 Kg 52 cm Classe D;"Caricamento: Frontale; Capacità carico: 8 kg; Profondità: 52 cm; Efficienza energetica: Classe D; Velocità centrifuga: 1200 rpm; Motore inverter: No; Efficienza centrifuga: Classe B; Altezza: 85 cm; Larghezza: 60 cm; Connettività: NFC; Colore: Bianco; Modello: CS1282DE-11; Serie: Smart;";Grandi elettrodomestici > Lavatrici;[114,207];Elettrodomestici > accessori grandi elettrodomestici
153||MK_000000193879;153;Monclick;TD_MANAGER;MK_000000193879;Borsa Mestalla 5532 - borsa trasporto notebook 5532blue;"Tipologia: Borsa trasporto notebook; Adatta per: Notebook; Dimensione monitor: 16 pollici; Colore: Blu;";Accessori > Borse e custodie;[113,190];Dispositivi elettronici > accessori
153||MK_000000193482;153;Monclick;TD_MANAGER;MK_000000193482;Chiavetta USB Datatraveler kyson - chiavetta usb - 64 gb dtkn/64gb;"Capacità: 64 GB; Interfaccia: USB 3.2 Gen 1; Colore: Argento; Velocità di lettura: 200 MB/s; Velocità di scrittura: Dato non disponibile;";HDD e Componenti PC > Chiavette USB;[113,191];Dispositivi elettronici > accessori computer e tablet
153||MK_000000193892;153;Monclick;TD_MANAGER;MK_000000193892;Mascherina Kit Filtri 30 Aryamask;"Tipologia: Filtri mascherina;";Salute e Bellezza > Salute e igiene;[122,211];Salute e bellezza > Apparecchiature mediche
153||MK_000000193893;153;Monclick;TD_MANAGER;MK_000000193893;Alimentatore Gaming Rog-strix-850g-white - white edition - alimentazione - 850 watt 90ye00a4-b0na00;"Potenza erogata: 850 Watt; Sistema di raffreddamento: Ventola da 135 mm; Tipologia: Interna;";HDD e Componenti PC > Alimentatori PC;[113,191];Dispositivi elettronici > accessori computer e tablet
153||MK_000000193530;153;Monclick;TD_MANAGER;MK_000000193530;Chiavetta USB Datatraveler 80 - chiavetta usb - 256 gb dt80/256gb;"Capacità: 256 GB; Interfaccia: USB 3.2 Gen 1 / USB-C; Colore: Grigio, Nero, Rosso; Velocità di lettura: 200 MB/s; Velocità di scrittura: 60 MB/s;";HDD e Componenti PC > Chiavette USB;[113,191];Dispositivi elettronici > accessori computer e tablet
153||MK_000000193897;153;Monclick;TD_MANAGER;MK_000000193897;Telefono VOIP Grandstream gxv3350 - telefono video ip gxv-3350;"Tipologia: Telefono video IP; Protocolli VoIP: RTCP, RTP, SIP, SRTP;";Telefoni cellulari e fissi > Telefoni VOIP;[113,202];Dispositivi elettronici > telefoni cellulari
153||MK_000000193559;153;Monclick;TD_MANAGER;MK_000000193559;Processore Xeon silver 4210r / 2.4 ghz processore 338-bvke;"Tecnologia: Xeon Silver; Modello processore: 4210R; Velocità clock: 2.4 GHz; N core: 10-core; Cache: 13.75 MB;";HDD e Componenti PC > Processori PC;[113,191];Dispositivi elettronici > accessori computer e tablet
153||MK_000000193904;153;Monclick;TD_MANAGER;MK_000000193904;Wired personal video collaboration kit - kit per videoconferenza 991-000338;"Tipologia: n.d.;";Accessori > Accessori server e networking;[113,191];Dispositivi elettronici > accessori computer e tablet
153||MK_000000193597;153;Monclick;TD_MANAGER;MK_000000193597;Xeon gold 5218r / 2.1 ghz processore 338-bvkv;"Tipologia: n.d.;";Accessori > Accessori rack;[113,191];Dispositivi elettronici > accessori computer e tablet
153||MK_000000193918;153;Monclick;TD_MANAGER;MK_000000193918;Monitor LED Qreator 27 - monitor a led - 4k - 27'' - hdr 66b7rac1it;"Tipo display: Monitor LCD con retroilluminazione a LED; Pollici: 27 ''; Risoluzione: 3840 x 2160 Pixel; Formato: 16:9; Tecnologia pannello: IPS; Touchscreen: No; Uscita audio: Altoparlanti; Regolazione posizione: Inclinazione; Wi-Fi: Nessuna; Luminosità: 400 cd/m; Tempo di risposta: 4 ms;";Monitor e Periferiche PC > Monitor PC;[113,191];Dispositivi elettronici > accessori computer e tablet
153||MK_000000193688;153;Monclick;TD_MANAGER;MK_000000193688;Termocoperta Adapto Maxi Anallergico Trapuntato Matrimoniale 16729;"Potenza: 300 W; Larghezza: 165 cm; Colore: Bianco;";Climatizzazione > Termocoperte;[111,173];Casa e giardino > Climatizzazione
153||MK_000000193927;153;Monclick;TD_MANAGER;MK_000000193927;Monitor LFD The wall iw016j iwj series led display unit lh016iwjmws/en;"Pollici: n.d.; Risoluzione: n.d.; Formato: n.d.; Tecnologia pannello: LED; Uscita audio: n.d.; Interfacce: n.d.; Connettività: Nessuna; Destinazione d'uso: Segnaletica digitale; Luminosità: 1000 cd/m2; Contrasto: 10000:1; Tempo di risposta: n.d.;";Monitor e Periferiche PC > Monitor LFD;[113,191];Dispositivi elettronici > accessori computer e tablet
153||MK_000000193698;153;Monclick;TD_MANAGER;MK_000000193698;Caffettiera Grancucina natural taste m.wood - percolatore v443043ntmw;"Numero tazze: 3; Linea: Grancucina;";Casalinghi > Caffettiere;[111,170];Casa e giardino > Accessori cucina
153||MK_000000193937;153;Monclick;TD_MANAGER;MK_000000193937;Micro SD Ultra - scheda di memoria flash - 256 gb - uhs-i microsdxc sdsqunr-256g-gn6ta;"Tipologia: Scheda di Memoria UHS-I microSDXC; Capacità: 256 GB; Classe: Class 10; Velocità di lettura: 100 MB/s;";Accessori > SD e Memory Card;[113,191];Dispositivi elettronici > accessori computer e tablet
153||MK_000000193707;153;Monclick;TD_MANAGER;MK_000000193707;Gruppo di continuità Paxxon - ups - 480 watt - 800 va 23503;"Potenza erogata: 480 Watt; Capacità di alimentazione: 800 VA; Durata batteria: 5 min; N spine connettibili: 2;";Networking e Wireless > Gruppi di continuità;[111,189];Casa e giardino > Sistemi di allarme
153||MK_000000193944;153;Monclick;TD_MANAGER;MK_000000193944;Memoria RAM Ddr4 - modulo - 16 gb - so dimm 260-pin kcp432sd8/16;"Tecnologia: DDR4 SDRAM; Capacità: 16 GB; Clock: 3200 MHz; Tipo modulo: SO DIMM 260-pin; Nome modulo: PC4-25600; Error checking: Non ECC; Ampiezza modulo: Senza buffer;";HDD e Componenti PC > Memorie RAM;[113,191];Dispositivi elettronici > accessori computer e tablet
153||MK_000000193716;153;Monclick;TD_MANAGER;MK_000000193716;SLIM1 Bianco;"Tipologia: True wireless earphones; Connettività: Senza fili; Tecnologia wireless: Bluetooth; Colore: Bianco; Serie: n.d.; Modello: SLIM1;";Home Cinema e Audio > Cuffie e auricolari;[113,196];Dispositivi elettronici > audio
153||MK_000000193948;153;Monclick;TD_MANAGER;MK_000000193948;Memoria RAM Valueram - ddr4 - modulo - 32 gb - so dimm 260-pin kvr32s22d8/32;"Tecnologia: DDR4 SDRAM; Capacità: 32 GB; Clock: 3200 MHz; Tipo modulo: SO DIMM 260-pin; Nome modulo: PC4-25600; Error checking: Non ECC; Ampiezza modulo: Senza buffer;";HDD e Componenti PC > Memorie RAM;[113,191];Dispositivi elettronici > accessori computer e tablet
153||MK_000000193720;153;Monclick;TD_MANAGER;MK_000000193720;Mouse Voca comfort - mouse - usb 23650;"Connettività: Cablato; Interfaccia: USB; Tecnologia: Ottica; Colore: Nero;";Monitor e Periferiche PC > Mouse;[113,191];Dispositivi elettronici > accessori computer e tablet
153||MK_000000193954;153;Monclick;TD_MANAGER;MK_000000193954;Memoria RAM Ddr4 - modulo - 32 gb - so dimm 260-pin kcp432sd8/32;"Tecnologia: DDR4 SDRAM; Capacità: 32 GB; Clock: 3200 MHz; Tipo modulo: SO DIMM 260-pin; Nome modulo: PC4-25600; Error checking: Non ECC; Ampiezza modulo: Senza buffer;";HDD e Componenti PC > Memorie RAM;[113,191];Dispositivi elettronici > accessori computer e tablet
153||MK_000000193729;153;Monclick;TD_MANAGER;MK_000000193729;Slim1 - true wireless earphones con microfono slim1bk;"Tipologia: True wireless earphones; Connettività: Senza fili; Tecnologia wireless: Bluetooth; Colore: Nero; Serie: n.d.; Modello: SLIM1;";Home Cinema e Audio > Cuffie e auricolari;[113,196];Dispositivi elettronici > audio
153||MK_000000193957;153;Monclick;TD_MANAGER;MK_000000193957;Rds industries game traveler deluxe travel case nns53a;"Tipologia: n.d.; Adatta per: Nintendo Switch;";Accessori > Accessori per console;[113,195];Dispositivi elettronici > accessori videogiochi
153||MK_000000193958;153;Monclick;TD_MANAGER;MK_000000193958;Custodia RDS Deluxe travel case Super Mario & Friends NNS53B;"Tipologia: Custodia; Adatta per: Nintendo Switch;";Accessori > Accessori per console;[113,195];Dispositivi elettronici > accessori videogiochi
153||MK_000000193959;153;Monclick;TD_MANAGER;MK_000000193959;Controller Wired Compact USB Gamepad PS4;"Compatibilità: Sony PlayStation 4; Tipologia: Gamepad; Tecnologia di connessione: Cablato; Colore: Grigio;";Giochi e Console > Controller e joystick;[113,206];Dispositivi elettronici > videogiochi
153||MK_000000193963;153;Monclick;TD_MANAGER;MK_000000193963;Controller Nacon revolution pro controller 3 - game pad - cablato ps4ofpadrpc3blue;"Compatibilità: PC, Sony PlayStation 4; Tipologia: Gamepad; Tecnologia di connessione: Cablato; Colore: Blu;";Giochi e Console > Controller e joystick;[113,206];Dispositivi elettronici > videogiochi
153||MK_000000193965;153;Monclick;TD_MANAGER;MK_000000193965;Controller Nacon revolution pro controller 3 - game pad - cablato ps4ofpadrpc3red;"Compatibilità: PC, Sony PlayStation 4; Tipologia: Gamepad; Tecnologia di connessione: Cablato; Colore: Rosso;";Giochi e Console > Controller e joystick;[113,206];Dispositivi elettronici > videogiochi
153||MK_000000193968;153;Monclick;TD_MANAGER;MK_000000193968;Cover posteriore per console giochi switch2glove;"Tipologia: n.d.; Adatta per: Nintendo Switch;";Accessori > Accessori per console;[113,195];Dispositivi elettronici > accessori videogiochi
153||MK_000000193972;153;Monclick;TD_MANAGER;MK_000000193972;Rasoio elettrico Cassetta rasoio - argento opaco 83m;"Batteria ricaricabile: No; Autonomia: 0; Utilizzo: n.d.; Tipo rasoio: n.d.; Numero testine/lame: 0; Serie: n.d.; Modello: 83M;";Salute e Bellezza > Rasoi elettrici;[122,216];Salute e bellezza > cura dei capelli
153||MK_000000193973;153;Monclick;TD_MANAGER;MK_000000193973;Lavasciuga CSWS 4962DWE/1-S Smart Touch 9 Kg / 6 Kg Profondità 58 cm Classe E;"Capacità di carico: 9 Kg; Capacità di asciugatura: 6 Kg; Profondità: 58 cm; Efficienza energetica: Classe E; Efficienza energetica lavaggio: Classe C; Motore inverter: No; Velocità centrifuga: 1400 rpm; Larghezza: 65 cm; Altezza: 89 cm; Modello: CSWS 4962DWE/1-S; Serie: Smart Touch;";Grandi elettrodomestici > Lavasciuga;[114,207];Elettrodomestici > accessori grandi elettrodomestici
153||MK_000000193974;153;Monclick;TD_MANAGER;MK_000000193974;Controller Xbox Wireless Controller Schock Black + USB-C Cable;"Compatibilità: Android, iOS, Microsoft Xbox One, Microsoft Xbox Series S, Microsoft Xbox Series X, PC; Tipologia: Gamepad; Tecnologia di connessione: Senza fili; Colore: Nero;";Giochi e Console > Controller e joystick;[113,206];Dispositivi elettronici > videogiochi
153||MK_000000193976;153;Monclick;TD_MANAGER;MK_000000193976;Router Dir-x1560 - router wireless - 802.11a/b/g/n/ac/ax - desktop dirx1560;"Tipologia: Router; Tecnologia di connessione: Cablato, Wireless; Velocità di trasferimento: Dato non disponibile; Formato: Desktop; Modem: Non presente; Funzioni aggiuntive: Firewall;";Networking e Wireless > Router e Access point;[111,189];Casa e giardino > Sistemi di allarme
153||MK_000000193977;153;Monclick;TD_MANAGER;MK_000000193977;Congelatore HCE379F Orizzontale 379 Litri Raffreddamento statico Classe F;"Tipologia: Orizzontale; Volume utile scomparto: 379 litri; Efficienza energetica: Classe F; Larghezza: 124 cm; Altezza: 84.5 cm; Profondità: 74.5 cm; Tipo di raffreddamento: Statico; Congelamento rapido: Sì; Modello: HCE379F;";Grandi elettrodomestici > Congelatori;[114,207];Elettrodomestici > accessori grandi elettrodomestici
153||MK_000000193978;153;Monclick;TD_MANAGER;MK_000000193978;Frigorifero HRC-45D2H Side by side Classe F 83.3 cm Total No Frost Argento;"Tipologia: Side by side; Colore: Argento; Efficienza energetica: Classe F; Larghezza: 83.3 cm; Volume scomparto freschi: 314 litri; Volume scomparto surgelati: 154 litri; Sistema raffreddamento: Total No Frost; Dispenser: No; Altezza: 180.4 cm; Profondità: 66.6 cm; Porte reversibili: n.d.; Display: Presente; N ripiani frigorifero: 3; Modello: HRC-45D2H;";Grandi elettrodomestici > Frigoriferi;[114,207];Elettrodomestici > accessori grandi elettrodomestici
153||MK_000000193979;153;Monclick;TD_MANAGER;MK_000000193979;Frigorifero HTR3619ENMN 3D 60 Serie 3 3 porte Classe E 59.5 cm Total No frost Argento;"Tipologia: 3 porte; Colore: Argento; Efficienza energetica: Classe E; Larghezza: 59.5 cm; Volume scomparto freschi: 234 litri; Volume scomparto surgelati: 114 litri; Sistema raffreddamento: Total No frost; Dispenser: No; Altezza: 190.5 cm; Profondità: 65.7 cm; Porte reversibili: Sì; Display: Presente; N ripiani frigorifero: 4; Modello: HTR3619ENMN 3D 60 Serie 3;";Grandi elettrodomestici > Frigoriferi;[114,207];Elettrodomestici > accessori grandi elettrodomestici
153||MK_000000193980;153;Monclick;TD_MANAGER;MK_000000193980;Lavatrice HW100-B1439N 10 Kg 60 cm Classe A;"Caricamento: Frontale; Capacità carico: 10 kg; Profondità: 60 cm; Efficienza energetica: Classe A; Velocità centrifuga: 1400 rpm; Motore inverter: No; Efficienza centrifuga: Classe B; Altezza: 85 cm; Larghezza: 59.5 cm; Connettività: Assente; Colore: Bianco; Modello: HW100-B1439N; Serie: n.d.;";Grandi elettrodomestici > Lavatrici;[114,207];Elettrodomestici > accessori grandi elettrodomestici
153||MK_000000193981;153;Monclick;TD_MANAGER;MK_000000193981;Lavasciuga HD 495AMC/1-S H-Wash & Dry 500 9 Kg / 5 Kg Profondità 53 cm Classe D;"Capacità di carico: 9 Kg; Capacità di asciugatura: 5 Kg; Profondità: 53 cm; Efficienza energetica: Classe D; Efficienza energetica lavaggio: Classe A; Motore inverter: Sì; Velocità centrifuga: 1400 rpm; Larghezza: 60 cm; Altezza: 89 cm; Modello: HD 495AMC/1-S; Serie: H-Wash & Dry 500;";Grandi elettrodomestici > Lavasciuga;[114,207];Elettrodomestici > accessori grandi elettrodomestici
153||MK_000000193982;153;Monclick;TD_MANAGER;MK_000000193982;Lavasciuga HD 696AMC/1-S H-Wash & Dry 500 9 Kg / 6 Kg Profondità 58 cm Classe D;"Capacità di carico: 9 Kg; Capacità di asciugatura: 6 Kg; Profondità: 58 cm; Efficienza energetica: Classe D; Efficienza energetica lavaggio: Classe A; Motore inverter: Sì; Velocità centrifuga: 1600 rpm; Larghezza: 60 cm; Altezza: 89 cm; Modello: HD 696AMC/1-S; Serie: H-Wash & Dry 500;";Grandi elettrodomestici > Lavasciuga;[114,207];Elettrodomestici > accessori grandi elettrodomestici
153||MK_000000193984;153;Monclick;TD_MANAGER;MK_000000193984;Lavatrice HW 48AMC/1-S H-Wash 500 8 Kg 53 cm Classe A;"Caricamento: Frontale; Capacità carico: 8 kg; Profondità: 53 cm; Efficienza energetica: Classe A; Velocità centrifuga: 1400 rpm; Motore inverter: Sì; Efficienza centrifuga: Classe B; Altezza: 85 cm; Larghezza: 60 cm; Connettività: Bluetooth, WiFi; Colore: Bianco; Modello: HW 48AMC/1-S; Serie: H-Wash 500;";Grandi elettrodomestici > Lavatrici;[114,207];Elettrodomestici > accessori grandi elettrodomestici
153||MK_000000193991;153;Monclick;TD_MANAGER;MK_000000193991;Lavastoviglie da incasso WIO 3O540 PELG A scomparsa totale 14 Coperti Classe B;"Tipologia Incasso: A scomparsa totale; N coperti: 14; Efficienza energetica: Classe B; Larghezza prodotto: 59.8 cm; Larghezza incasso: 60 cm; Livello rumorosità: 40 dB; Consumo acqua: 9.5 litri; Altezza prodotto: 82 cm; Profondità prodotto: 55.5 cm; Altezza incasso: 82 cm; Profondità incasso: 56 cm; Colore: Acciaio inossidabile; Modello: WIO 3O540 PELG;";Elettrodomestici da incasso > Lavastoviglie da incasso;[114,209];Elettrodomestici > Grandi elettrodomestici
153||MK_000000194005;153;Monclick;TD_MANAGER;MK_000000194005;Notebook Laptop 15s-eq0008nl - 15.6'' - ryzen 5 3500u - 8 gb ram - 512 gb ssd 9cn80ea#abz;"Tipologia: Notebook; Dimensione schermo: 15,6 ''; Sistema operativo: Windows 10 Home; Tipo processore: AMD Ryzen 5; Serie scheda video: AMD Radeon Vega; Scheda grafica dedicata: Integrata; Memoria RAM: 8 GB; Touchscreen: No; Modello processore: 3500U; Modello scheda grafica: AMD Radeon Vega 8; RAM massima: 16 GB; Tipo hard disk: SSD; Capacità hard disk: 512 GB; Peso: 1.74 kg; Risoluzione: 1920 x 1080 Pixels; Unità ottica installata: Nessuna unità ottica; Colore: Argento; Marchio processore: AMD;";PC Notebook e Tablet > Notebook;[113,197];Dispositivi elettronici > computer e tablet
153||MK_000000194008;153;Monclick;TD_MANAGER;MK_000000194008;Scheda video Gtx 1050 ti 4gt lp - scheda grafica - gf gtx 1050 ti - 4 gb gtx1050ti-4gtlp;"Chip grafico: NVIDIA GeForce; Memoria video: n.d.; Interfaccia (bus): PCI Express 3.0 x16; Uscita video: DisplayPort, DVI, HDMI; Tipo di memoria video: GDDR5 SDRAM;";HDD e Componenti PC > Schede video;[113,191];Dispositivi elettronici > accessori computer e tablet
