Identification;EshopId;EshopName;ManagerClassName;ProductItemId;Name;Description;SearchCategoryKey;CategoryId;CategoryDesc
174||655675902;174;Coop Online;TD_MANAGER;655675902;Extra Power Universal Nastro americano argento 5 m x 50 mm;Tesa extra Power Universale 5 m x 50 mm è un nastro versatile con grande forza adesiva e resistenza agli strappi. Ideale per applicazioni domestiche, hobby e tempo libero. Colore: argento.;Home-Outdoor e Tempo Libero-Auto e fai da te-Ferramenta-Colle e siliconi;[112];Componenti ed accessori auto e moto
174||638005401;174;Coop Online;TD_MANAGER;638005401;Nastro biadesivo Powerbond Interni 19 mm x 1,5 m;Tesa Powerbond Interni 19 mm x 1,5 m è un nastro biadesivo perfetto per fissare oggetti in modo permanente su superfici in interni. Il modo semplice di completare lavori di fissaggio a parete senza il fastidio di praticare fori.;Home-Outdoor e Tempo Libero-Auto e fai da te-Ferramenta-Colle e siliconi;[112];Componenti ed accessori auto e moto
174||653004001;174;Coop Online;TD_MANAGER;653004001;Nastro da imballaggio Pack Basic 3 pz. 55mm x 6m;TesapackBasic è un nastro da imballaggio conveniente per una grande varietà di applicazioni. Ti permette di chiudere scatole e cartoni in semplicità. La confezione include 3 rotoli da 55mm x 6m.;Home-Outdoor e Tempo Libero-Auto e fai da te-Ferramenta-Colle e siliconi;[112];Componenti ed accessori auto e moto
174||638032601;174;Coop Online;TD_MANAGER;638032601;Powerbond Nastro biadesivo per specchi 1,5 m x 19 mm;Perfetto per fissare specchi senza trapanare, questo nastro biadesivo resistente all'umidità da 1,5 m x 19 mm è idoneo anche per l'uso nei bagni in presenza di vapore.;Home-Outdoor e Tempo Libero-Auto e fai da te-Ferramenta-Colle e siliconi;[112];Componenti ed accessori auto e moto
174||655676502;174;Coop Online;TD_MANAGER;655676502;Extra Power Universal Nastro americano bianco 5 m x 50 mm;Tesa extra Power Universale 5 m x 50 mm è un nastro versatile con grande forza adesiva e resistenza agli strappi. Ideale per applicazioni domestiche, hobby e tempo libero. Colore: bianco.;Home-Outdoor e Tempo Libero-Auto e fai da te-Ferramenta-Colle e siliconi;[112];Componenti ed accessori auto e moto
174||700644701;174;Coop Online;TD_MANAGER;700644701;Set rifrangenti 12 pz.;Set di 12 sagome curve con collante speciale rifrangenti in tessuto per pneumatici bici.;Home-Outdoor e Tempo Libero-Bici e accessori-Accessori bici-Sicurezza e protezioni;[108,163];Articoli sportivi > Biciclette
174||442212101;174;Coop Online;TD_MANAGER;442212101;Kit protezioni Mickey XS;Kit con protezioni per gomiti e ginocchia dedicate all'iconico Mickey Mouse. Si può usare per la bicicletta, con i pattini e con lo skateboard. Taglia XS adatta a bambini di 2-3 anni e di massimo 25 kg.;Home-Outdoor e Tempo Libero-Bici e accessori-Accessori bici-Sicurezza e protezioni;[108,163];Articoli sportivi > Biciclette
174||442212301;174;Coop Online;TD_MANAGER;442212301;Kit protezioni Cars S;Kit con protezioni per gomiti, ginocchia e polsi dedicate a Cars. Si può usare per la bicicletta, con i pattini e con lo skateboard. Taglia S adatta a bambini da 4 a 7 anni e di massimo 25 kg.;Home-Outdoor e Tempo Libero-Bici e accessori-Accessori bici-Sicurezza e protezioni;[108,163];Articoli sportivi > Biciclette
174||306421301;174;Coop Online;TD_MANAGER;306421301;Luce LED posteriore con rilevamento frenata automatico;Luce LED posteriore con rilevamento frenata automatico, 6 modalità di lampeggio ed autonomia fino a 54 ore.;Home-Outdoor e Tempo Libero-Bici e accessori-Accessori bici-Sicurezza e protezioni;[108,163];Articoli sportivi > Biciclette
174||442211601;174;Coop Online;TD_MANAGER;442211601;Casco ciclo Kid Principesse Tg. M 52-56 cm;Il casco ci permette di evitare che i nostri bambini rischino di battere la testa andando in bicicletta o solo dopo un'improvvisa frenata. Adatto dai 4 agli 8 anni, il casco Kid Principesse taglia M, circonferenza 52-56 cm, è quello che fa al caso vostro!;Home-Outdoor e Tempo Libero-Bici e accessori-Accessori bici-Caschi bici;[108,163];Articoli sportivi > Biciclette
174||442211801;174;Coop Online;TD_MANAGER;442211801;Casco ciclo Baby Mickey Mouse Tg. XS 44-50 cm;Il casco ci permette di evitare che i nostri bambini rischino di battere la testa andando in bicicletta o solo dopo un'improvvisa frenata. Adatto dai 2 ai 4 anni, il casco Baby Mickey Mouse taglia XS, circonferenza 44-50 cm, è quello che fa al caso vostro!;Home-Outdoor e Tempo Libero-Bici e accessori-Accessori bici-Caschi bici;[108,163];Articoli sportivi > Biciclette
174||442211901;174;Coop Online;TD_MANAGER;442211901;Casco ciclo Baby Minnie Tg. XS 44-50 cm;Il casco ci permette di evitare che i nostri bambini rischino di battere la testa andando in bicicletta o solo dopo un'improvvisa frenata. Adatto dai 2 ai 4 anni, il casco Baby Minnie taglia XS, circonferenza 44-50 cm, è quello che fa al caso vostro!;Home-Outdoor e Tempo Libero-Bici e accessori-Accessori bici-Caschi bici;[108,163];Articoli sportivi > Biciclette
174||315117101;174;Coop Online;TD_MANAGER;315117101;Casco bambino con luce LED blue;Pedala in sicurezza con il casco Nilox con luce LED posteriore a 3 intermittenze, realizzato in taglia S/M, per una circonferenza della testa di 52-57 cm. Colore: blu.;Home-Outdoor e Tempo Libero-Bici e accessori-Accessori bici-Caschi bici;[108,163];Articoli sportivi > Biciclette
174||449520501;174;Coop Online;TD_MANAGER;449520501;Pompa officina con manometro;Pompa officina con manometro, con piedino ed impugnatura in plastica antiscivolo. Accessoriata con un raccordo doppia valvola, è indicata per valvole Schraeder, Presta e Regina. Sulla pompa è presente anche una levetta di ancoraggio valvola. La pressione massima è di 7 atmosfere. Colore: titanio.;Home-Outdoor e Tempo Libero-Bici e accessori-Accessori bici-Pompe;[108,163];Articoli sportivi > Biciclette
174||646060202;174;Coop Online;TD_MANAGER;646060202;Rastrelliera per bicicletta a 1 posto;La rastrelliera a un posto in acciaio zincato è un supporto molto pratico che, tra laltro, può essere utilizzato anche per parcheggiare più biciclette una di fianco allaltra in quanto componibile. Adattabile a tutti i tipi di ruota di cicli corsa/MTB/city bike/sport.;Home-Outdoor e Tempo Libero-Bici e accessori-Accessori bici-Portabici;[108,163];Articoli sportivi > Biciclette
174||748904201;174;Coop Online;TD_MANAGER;748904201;Cesto anteriore bici Ceanfo;Dalla grafica minimal in linea con la 321 folding firmata Dino Bikes, il cesto Ceanfo è l'accessorio ideale per valorizzare il vostro look aggiungendo la comodità.;Home-Outdoor e Tempo Libero-Bici e accessori-Accessori bici-Cestini e portapacchi;[108,163];Articoli sportivi > Biciclette
174||612402001;174;Coop Online;TD_MANAGER;612402001;Panetto bianco 0,5 kg;DAS è la pasta per modellare autoindurente a base minerale, dermatologicamente testata e senza glutine, indurisce all'aria senza bisogno di cottura. Confezionata in buste dalluminio per mantenere a lungo il prodotto, questo panetto bianco ha l'etichetta apri e chiudi inserita sul retro.;Home-Giochi, Infanzia e Cartoleria-Cartoleria-Disegno e scrittura-Didattica;[125,234];Ufficio > Forniture per ufficio
174||687831601;174;Coop Online;TD_MANAGER;687831601;Set 4 accessori per modellare Easydò;Di questo set proprio non puoi fare a meno per rifinire, tagliare e lavorare al meglio la tua pasta da modellare Esydò. 4 accessori per scatenare la tua passione creativa!;Home-Giochi, Infanzia e Cartoleria-Cartoleria-Disegno e scrittura-Didattica;[125,234];Ufficio > Forniture per ufficio
174||758481201;174;Coop Online;TD_MANAGER;758481201;Astuccio delle regole di matematica;Tutto quello che ti serve per ripassare le regole di matematica e geometria, i procedimenti di calcolo e le tabelle riassuntive con le formule!;Home-Giochi, Infanzia e Cartoleria-Cartoleria-Disegno e scrittura-Didattica;[125,234];Ufficio > Forniture per ufficio
174||758481801;174;Coop Online;TD_MANAGER;758481801;La linea del 100 libro e strumento;Ecco una nuova proposta per lo svolgimento del programma di matematica per il secondo anno della scuola primaria. La linea del 100 offre a tutti i bambini un modo divertente e stimolante per alleviare la fatica che comporta l'apprendimento della matematica.;Home-Giochi, Infanzia e Cartoleria-Cartoleria-Disegno e scrittura-Didattica;[125,234];Ufficio > Forniture per ufficio
174||493856201;174;Coop Online;TD_MANAGER;493856201;Libro È arrivata un'astronave carica di... cornicette, giochi e pregra;Libro pensato per bambini dai 5 ai 7 anni ricco di fumetti, percorsi, cornicette, esercizi di pregrafismo e di svago. Capitan Lapis ha bisogno del vostro aiuto per recuperare i mostri dispersi!;Home-Giochi, Infanzia e Cartoleria-Cartoleria-Disegno e scrittura-Didattica;[125,234];Ufficio > Forniture per ufficio
174||486265601;174;Coop Online;TD_MANAGER;486265601;Le mille e una storia Giochi per raccontare e immaginare;Le mille e una storia Giochi per raccontare e immaginare offre in una sola scatola, tanti giochi educativi per bambini che stimolano e sviluppano la fantasia e la creatività.;Home-Giochi, Infanzia e Cartoleria-Cartoleria-Disegno e scrittura-Didattica;[125,234];Ufficio > Forniture per ufficio
174||111853501;174;Coop Online;TD_MANAGER;111853501;10 mine per compasso e affilamine;Blister contenente 10 mine per compasso facili da cancellare e resistenti ed affilamine. Queste per compasso possono essere applicate nella maggior parte dei compassi con ricariche sostituibili.;Home-Giochi, Infanzia e Cartoleria-Cartoleria-Disegno e scrittura-Didattica;[125,234];Ufficio > Forniture per ufficio
174||116420801;174;Coop Online;TD_MANAGER;116420801;Il gran libro green;Il gran libro green è un colorato e divertente quaderno operativo, ricco di attività e quiz, ideato per sviluppare una sensibilità ecologica e aiutare i bambini, dai 6 agli 8 anni, a diventare adulti responsabili nei confronti del pianeta.;Home-Giochi, Infanzia e Cartoleria-Cartoleria-Disegno e scrittura-Didattica;[125,234];Ufficio > Forniture per ufficio
174||499996401;174;Coop Online;TD_MANAGER;499996401;44 gatti sottosopra;I gatti di 44 Gatti, hanno messo sottosopra il loro mondo. Aiutali a mettere ordine e, contemporaneamente, impara a descrivere lo spazio e le posizioni degli oggetti, abilità visuo-spaziali che ti serviranno per iniziare la scuola!;Home-Giochi, Infanzia e Cartoleria-Cartoleria-Disegno e scrittura-Didattica;[125,234];Ufficio > Forniture per ufficio
174||676082901;174;Coop Online;TD_MANAGER;676082901;Frizion Compasso con tasti apertura e prolunga;Frizion di Staedtler è un compasso in ottone nichelato con vite centrale per regolazione micrometrica, tasti per apertura rapida a frizione e aste snodate. In confezione con prolunga, tubetto mine di ricambio e innesto universale. Diametro massimo del cerchio: ca. 330 mm, con prolunga 580 mm.;Home-Giochi, Infanzia e Cartoleria-Cartoleria-Disegno e scrittura-Righe, compassi e squadre;[125,234];Ufficio > Forniture per ufficio
174||751945301;174;Coop Online;TD_MANAGER;751945301;Balaustrone Project Black;Project Black include un balaustrone, un'allunga, un'innesto e punte di ricambio. Adatto all'uso scolastico e professionale, è doatato di innovativo sistema di apertura a doppio meccanismo.;Home-Giochi, Infanzia e Cartoleria-Cartoleria-Disegno e scrittura-Righe, compassi e squadre;[125,234];Ufficio > Forniture per ufficio
174||502701601;174;Coop Online;TD_MANAGER;502701601;Squadra in plastica 60 30 cm Tecnoschool;Questa squadra di 60, della lunghezza di 30 cm, è realizzata in plastica ed è caratterizzata da un bordo esterno smussato e bordo interno in modo da agevolare la presa e rendere il suo utilizzo più semplice ed efficace.;Home-Giochi, Infanzia e Cartoleria-Cartoleria-Disegno e scrittura-Righe, compassi e squadre;[125,234];Ufficio > Forniture per ufficio
174||502701801;174;Coop Online;TD_MANAGER;502701801;Riga in plastica 60 cm tecnoschool;Questo riga della lunghezza di 60 cm è realizzata in plastica, è maneggevole e ne permette l'utilizzo in tutta semplicità ed efficacia.;Home-Giochi, Infanzia e Cartoleria-Cartoleria-Disegno e scrittura-Righe, compassi e squadre;[125,234];Ufficio > Forniture per ufficio
174||502702101;174;Coop Online;TD_MANAGER;502702101;Triplodecimetro da 30 cm in plastica Tecnoschool;Triplodecimetro 30 cm in plastica. Impugnatura centrale piccola e maneggevole. Graduazione incisa a caldo dei numeri e dei millimetri per garantire precisione e indelebilità. Materiale termoresistente e massima trasparenza.;Home-Giochi, Infanzia e Cartoleria-Cartoleria-Disegno e scrittura-Righe, compassi e squadre;[125,234];Ufficio > Forniture per ufficio
174||502702201;174;Coop Online;TD_MANAGER;502702201;Goniometro in plastica 180 12 cm Tecnoschool;Questo goniometro di 180, della lunghezza di 12 cm, è realizzato in plastica ed è caratterizzato da un bordo esterno smussato e bordo interno in modo da agevolare la presa e rendere il suo utilizzo più semplice ed efficace.;Home-Giochi, Infanzia e Cartoleria-Cartoleria-Disegno e scrittura-Righe, compassi e squadre;[125,234];Ufficio > Forniture per ufficio
174||256866001;174;Coop Online;TD_MANAGER;256866001;Correttore a nastro Micro Tape Twist 8 m;Correttore a nastro Micro Tape Twist con nastro da 5 mm di larghezza x 8 m di lunghezza, dal design ultra compatto con film a base di plastica resistente agli strappi. Dotato di punta girevole proteggi-nastro: nessun cappuccio verrà perso.;Home-Giochi, Infanzia e Cartoleria-Cartoleria-Disegno e scrittura-Scrittura e correzione;[125,234];Ufficio > Forniture per ufficio
174||503794601;174;Coop Online;TD_MANAGER;503794601;Maschera cerchi da 1 a 35 mm;Questa maschera per cerchi grande è un particolare tipo di strumento che permette di disegnare cerchi da 1 a 35 mm.;Home-Giochi, Infanzia e Cartoleria-Cartoleria-Disegno e scrittura-Righe, compassi e squadre;[125,234];Ufficio > Forniture per ufficio
174||290692701;174;Coop Online;TD_MANAGER;290692701;Marcatore permanente N50 rosso;Marcatore permanente rosso con punta conica extra forte sintetica da 4,3 mm, tratto 1,5 mm e fusto in metallo ideale per un utilizzo professionale. Graziea all'alta indelebilità dell'inchiostro, è adatto a scrivere su tutte le superfici. Lunghezza di scrittura minima 1000m.;Home-Giochi, Infanzia e Cartoleria-Cartoleria-Disegno e scrittura-Scrittura e correzione;[125,234];Ufficio > Forniture per ufficio
174||701180002;174;Coop Online;TD_MANAGER;701180002;Set compasso Arco con 7 pezzi;Cerchi perfetti con il set compasso Arco. All'interno della confezione troverai compasso, prolunga, innesto a punta, tiralinee, balaustrino ad arco e innesto a punta per balaustrino.;Home-Giochi, Infanzia e Cartoleria-Cartoleria-Disegno e scrittura-Righe, compassi e squadre;[125,234];Ufficio > Forniture per ufficio
174||295537001;174;Coop Online;TD_MANAGER;295537001;Confezione da 2 penne a sfera blu Noris stick 434;Confezione da 2 penne a sfera Noris stick 434, tratto M. Fusto esagonale e lungo puntale in ottone, inchiostro blu. Grande autonomia di scrittura grazie all''elevato contenuto d'inchiostro.;Home-Giochi, Infanzia e Cartoleria-Cartoleria-Disegno e scrittura-Scrittura e correzione;[125,234];Ufficio > Forniture per ufficio
174||719617601;174;Coop Online;TD_MANAGER;719617601;Normografo UNI 5 mm lettere numeri e simboli 22,9x4,8 cm;Questo normografo è realizzato in materiale flessibile e di elevata resistenzam caratterizzato da una cornice bianca. Adatto per scrivere con matita o penna a china. Altezza carattere 5 mm.;Home-Giochi, Infanzia e Cartoleria-Cartoleria-Disegno e scrittura-Righe, compassi e squadre;[125,234];Ufficio > Forniture per ufficio
174||297507302;174;Coop Online;TD_MANAGER;297507302;Set 2 evidenziatori Boss Original giallo/rosa;Nato nel 1971, l'evidenziatore STABILO Boss Original ha un design unico e i suoi colori fluorescenti sono ormai un'icona. In più, resiste fino a 4 ore senza tappo, senza che l'inchiostro si secchi! La confezione contiene 2 evidenziatori Boss Original giallo/rosa.;Home-Giochi, Infanzia e Cartoleria-Cartoleria-Disegno e scrittura-Scrittura e correzione;[125,234];Ufficio > Forniture per ufficio
174||451963101;174;Coop Online;TD_MANAGER;451963101;Set disegno Mini Kit Keep Colour Pastel 3 pz.;Il set disegno Mini Kit Keep Colour Pastel è composto da una squadra 45 15 cm, una squadra 60 15 cm e un righello 16 cm in colori pastello.;Home-Giochi, Infanzia e Cartoleria-Cartoleria-Disegno e scrittura-Righe, compassi e squadre;[125,234];Ufficio > Forniture per ufficio
174||297507902;174;Coop Online;TD_MANAGER;297507902;Set 2 evidenziatori Boss Original giallo/verde;Nato nel 1971, l'evidenziatore STABILO Boss Original ha un design unico e i suoi colori fluorescenti sono ormai un'icona. In più, resiste fino a 4 ore senza tappo, senza che l'inchiostro si secchi! La confezione contiene 2 evidenziatori Boss Original giallo/verde.;Home-Giochi, Infanzia e Cartoleria-Cartoleria-Disegno e scrittura-Scrittura e correzione;[125,234];Ufficio > Forniture per ufficio
174||297667301;174;Coop Online;TD_MANAGER;297667301;Set 2 Tratto Pen rosso;Set 2 penne fineliner a punta sintetica indeformabile con inchiostro rosso a base d'acqua e con larghezza del tratto di scrittura di 0,5 mm.;Home-Giochi, Infanzia e Cartoleria-Cartoleria-Disegno e scrittura-Scrittura e correzione;[125,234];Ufficio > Forniture per ufficio
174||443422801;174;Coop Online;TD_MANAGER;443422801;Penna a sfera e portamine 2in1 4 Colours;Penna a sfera della linea 4 Colours composta da 3 inchiostri in colori assortiti (nero, blu, rosso) e una parte con mine HB da 0,7mm in una penna sola. La punta è da 1 mm per una larghezza di tratto da 0,32 mm. Confortevole e morbida grip, ha la gomma integrata con cappuccio protettivo.;Home-Giochi, Infanzia e Cartoleria-Cartoleria-Disegno e scrittura-Scrittura e correzione;[125,234];Ufficio > Forniture per ufficio
174||443447601;174;Coop Online;TD_MANAGER;443447601;Marcatore Pintor nero;Dalla punta di 4,5 mm e tratto 1,4 mm, Pintor è un marker ad inchiostro pigmentato a base acqua nero di Pilot che asciuga rapidamente. Multi-superficie, non scolora mantenendo colori brillanti, copre perfettamente la superficie. Per gli artisti professionisti e non.;Home-Giochi, Infanzia e Cartoleria-Cartoleria-Disegno e scrittura-Scrittura e correzione;[125,234];Ufficio > Forniture per ufficio
174||443447801;174;Coop Online;TD_MANAGER;443447801;Marcatore Pintor rosso;Dalla punta di 4,5 mm e tratto 1,4 mm, Pintor è un marker ad inchiostro pigmentato a base acqua rosso di Pilot che asciuga rapidamente. Multi-superficie, non scolora mantenendo colori brillanti, copre perfettamente la superficie. Per gli artisti professionisti e non.;Home-Giochi, Infanzia e Cartoleria-Cartoleria-Disegno e scrittura-Scrittura e correzione;[125,234];Ufficio > Forniture per ufficio
174||443447901;174;Coop Online;TD_MANAGER;443447901;Marcatore Pintor giallo;Dalla punta di 4,5 mm e tratto 1,4 mm, Pintor è un marker ad inchiostro pigmentato a base acqua giallo di Pilot che asciuga rapidamente. Multi-superficie, non scolora mantenendo colori brillanti, copre perfettamente la superficie. Per gli artisti professionisti e non.;Home-Giochi, Infanzia e Cartoleria-Cartoleria-Disegno e scrittura-Scrittura e correzione;[125,234];Ufficio > Forniture per ufficio
174||443457801;174;Coop Online;TD_MANAGER;443457801;Set 4 penne PointMax colori pastello;Parola d'ordine: creatività! PointMax è la penna giusta e resistente grazie alla punta media in nylon (M 0.8 mm). Per ottime performance di scrittura. La confezione contiene 4 PointMax in colori pastello.;Home-Giochi, Infanzia e Cartoleria-Cartoleria-Disegno e scrittura-Scrittura e correzione;[125,234];Ufficio > Forniture per ufficio
174||446051201;174;Coop Online;TD_MANAGER;446051201;Set 4 evidenziatori Swing Cool Pastel colori pastello;Il confort incontra la moda! L'evidenziatore STABILO swing cool Pastel Edition è perfetto per chi ama giocare con colori tenui e delicati. La confezione contiene 4 evidenziatori Swing Cool Pastel in colori assortiti pastello.;Home-Giochi, Infanzia e Cartoleria-Cartoleria-Disegno e scrittura-Scrittura e correzione;[125,234];Ufficio > Forniture per ufficio
174||443932701;174;Coop Online;TD_MANAGER;443932701;Set 15+5 penne a sfera 1 Grip colori nero/blu/rosso/verde;"1 Grip è la penna a sfera ""Made in Italy"" con impugnatura in gomma antiscivolo, dotata di meccanismo di fuoriuscita della punta tramite rotazione del cappuccio. Larghezza del tratto di scrittura: 0,5 mm. Lunghezza di scrittura 2.000 mt. La busta con colori scuola include 20 penne 1 Grip (8 nere, 8 blu, 3 rosse, 1 verde).";Home-Giochi, Infanzia e Cartoleria-Cartoleria-Disegno e scrittura-Scrittura e correzione;[125,234];Ufficio > Forniture per ufficio
174||500194301;174;Coop Online;TD_MANAGER;500194301;Set 4 evidenziatori Swing Cool colori assortiti;La comodità in tasca! L'evidenziatore STABILO Swing Cool è dotato di pratica clip, 2 ampiezze di tratto e inchiostro a base d'acqua. La confezione contiene 4 evidenziatori Swing Cool in colori assortiti.;Home-Giochi, Infanzia e Cartoleria-Cartoleria-Disegno e scrittura-Scrittura e correzione;[125,234];Ufficio > Forniture per ufficio
174||496580001;174;Coop Online;TD_MANAGER;496580001;24 Pennarelli a punta fine;Scatola con 24 pennarelli punta fine Le Cose dall'inchiostro superlavabile e punta bloccata con cappuccio ventilato in colori assortiti. Made in Italy. Senza glutine.;Home-Giochi, Infanzia e Cartoleria-Cartoleria-Disegno e scrittura-Disegno;[125,234];Ufficio > Forniture per ufficio
174||751674301;174;Coop Online;TD_MANAGER;751674301;Gomma Frixion Remover;"Blister contenente n. 1 Frixion Remover, gomma utilizzabile per cancellare l'inchiostro termosensibile di tutti i prodotti della ""famiglia"" Frixion. Adatta a penne, pennarelli, fineliner, evidenziatori cancellabili Frixion.";Home-Giochi, Infanzia e Cartoleria-Cartoleria-Disegno e scrittura-Scrittura e correzione;[125,234];Ufficio > Forniture per ufficio
174||486516501;174;Coop Online;TD_MANAGER;486516501;Set 36 matite colorate;"Le matite colorate Le Cose sono pastelli in legno in 36 colori assortiti, pre-temperati e verniciati nel colore della mina; sono caratterizzati da una mina resistente e offrono un tratto preciso, nitido ma allo stesso tempo morbido.";Home-Giochi, Infanzia e Cartoleria-Cartoleria-Disegno e scrittura-Disegno;[125,234];Ufficio > Forniture per ufficio
174||477644401;174;Coop Online;TD_MANAGER;477644401;Gel-ocity Quick Dry Penna Gel Punta Media 0.7 mm blu;Gel-ocity Quick Dry è una Penna Gel a Punta Media da 0.7 mm con inchiostro di colore blu.;Home-Giochi, Infanzia e Cartoleria-Cartoleria-Disegno e scrittura-Scrittura e correzione;[125,234];Ufficio > Forniture per ufficio
174||312369101;174;Coop Online;TD_MANAGER;312369101;Set 6 matitoni Be-bè;I matitoni Be-bè, in confezione da 6, sono matitoni sicuri, superlavabili, facili da temperare, con mina gigante 7 mm. Specifici per un primo approccio al colore già al di sotto dei tre anni.;Home-Giochi, Infanzia e Cartoleria-Cartoleria-Disegno e scrittura-Disegno;[125,234];Ufficio > Forniture per ufficio
174||484532701;174;Coop Online;TD_MANAGER;484532701;Set 2 cancellini Super Pirat;Il cancellino Super Pirat di Pelikan è un cancellatore d'inchiostro penna sfera e stilografica con 2 punte: una bianca per cancellare ed una blu per riscrivere sulla parte cancellata. La confezione include 2 pz.;Home-Giochi, Infanzia e Cartoleria-Cartoleria-Disegno e scrittura-Scrittura e correzione;[125,234];Ufficio > Forniture per ufficio
174||312369301;174;Coop Online;TD_MANAGER;312369301;Set 6 pennarelli Be-bè;I pennarelli Be-bè, in confezione da 6, adatti da sotto i 3 anni, hanno colori sicuri e superlavabili da mani e tessuti, dermatologicamente testati. Il cappuccio è ventilato antisoffocamento, tappo di sicurezza e pennino bloccato ( 5 mm) super resistente.;Home-Giochi, Infanzia e Cartoleria-Cartoleria-Disegno e scrittura-Disegno;[125,234];Ufficio > Forniture per ufficio
174||312633701;174;Coop Online;TD_MANAGER;312633701;Astuccio 24 matite acquerellabili Design Journey colori assortiti;Quelle della linea Design Journey sono matite colorate di alta qualità nella classica forma esagonale con mina acquerellabile. Per sorprendenti effetti luminosi su carta per acquerello, con acqua e pennello.;Home-Giochi, Infanzia e Cartoleria-Cartoleria-Disegno e scrittura-Disegno;[125,234];Ufficio > Forniture per ufficio
174||313611001;174;Coop Online;TD_MANAGER;313611001;Set 12 matite grafite HB Studio Graph Pastel;Astuccio contenente 12 matite grafite HB Studio Graph a sezione esagonale dal fusto colorato in colori pastello e gommino dello stesso colore del fusto.;Home-Giochi, Infanzia e Cartoleria-Cartoleria-Disegno e scrittura-Disegno;[125,234];Ufficio > Forniture per ufficio
174||317078001;174;Coop Online;TD_MANAGER;317078001;Set Pitt Artist Manga con 6 pennarelli XS-S-SC-M-SB-B col. nero;Set Pitt Artist Manga con 6 penne a inchiostro di china pigmentato XS-S-SC-M-SB-B col. nero, dall'ottima resistenza alla luce, resistente all'acqua, permanente, inodore, senza acidi, a pH neutro.;Home-Giochi, Infanzia e Cartoleria-Cartoleria-Disegno e scrittura-Disegno;[125,234];Ufficio > Forniture per ufficio
174||497198401;174;Coop Online;TD_MANAGER;497198401;Set 5 penne Cristal Large blu;Liconica penna BIC Cristal è anche disponibile con una punta larga da 1,6 mm per una scrittura ultra leggibile. Le 5 sfere perfettamente progettate di questa confezione garantiscono un flusso di inchiostro blu uniforme e scorrevole per una scrittura estremamente piacevole.;Home-Giochi, Infanzia e Cartoleria-Cartoleria-Disegno e scrittura-Scrittura e correzione;[125,234];Ufficio > Forniture per ufficio
