Identification;EshopId;EshopName;ManagerClassName;ProductItemId;Name;Description;SearchCategoryKey;CategoryId;CategoryDesc
174||464978101;174;Coop Online;TD_MANAGER;464978101;Pulitore a vapore SC 3 Upright EasyFix giallo/nero 1.513-300.0;Per tutti i pavimenti duri, anche il legno. Rimuove il 99.99% dei comuni batteri domestici senza prodotti chimici. Serbatoio 0.5 L rimovibile. Lunghezza cavo: 5 m. Tempo riscaldamento: 30 sec. Panno in microfibra per pavimenti e accessorio per tappeti inclusi.;Home-Elettrodomestici e Tecnologia-Pulizia e stiro-Pulire-Pulitori a vapore;[111,186];Casa e giardino > Prodotti pulizia casa
174||446127801;174;Coop Online;TD_MANAGER;446127801;Scopa elettrica cordless senza sacco Air Force Light nero RH6545WH;Tecnologia ciclonica. Autonomia: fino a 30 minuti. Tempo di ricarica: 5 ore. Sistema Vision: Illuminazione LED. Capacità contenitore polvere: 0.65 L.;Home-Elettrodomestici e Tecnologia-Pulizia e stiro-Pulire-Scope elettriche;[111,186];Casa e giardino > Prodotti pulizia casa
174||705421601;174;Coop Online;TD_MANAGER;705421601;Aspirapolvere palmare DustBuster Flexi PD1820L;Aspirapolvere palmare con potenza di 18 V e tecnologia al litio per le pulizie quotidiane. Dotato di bocchetta aspirante flessibile ed estensibile fino ad 1.5 mt ideale per raggiungere gli angoli più inaccessibili della casa.;Home-Elettrodomestici e Tecnologia-Pulizia e stiro-Pulire-Aspirapolvere;[111,186];Casa e giardino > Prodotti pulizia casa
174||464466301;174;Coop Online;TD_MANAGER;464466301;Scopa elettrica senza sacco Piuma Extreme++ SC3-400 bianco/grigio 8667;Scopa elettrica Imetec Piuma Extreme++ SC3-400. Capacità vano raccoglipolvere: 0.6 L. Tecnologia ciclonica senza sacco. Lunghezza cavo: 6 m. Spazzola multisuperficie.;Home-Elettrodomestici e Tecnologia-Pulizia e stiro-Pulire-Scope elettriche;[111,186];Casa e giardino > Prodotti pulizia casa
174||444060201;174;Coop Online;TD_MANAGER;444060201;Aspirapolvere a traino multiciclonico VC 3 senza sacco giallo/nero 1.1;Tecnologia multiciclonica. Filtro HEPA 12. Sistema di raccolta senza sacco. Serbatoio rimovibile con capacità 0,9 L. Raggio d'azione: 7,5 m.;Home-Elettrodomestici e Tecnologia-Pulizia e stiro-Pulire-Aspirapolvere;[111,186];Casa e giardino > Prodotti pulizia casa
174||464466501;174;Coop Online;TD_MANAGER;464466501;Scopa elettrica 2in1 con filo senza sacco nero/rosso NH9204;NECCHI NH9204 - Scopa elettrica - portatile 2 in 1 - senza sacco - Filtrazione ciclonica - Contenitore polvere capienza 0,9 L;Home-Elettrodomestici e Tecnologia-Pulizia e stiro-Pulire-Scope elettriche;[111,186];Casa e giardino > Prodotti pulizia casa
174||497320401;174;Coop Online;TD_MANAGER;497320401;Scopa elettrica 2in1 cordless senza sacco rosso/nero NH9205;NECCHI NH9205 - Scopa elettrica 2-in-1 - senza sacco - senza fili - capacità vano polvere: 0.8 L;Home-Elettrodomestici e Tecnologia-Pulizia e stiro-Pulire-Scope elettriche;[111,186];Casa e giardino > Prodotti pulizia casa
174||454307301;174;Coop Online;TD_MANAGER;454307301;Aspirapolvere ciclonico a traino senza sacco KHROSS KS31PAR 011 grigio;Tecnologia multi-ciclonica. Filtro EPA. Capacità contenitore raccolta polvere: 1.8 L. Raggio dazione: 7.5 m. Spazzola Carpet & Floor, spazzola parquet e accessorio 2 in 1 a bordo.;Home-Elettrodomestici e Tecnologia-Pulizia e stiro-Pulire-Aspirapolvere;[111,186];Casa e giardino > Prodotti pulizia casa
174||496295801;174;Coop Online;TD_MANAGER;496295801;Scopa elettrica cordless senza sacco Viva CVIVA10 011 bianco/blu 39400;Scopa elettrica senza filo Candy Viva per tutti i tipi di pavimento, superfici delicate e zone difficili da raggiungere. Batteria al litio con autonomia fino a 35 minuti. Sistema di separazione ciclonica.;Home-Elettrodomestici e Tecnologia-Pulizia e stiro-Pulire-Scope elettriche;[111,186];Casa e giardino > Prodotti pulizia casa
174||457460501;174;Coop Online;TD_MANAGER;457460501;Aspirapolvere a traino ciclonico senza sacco 13MA;"Aspirapolvere 13MA - Potenza 700 W - Capacità netta 1 L - Filtro EPA 12 - Alta efficienza di aspirazione ""ECO";Home-Elettrodomestici e Tecnologia-Pulizia e stiro-Pulire-Aspirapolvere;[111,186];Casa e giardino > Prodotti pulizia casa
174||479637401;174;Coop Online;TD_MANAGER;479637401;Aspirapolvere a traino senza sacco SWIFT POWER CYCLONIC rosso/nero RO2;Tecnologia ciclonica. Senza sacco. Sistema ad alto filtraggio. Raggio di utilizzo: 7.55 m. Tubo telescopico in metallo. Contenitore della polvere facile da pulire.;Home-Elettrodomestici e Tecnologia-Pulizia e stiro-Pulire-Aspirapolvere;[111,186];Casa e giardino > Prodotti pulizia casa
174||305408401;174;Coop Online;TD_MANAGER;305408401;Scopa elettrica con filo UltraEnergica Classic EENB54EB nero 900258333;Electrolux UltraEnergica Classic EENB54EB - Scopa elettrica - con sacchetto - nero;Home-Elettrodomestici e Tecnologia-Pulizia e stiro-Pulire-Scope elettriche;[111,186];Casa e giardino > Prodotti pulizia casa
174||477402101;174;Coop Online;TD_MANAGER;477402101;Aspirapolvere a bidone 23L Wet & Dry MultiClean nero 2026M;BISSELL MultiClean 2026M - bidone da usare in e fuori casa con funzione aspirasolidi e aspiraliquidi, raccoglie ogni tipo di sporco - funzione soffiante ideale per spazzare ingressi e porticati;Home-Elettrodomestici e Tecnologia-Pulizia e stiro-Pulire-Aspirapolvere;[111,186];Casa e giardino > Prodotti pulizia casa
174||119004101;174;Coop Online;TD_MANAGER;119004101;Scopa elettrica cordless 2in1 senza sacco X-Nano RH1127WO;Rowenta X-Nano RH1127WO - Scopa elettrica - 2in1 - senza sacco - senza fili - caricabatterie incluso;Home-Elettrodomestici e Tecnologia-Pulizia e stiro-Pulire-Scope elettriche;[111,186];Casa e giardino > Prodotti pulizia casa
174||451368901;174;Coop Online;TD_MANAGER;451368901;Aspirapolvere a traino con sacco EasyGo EEG42EB nero 900258233;Electrolux EasyGo EEG42EB - Aspirapolvere a traino - con sacchetto - nero ebano;Home-Elettrodomestici e Tecnologia-Pulizia e stiro-Pulire-Aspirapolvere;[111,186];Casa e giardino > Prodotti pulizia casa
174||111719301;174;Coop Online;TD_MANAGER;111719301;Scopa elettrica 2in1 cordless senza sacco rosso/nero VRT50121VR;Beko VRT 50121 VR - Scopa elettrica (2-in-1) - senza sacco - 110 W - senza fili - rosso;Home-Elettrodomestici e Tecnologia-Pulizia e stiro-Pulire-Scope elettriche;[111,186];Casa e giardino > Prodotti pulizia casa
174||756435201;174;Coop Online;TD_MANAGER;756435201;Caffettiera Rainbow 3 tazze verde;Rainbow Bialetti è una caffettiera in allumino lucidato nel brillante colore verde, impeccabile per funzionalità ed estetica, dalla capacità di 3 tazze, dotata di pomolo ed elegante manico ergonomico realizzati in materiale plastico antiscottatura.;Home-A tavola e in cucina-Colazione-Caffettiere e teiere;[111,170];Casa e giardino > Accessori cucina
174||756435401;174;Coop Online;TD_MANAGER;756435401;Caffettiera Rainbow 3 tazze azzurro;Rainbow Bialetti è una caffettiera in allumino lucidato nel brillante colore azzurro, impeccabile per funzionalità ed estetica, dalla capacità di 3 tazze, dotata di pomolo ed elegante manico ergonomico realizzati in materiale plastico antiscottatura.;Home-A tavola e in cucina-Colazione-Caffettiere e teiere;[111,170];Casa e giardino > Accessori cucina
174||756435701;174;Coop Online;TD_MANAGER;756435701;Tuttocrema 8 cm;Tuttocrema di Bialetti è lo strumento ideale per ottenere una soffice crema di latte. Con corpo in alluminio verniciato resistente alle alte temperature e rivestimento interno antiaderente per una facile pulizia, il suo coperchio è dotato di una frusta a doppio disco brevettata per montare la crema alla perfezione.;Home-A tavola e in cucina-Colazione-Caffettiere e teiere;[111,170];Casa e giardino > Accessori cucina
174||458828801;174;Coop Online;TD_MANAGER;458828801;Moka LaCaffettiera 3 tazze;Protagonista indiscussa del rito quotidiano del caffè, la moka in alluminio LaCaffettiera da 3 tazze contribuisce ad esaltarne il profumo, laroma e il gusto tipico della bevanda italiana per eccellenza.;Home-A tavola e in cucina-Colazione-Caffettiere e teiere;[111,170];Casa e giardino > Accessori cucina
174||458834001;174;Coop Online;TD_MANAGER;458834001;Moka Ibrida induzione bianco/acciaio 3 tazze;La caffettiera Ibrida di Barazzoni, nella misura 3 tazze, è realizzata esternamente in acciaio ed internamente in alluminio. Prerogativa fondamentale di questa caffettiera è la sua caldaia in bimetallo.;Home-A tavola e in cucina-Colazione-Caffettiere e teiere;[111,170];Casa e giardino > Accessori cucina
174||477297301;174;Coop Online;TD_MANAGER;477297301;Moka express Oceana 4 tazze;Moka express Oceana 4 tazze è liconica Moka Express dedicata a Oceana, l'organizzazione mondiale dedicata alla salvaguardia degli ecosistemi oceanici che punta i riflettori sul tema dellinquinamento da plastica monouso.;Home-A tavola e in cucina-Colazione-Caffettiere e teiere;[111,170];Casa e giardino > Accessori cucina
174||294065001;174;Coop Online;TD_MANAGER;294065001;Cicciobello Bua;Cicciobello Bua di Giochi Preziosi è malato e ha bisogno di cure. Per fortuna nella confezione si troverà tutto il necessario: tre biberon, una siringa, un termometro, uno stetoscopio, un ciuccio che si illumina la notte. Il gioco è adatto dai 3 anni in su.;Home-Giochi, Infanzia e Cartoleria-Bambole, personaggi e peluche-Bambole e personaggi;[125,234];Ufficio > Forniture per ufficio
174||445776301;174;Coop Online;TD_MANAGER;445776301;Dormi con me interattiva;Bambola Nenuco con lettino a sponda da posizionare vicino e te e grazie al baby monitor indossabile come braccialetto scoprirari in ogni momento di cosa ha bisogno!;Home-Giochi, Infanzia e Cartoleria-Bambole, personaggi e peluche-Bambole e personaggi;[125,234];Ufficio > Forniture per ufficio
174||443809401;174;Coop Online;TD_MANAGER;443809401;Casa City Life;Crea più spazio per l'immaginazione e il gioco della tua bambina! La spaziosa casa delle bambole City Life completa di mobili e accessori nelle stanze, è grande abbastanza per fare volare la fantasia delle tue bimbe.;Home-Giochi, Infanzia e Cartoleria-Bambole, personaggi e peluche-Bambole e personaggi;[125,234];Ufficio > Forniture per ufficio
174||443143401;174;Coop Online;TD_MANAGER;443143401;Love Care Center;Assumi il ruolo di un vero medico insieme a Steffi e prenditi cura dei suoi due piccoli pazienti! Il Care Center è lo studio medico privato di Steffi, dove accetta i suoi piccoli pazienti. 3 bambole e 30 accessori inclusi!;Home-Giochi, Infanzia e Cartoleria-Bambole, personaggi e peluche-Bambole e personaggi;[125,234];Ufficio > Forniture per ufficio
174||477298201;174;Coop Online;TD_MANAGER;477298201;Elsa e il cavallo Nokk elettronico;Immagina incredibili avventure nel mondo di Frozen con la bambola di Elsa e il Nokk elettronico che cammina e nuota per davvero!;Home-Giochi, Infanzia e Cartoleria-Bambole, personaggi e peluche-Bambole e personaggi;[125,234];Ufficio > Forniture per ufficio
174||477831901;174;Coop Online;TD_MANAGER;477831901;Bambola Amore Mio Baby Oplà;Amore Mio Baby Oplà è la simpatica bambola con tutina colorata in morbido panno in grado di stupirti con le sue incredibili capriole!;Home-Giochi, Infanzia e Cartoleria-Bambole, personaggi e peluche-Bambole e personaggi;[125,234];Ufficio > Forniture per ufficio
174||304686201;174;Coop Online;TD_MANAGER;304686201;Barbie Dreamtopia Bambola Principessa con ciocca turchese;Le principesse Barbie Dreamtopia ispirano le avventure più fantastiche con i loro abiti da favola! Questa principessa Barbie ha corpetto luccicante rosa e viola abbinato alla coloratissima gonna decorata con fantastiche stelline.;Home-Giochi, Infanzia e Cartoleria-Bambole, personaggi e peluche-Bambole e personaggi;[125,234];Ufficio > Forniture per ufficio
174||304686401;174;Coop Online;TD_MANAGER;304686401;Barbie Dreamtopia Bambola Principessa bionda con ciocca rosa;Le principesse Barbie Dreamtopia ispirano le avventure più fantastiche con i loro abiti da favola! Questa principessa Barbie ha corpetto luccicante azzurro e coloratissima gonna decorata con arcobaleni.;Home-Giochi, Infanzia e Cartoleria-Bambole, personaggi e peluche-Bambole e personaggi;[125,234];Ufficio > Forniture per ufficio
174||304686601;174;Coop Online;TD_MANAGER;304686601;Barbie Bambola Ken Fashionistas n. 165;Bambola Ken Fashionistas n. 165 con capelli castani modellati e maglietta viola Malibù, adatta a bambini da 3+ anni.;Home-Giochi, Infanzia e Cartoleria-Bambole, personaggi e peluche-Bambole e personaggi;[125,234];Ufficio > Forniture per ufficio
174||304686701;174;Coop Online;TD_MANAGER;304686701;Barbie Bambola Ken Fashionistas n. 152;Bambola Ken Fashionistas n. 152 con capelli biondi e camicia blu con stampa tropicale, adatta a bambini da 3+ anni.;Home-Giochi, Infanzia e Cartoleria-Bambole, personaggi e peluche-Bambole e personaggi;[125,234];Ufficio > Forniture per ufficio
174||304687101;174;Coop Online;TD_MANAGER;304687101;Polly Pocket Cofanetto Amici delle Nevi;Il cofanetto Polly Pocket Amici delle nevi a forma di narvalo è ideale per vivere un'avventura tra i ghiacci dell'Artico, con le micro bambole Polly e Lila, un cane husky con la slitta e un orso polare.;Home-Giochi, Infanzia e Cartoleria-Bambole, personaggi e peluche-Bambole e personaggi;[125,234];Ufficio > Forniture per ufficio
174||304687201;174;Coop Online;TD_MANAGER;304687201;Polly Pocket Cofanetto Coccole Amici a 4 Zampe;Il cofanetto di Polly Pocket Coccole Amici a 4 Zampe presenta la forma di un cane corgi e si apre per rivelare un'avventura a tema per gli animali domestici con micro bambole di Polly e Shani oltre a 2 amici cagnolini (un barboncino e un cagnolino).;Home-Giochi, Infanzia e Cartoleria-Bambole, personaggi e peluche-Bambole e personaggi;[125,234];Ufficio > Forniture per ufficio
174||304687401;174;Coop Online;TD_MANAGER;304687401;Polly Pocket Cofanetto Caffetteria del Porcospino;L'adorabile cofanetto Polly Pocket Caffetteria del Porcospino presenta la forma di un carinissimo riccio e si apre per rivelare una caffetteria e un'avventura a tema animali con bambola micro Polly e amica oltre a 2 animali domestici.;Home-Giochi, Infanzia e Cartoleria-Bambole, personaggi e peluche-Bambole e personaggi;[125,234];Ufficio > Forniture per ufficio
174||304688401;174;Coop Online;TD_MANAGER;304688401;Barbie Carriera Playset Insegnante d'Arte con bambola bruna e allieva;Puoi diventare un'insegnante d'arte con il playset Barbie Insegnante d'Arte con bambola bruna e allieva!;Home-Giochi, Infanzia e Cartoleria-Bambole, personaggi e peluche-Bambole e personaggi;[125,234];Ufficio > Forniture per ufficio
174||304688701;174;Coop Online;TD_MANAGER;304688701;Barbie Carriera Playset Pediatra con bambola bionda;Scopri come aiutare gli altri e prendersi cura dei bambini con il playset Barbie pediatra con bambola bionda!;Home-Giochi, Infanzia e Cartoleria-Bambole, personaggi e peluche-Bambole e personaggi;[125,234];Ufficio > Forniture per ufficio
174||304688901;174;Coop Online;TD_MANAGER;304688901;Barbie Playset Allenatrice di calcio con bambola bruna e allieva;Con le bambole e gli accessori di Barbie Allenatrice di Calcio, i bambini e le bambine potranno segnare il gol decisivo per un divertimento smisurato!;Home-Giochi, Infanzia e Cartoleria-Bambole, personaggi e peluche-Bambole e personaggi;[125,234];Ufficio > Forniture per ufficio
174||304689001;174;Coop Online;TD_MANAGER;304689001;Barbie Playset Allenatrice di calcio con bambola bionda e allieva;Con le bambole e gli accessori di Barbie Allenatrice di Calcio, i bambini e le bambine potranno segnare il gol decisivo per un divertimento smisurato!;Home-Giochi, Infanzia e Cartoleria-Bambole, personaggi e peluche-Bambole e personaggi;[125,234];Ufficio > Forniture per ufficio
174||305054701;174;Coop Online;TD_MANAGER;305054701;Polly Pocket Borsetta Twist Frappè;Preparati per le avventure nel parco a tema con Polly Pocket! Il divertentissimo parco acquatico pieno di sorprese ha la forma di un frullato tropicale, con il coperchio che si apre, e 3 livelli da girare per rivelare 3 piani di divertimento.;Home-Giochi, Infanzia e Cartoleria-Bambole, personaggi e peluche-Bambole e personaggi;[125,234];Ufficio > Forniture per ufficio
174||452951902;174;Coop Online;TD_MANAGER;452951902;Bicicletta di Barbie;Il telaio rosa, i parafanghi azzurri, gli accenti argentati e i pedali che girano davvero rendono la bicicletta di Barbie perfetta per le tante gite spensierate della tua bambola. Adatta dai 3 anni in su.;Home-Giochi, Infanzia e Cartoleria-Bambole, personaggi e peluche-Bambole e personaggi;[125,234];Ufficio > Forniture per ufficio
174||459679002;174;Coop Online;TD_MANAGER;459679002;Casa Portatile Piccola con piscina e accessori;"Questa casa di Barbie portatile si può aprire per svelare tanto spazio per divertirsi (più di 60 cm); il playset a 1 piano comprende una cucina, una camera da letto, un bagno e una piscina all'aperto.";Home-Giochi, Infanzia e Cartoleria-Bambole, personaggi e peluche-Bambole e personaggi;[125,234];Ufficio > Forniture per ufficio
174||477824902;174;Coop Online;TD_MANAGER;477824902;Playset Unicorno Magiche Sorprese con micro bambole;Partecipa alla miglior festa a sorpresa di sempre con il playset Polly Pocket Unicorno Magiche Sorprese! Questo grande cofanetto a forma di unicorno ha ali scintillanti che si aprono e una maniglia per portarlo dove vuoi!;Home-Giochi, Infanzia e Cartoleria-Bambole, personaggi e peluche-Bambole e personaggi;[125,234];Ufficio > Forniture per ufficio
174||492530501;174;Coop Online;TD_MANAGER;492530501;Veterinaria in Studio con Evi;Aiuta Steffi ed Evi Love a prendersi cura degli animali che non si sentono così bene con questo playset per i piccoli amanti del mondo animale!;Home-Giochi, Infanzia e Cartoleria-Bambole, personaggi e peluche-Bambole e personaggi;[125,234];Ufficio > Forniture per ufficio
174||496978901;174;Coop Online;TD_MANAGER;496978901;Elsa Momenti di Magia bambola con suoni e frasi;La bambola parlate Disney Frozen Elsa Momenti di Magia riproduce oltre 20 suoni e frasi ed è dotata di tanti magici accessori ispirati al film Disney Frozen 2!;Home-Giochi, Infanzia e Cartoleria-Bambole, personaggi e peluche-Bambole e personaggi;[125,234];Ufficio > Forniture per ufficio
174||497574501;174;Coop Online;TD_MANAGER;497574501;Amore Mio Passeggino Urban;Il Passeggino Urban Amore Mio è reclinabile ed ha una comodissima cappottina per permettere alle bambine di andare in giro con le loro bambole preferite!;Home-Giochi, Infanzia e Cartoleria-Bambole, personaggi e peluche-Bambole e personaggi;[125,234];Ufficio > Forniture per ufficio
174||305415001;174;Coop Online;TD_MANAGER;305415001;Polly Pocket Borsetti dei Segreti a Conchiglia;Questa adorabile borsetta cofanetto di Polly Pocket ha la forma di una conchiglia (con stelle e cuoricini brillanti) e si apre per emozionanti avventure sottomarine con le micro sirenette Polly e Lila.;Home-Giochi, Infanzia e Cartoleria-Bambole, personaggi e peluche-Bambole e personaggi;[125,234];Ufficio > Forniture per ufficio
174||497286502;174;Coop Online;TD_MANAGER;497286502;Polly Pocket Playset Lunapark dell'Arcobaleno;Preparati al divertimento del Lunapark dell'Arcobaleno, che comprende 3 giostre, 7 aree di gioco, bambole Polly e Shani, 2 unicorni e 25 sorprese (3N/A pezzi in totale).;Home-Giochi, Infanzia e Cartoleria-Bambole, personaggi e peluche-Bambole e personaggi;[125,234];Ufficio > Forniture per ufficio
174||448926101;174;Coop Online;TD_MANAGER;448926101;Personaggio da collezionare Harry Potter h.25 cm;Personaggio da collezionare Harry Potter (25 cm) con uniforme di Hogwarts, mantello di Grifondoro e bacchetta inclusa.;Home-Giochi, Infanzia e Cartoleria-Bambole, personaggi e peluche-Bambole e personaggi;[125,234];Ufficio > Forniture per ufficio
174||112993601;174;Coop Online;TD_MANAGER;112993601;Cicciobello Pappa Si Pappa No;Proprio come i bambini piccoli, Cicciobello scopre un gusto nuovo ogni giorno! Oggi sarà goloso di mela, latte oppure della pappa? Per scoprirlo, basta dargli uno dei cibi e lui 'mangia' oppure scuote la testa se preferisce un altro gusto o se è sazio.;Home-Giochi, Infanzia e Cartoleria-Bambole, personaggi e peluche-Bambole e personaggi;[125,234];Ufficio > Forniture per ufficio
174||112994401;174;Coop Online;TD_MANAGER;112994401;Me Contro Te Party Truck con Sofi;Festeggia insieme a Sofì nel suo meraviglioso Party Truck! Da un lato gelateria e dall'altro Fast Food! Tanti accessori inclusi!;Home-Giochi, Infanzia e Cartoleria-Bambole, personaggi e peluche-Bambole e personaggi;[125,234];Ufficio > Forniture per ufficio
174||113197101;174;Coop Online;TD_MANAGER;113197101;Steffi Love Vacanza a Sorpresa;Steffi Love e la sua famiglia sono pronti per partire per le vacanze, ma la destinazione è una sorpresa. Aprendo la confezione troverai accessori da mare o da montagna in base alla destinazione!;Home-Giochi, Infanzia e Cartoleria-Bambole, personaggi e peluche-Bambole e personaggi;[125,234];Ufficio > Forniture per ufficio
174||317118301;174;Coop Online;TD_MANAGER;317118301;Polly Pocket Cofanetto Borsetta dei Segreti Arcobaleno;Il Cofanetto Borsetta da indossare Sogni Arcobaleno di Polly Pocket ha 8 simpatiche sorprese, micro Polly e Shani, 2 accessori e foglio sticker. Per bambini dai 4 anni in su.;Home-Giochi, Infanzia e Cartoleria-Bambole, personaggi e peluche-Bambole e personaggi;[125,234];Ufficio > Forniture per ufficio
174||317118401;174;Coop Online;TD_MANAGER;317118401;Barbie Playset Motoscafo galleggiante con bambola, cucciolo e accessor;Il playset Motoscafo galleggiante di Barbie include una bambola con cucciolo, giubbotto di salvataggio ed accessori. Il Motoscafo può contenere 3 bambole e galleggia in acqua. Per bambini da 3 a 7 anni.;Home-Giochi, Infanzia e Cartoleria-Bambole, personaggi e peluche-Bambole e personaggi;[125,234];Ufficio > Forniture per ufficio
174||317118501;174;Coop Online;TD_MANAGER;317118501;Barbie Extra n. 9 con vestito arcobaleno e cucciolo di coccodrillo;Barbie Extra n. 9 è una bambola mora con capelli lunghi e articolazioni flessibili che indossa una giacca blu con volant e luccicanti fermagli per capelli e include un cucciolo di coccodrillo. Per bambini dai 3 anni in su.;Home-Giochi, Infanzia e Cartoleria-Bambole, personaggi e peluche-Bambole e personaggi;[125,234];Ufficio > Forniture per ufficio
174||111719101;174;Coop Online;TD_MANAGER;111719101;Aspirapolvere robot VRR 60110 VW bianco 8911833200;Beko VRR 60110 VW - Aspirapolvere - robot - senza sacco - bianco;Home-Elettrodomestici e Tecnologia-Pulizia e stiro-Pulire-Aspirapolvere;[111,186];Casa e giardino > Prodotti pulizia casa
174||111719401;174;Coop Online;TD_MANAGER;111719401;Aspirapolvere a traino senza sacco beige/nero VCO32803AF;Beko VCO32803AF - Aspirapolvere - a traino - senza sacco - 800 W - Beige;Home-Elettrodomestici e Tecnologia-Pulizia e stiro-Pulire-Aspirapolvere;[111,186];Casa e giardino > Prodotti pulizia casa
174||447926301;174;Coop Online;TD_MANAGER;447926301;Aspirapolvere a traino ciclonico senza sacco J-Force nero/rosso 00P275;Ariete J-Force (Mod: 2753) - Aspirapolvere - a traino - senza sacco;Home-Elettrodomestici e Tecnologia-Pulizia e stiro-Pulire-Aspirapolvere;[111,186];Casa e giardino > Prodotti pulizia casa
174||719098501;174;Coop Online;TD_MANAGER;719098501;Kit panni PAEU0307 per scopa a vapore Vaporetto SV205;Polti PAEU0307 - Kit accessori per pulitore a vapore Vaporetto SV205;Home-Elettrodomestici e Tecnologia-Pulizia e stiro-Pulire-Accessori;[111,186];Casa e giardino > Prodotti pulizia casa
174||755114801;174;Coop Online;TD_MANAGER;755114801;Kit panni per scopa a vapore JC-208;Kit panni con tutto quello che ti occorre per mantenere sempre in completa efficienza la Scopa a vapore JC-208. Include 1 panno per pavimenti in coral con frange, 1 panno per pavimenti con frange, 1 panno per polvere con frange, 1 panno per vetri, 1 panno per tessuti e 1 spazzola in nylon.;Home-Elettrodomestici e Tecnologia-Pulizia e stiro-Pulire-Accessori;[111,186];Casa e giardino > Prodotti pulizia casa
174||297491101;174;Coop Online;TD_MANAGER;297491101;Filtri universali per cappa cucina Kappafiltro KA 2;Due Filtri piatti di aspirazione dei vapori con indicatore di saturazione. Elevate capacità di assorbimento.;Home-Elettrodomestici e Tecnologia-Pulizia e stiro-Pulire-Accessori;[111,186];Casa e giardino > Prodotti pulizia casa
174||723610601;174;Coop Online;TD_MANAGER;723610601;Confezione da 10 sacchetti di carta per aspirapolvere Rowenta/Moulinex;Elettrocasa RW 16 - Sacchetti di carta compatibili con aspirapolvere Rowenta/Moulinex (pacchetto di 10);Home-Elettrodomestici e Tecnologia-Pulizia e stiro-Pulire-Accessori;[111,186];Casa e giardino > Prodotti pulizia casa
174||871036002;174;Coop Online;TD_MANAGER;871036002;Confezione da 10 sacchetti di carta per aspirapolvere compatibili DW 1;Elettrocasa DW 1 - Sacchetti di carta compatibili per aspirapolvere (pacchetto di 10);Home-Elettrodomestici e Tecnologia-Pulizia e stiro-Pulire-Accessori;[111,186];Casa e giardino > Prodotti pulizia casa
174||871083002;174;Coop Online;TD_MANAGER;871083002;Confezione da 10 sacchetti di carta per aspirapolvere Philips/Aeg PS 4;Elettrocasa PS 4 - Sacchetti di carta compatibili con aspirapolvere Philips/Aeg (pacchetto di 10);Home-Elettrodomestici e Tecnologia-Pulizia e stiro-Pulire-Accessori;[111,186];Casa e giardino > Prodotti pulizia casa
174||871110002;174;Coop Online;TD_MANAGER;871110002;Confezione da 10 sacchetti di carta per aspirapolvere Hoover HV 17;Elettrocasa HV 17 - Sacchetti di carta compatibili con aspirapolvere Hoover (pacchetto di 10);Home-Elettrodomestici e Tecnologia-Pulizia e stiro-Pulire-Accessori;[111,186];Casa e giardino > Prodotti pulizia casa
174||674185701;174;Coop Online;TD_MANAGER;674185701;Filtro HEPA + 2 filtri motore CJ073 per aspirapolvere senza sacco;Filtro HEPA + 2 Filtri Motore Coop CJ073 per aspirapolvere senza sacco;Home-Elettrodomestici e Tecnologia-Pulizia e stiro-Pulire-Accessori;[111,186];Casa e giardino > Prodotti pulizia casa
