Identification;EshopId;EshopName;ManagerClassName;ProductItemId;Name;Description;SearchCategoryKey;CategoryId;CategoryDesc
153||SP_4BAY_PSU;153;Monclick;TD_MANAGER;SP_4BAY_PSU;Alimentazione - 250 watt sp-4bay-psu;"Tipologia: Alimentazione;";Accessori > Accessori server e networking;[113,191];Dispositivi elettronici > accessori computer e tablet
153||SP4C08;153;Monclick;TD_MANAGER;SP4C08;Videogioco Control;"Piattaforma: Sony PlayStation 4; Genere: Azione - avventura, Azione - sparatutto in terza persona; PEGI rating >: 18; Publisher: 505 Games;";Giochi e Console > Videogiochi;[113,206];Dispositivi elettronici > videogiochi
153||ST1000SPEXD4;153;Monclick;TD_MANAGER;ST1000SPEXD4;Adattatore di rete Startech.com scheda di rete ethernet pci express a 2 porte rj45 da 1 gbps st100;"Tipologia: Scheda plug-in; Tipologia interfaccia PC: PCI Express x1; Velocità di trasferimento dati: 1 Gbps; Tipologia cablaggio: Ethernet 1000Base-T, Ethernet 100Base-TX, Ethernet 10Base-T;";Networking e Wireless > Adattatori di rete ethernet;[111,189];Casa e giardino > Sistemi di allarme
153||SP4D14;153;Monclick;TD_MANAGER;SP4D14;Videogioco Devil may cry;"Piattaforma: Sony PlayStation 4; Genere: Azione - avventura; PEGI rating >: 16; Publisher: Capcom;";Giochi e Console > Videogiochi;[113,206];Dispositivi elettronici > videogiochi
153||ST1000VX005;153;Monclick;TD_MANAGER;ST1000VX005;Hard disk interno Skyhawk 3.5'' 1TB per videosorveglianza;"Capacità: 1 TB; Formato: 3.5''; Interfaccia: Serial ATA-600; Velocità di rotazione: 5900 rpm; Velocità di trasferimento dati: 600 MBps;";HDD e Componenti PC > Hard disk interni;[113,191];Dispositivi elettronici > accessori computer e tablet
153||SP4F07;153;Monclick;TD_MANAGER;SP4F07;Videogioco Farming simulator 19;"Piattaforma: Sony PlayStation 4; Genere: Simulazione - fattoria; PEGI rating >: 3; Publisher: Focus Home Interactive;";Giochi e Console > Videogiochi;[113,206];Dispositivi elettronici > videogiochi
153||ST103008U2C;153;Monclick;TD_MANAGER;ST103008U2C;Hub Startech.com hub usb 3.0 a 10 porte di ricarica e sincronizzazione st103008u2c;"Tipologia: Switch condivisione periferiche USB; Q.ta porte: 10; Colore: Nero;";Networking e Wireless > Hub;[111,189];Casa e giardino > Sistemi di allarme
153||SP4M11;153;Monclick;TD_MANAGER;SP4M11;Videogioco Metal gear survive;"Piattaforma: Sony PlayStation 4; Genere: Azione - avventura, Azione di gioco sandbox/open world; PEGI rating >: 18; Publisher: Konami;";Giochi e Console > Videogiochi;[113,206];Dispositivi elettronici > videogiochi
153||ST10GPEXNDPI;153;Monclick;TD_MANAGER;ST10GPEXNDPI;Adattatore di rete Startech.com scheda di rete ethernet pcie a 2 porte 10gb st10gpexndpi;"Tipologia: Scheda plug-in; Tipologia interfaccia PC: PCI Express 3.0 x4; Velocità di trasferimento dati: 10 Gbps; Tipologia cablaggio: Ethernet 10GBase-T;";Networking e Wireless > Adattatori di rete ethernet;[111,189];Casa e giardino > Sistemi di allarme
153||SP4M20;153;Monclick;TD_MANAGER;SP4M20;Videogioco Megaman 11;"Piattaforma: Sony PlayStation 4; Genere: Azione - a piattaforme; PEGI rating >: 7; Publisher: Capcom;";Giochi e Console > Videogiochi;[113,206];Dispositivi elettronici > videogiochi
153||ST1200MM0017;153;Monclick;TD_MANAGER;ST1200MM0017;Hard disk interno Enterprise performance 10k hdd - hdd - 1.2 tb - sas 6gb/s st1200mm0017;Enterprise performance 10k hdd - hdd - 1.2 tb - sas 6gb/s st1200mm0017;HDD e Componenti PC > Hard disk interni;[113,191];Dispositivi elettronici > accessori computer e tablet
153||SP4P19;153;Monclick;TD_MANAGER;SP4P19;Videogioco PRO EVOLUTION SOCCER 2019 PS4;"Piattaforma: Sony PlayStation 4; Genere: Sport - simulazione calcio; PEGI rating >: 3; Publisher: Konami;";Giochi e Console > Videogiochi;[113,206];Dispositivi elettronici > videogiochi
153||ST121HDBTE;153;Monclick;TD_MANAGER;ST121HDBTE;Adattatore Startech.com extender hdmi via cat5e/ cat6 hdbaset da 70m st121hdbte;"Tipo connettore esterno: Hdmi; Tipo connettore interno: USB 3.0;";Accessori > Adattatori;[113,190];Dispositivi elettronici > accessori
153||SP4R14;153;Monclick;TD_MANAGER;SP4R14;Videogioco Resident evil revelations;"Piattaforma: Sony PlayStation 4; Genere: Azione - sopravvivenza in ambientazione horror, Azione - sparatutto in terza persona; PEGI rating >: n.d.; Publisher: Capcom;";Giochi e Console > Videogiochi;[113,206];Dispositivi elettronici > videogiochi
153||ST121HDBTPW;153;Monclick;TD_MANAGER;ST121HDBTPW;Adattatore Startech.com extender hdmi su cat5e / cat6 100 m - hdmi su cat5e st121hdbtpw;"Tipo connettore esterno: Hdmi; Tipo connettore interno: Hdmi;";Accessori > Adattatori;[113,190];Dispositivi elettronici > accessori
153||ST121HDBTRP;153;Monclick;TD_MANAGER;ST121HDBTRP;Hub Startech.com ripetitore hdbaset per kit extender hdmi st121hdbte o st121hdbtpw;"Q.ta porte: n.d.; Colore: n.d.;";Networking e Wireless > Hub;[111,189];Casa e giardino > Sistemi di allarme
153||SP4R18;153;Monclick;TD_MANAGER;SP4R18;Videogioco RESIDENT EVIL 2 - PS4;"Piattaforma: Sony PlayStation 4; Genere: Azione - sopravvivenza in ambientazione horror; PEGI rating >: 18; Publisher: Capcom;";Giochi e Console > Videogiochi;[113,206];Dispositivi elettronici > videogiochi
153||ST121SHD30;153;Monclick;TD_MANAGER;ST121SHD30;Startech.com extender video audio hdmi via cat5/cat6 con ir st121shd30;Startech.com extender video audio hdmi via cat5/cat6 con ir st121shd30;Accessori > Accessori video;[113,205];Dispositivi elettronici > video
153||SP4S16;153;Monclick;TD_MANAGER;SP4S16;Videogioco Street fighter v arcade;"Piattaforma: Sony PlayStation 4; Genere: Azione - lotta; PEGI rating >: n.d.; Publisher: Capcom;";Giochi e Console > Videogiochi;[113,206];Dispositivi elettronici > videogiochi
153||ST121USBHD;153;Monclick;TD_MANAGER;ST121USBHD;Adattatore Startech.com extender hdmi via cat6 con hub usb a 4 porte - 50m st121usbhd;"Tipo connettore esterno: Hdmi; Tipo connettore interno: Hdmi;";Accessori > Adattatori;[113,190];Dispositivi elettronici > accessori
153||SP_5000;153;Monclick;TD_MANAGER;SP_5000;Speaker sp-5000.al;"Tipologia: n.d.;";Accessori > Supporti e accessori per monitor;[113,193];Dispositivi elettronici > accessori telefoni cellulari
153||ST121UTPHD2;153;Monclick;TD_MANAGER;ST121UTPHD2;Adattatore Startech.com extender video hdbaset hdmi via cat5 con rs-232 e controllo ir st1;"Tipo connettore esterno: Ethernet, HDMI; Tipo connettore interno: Hdmi;";Accessori > Adattatori;[113,190];Dispositivi elettronici > accessori
153||SP_72801GC01;153;Monclick;TD_MANAGER;SP_72801GC01;Borsa Carry bag l - borsa trasporto proiettore sp.72801gc01;"Tipologia: Borsa trasporto proiettore; Adatta per: Borsa trasporto proiettore; Dimensione monitor: Non applicabile; Colore: Nero;";Accessori > Borse e custodie;[113,190];Dispositivi elettronici > accessori
153||SP791D_2;153;Monclick;TD_MANAGER;SP791D_2;Lavello SP791D-2;"N vasche: 1; Larghezza perimetrale: 790 mm; Profondità perimetrale: 500 mm;";Elettrodomestici da incasso > Lavelli;[114,209];Elettrodomestici > Grandi elettrodomestici
153||ST122HD4K;153;Monclick;TD_MANAGER;ST122HD4K;Cavo HDMI Startech.com sdoppiatore splitter video hdmi 4k @ 30hz 1 ingresso 2 uscite 1x2;"Tipo connettore esterno: Sdoppiatore Splitter Video HDMI 4k @ 30hz 1 ingresso 2 uscite 1x2 porte di uscita con custodia in alluminio; Tipo connettore interno: HDMI;";Accessori > Adattatori;[113,190];Dispositivi elettronici > accessori
153||SS494B;153;Monclick;TD_MANAGER;SS494B;Ml-mem370 - ddr3 - modulo - 512 mb ss494b#eee;"Tipologia: DRAM;";Accessori > Espansioni di memoria;[113,191];Dispositivi elettronici > accessori computer e tablet
153||ST122HDMILE;153;Monclick;TD_MANAGER;ST122HDMILE;Adattatore Startech.com sdoppiatore video hdmi a 2 porte con audio alimentato via usb (s;"Tipo connettore esterno: Sdoppiatore video HDMI a 2 porte con audio Alimentato via USB (ST122HDMILE); Tipo connettore interno: HDMI;";Accessori > Adattatori;[113,190];Dispositivi elettronici > accessori
153||SS498A;153;Monclick;TD_MANAGER;SS498A;Cassetto carta Ml-pmk65k - kit di manutenzione ss498a;"Tipologia: Kit di manutenzione;";Accessori > Accessori per stampanti;[113,192];Dispositivi elettronici > accessori stampanti
153||ST122LEA;153;Monclick;TD_MANAGER;ST122LEA;Adattatore Startech.com sdoppiatore video vga a 2 porte con audio st122lea;"Tipo connettore esterno: Sdoppiatore video VGA a 2 porte con audio - Alimentato via USB; Tipo connettore interno: VGA / audio;";Accessori > Adattatori;[113,190];Dispositivi elettronici > accessori
153||SS499C;153;Monclick;TD_MANAGER;SS499C;Ml-s5010a - cassetto carta - 520 fogli ss499c#abz;"Tipologia: Cassetto carta; Tipologia stampante: n.d.;";Consumabili > Kit immagini e contenitori di recupero toner;[113,192];Dispositivi elettronici > accessori stampanti
153||ST122VGA;153;Monclick;TD_MANAGER;ST122VGA;Adattatore Startech.com switch box automatico vga a 2 porte con commutazione per priorità;"Tipo connettore esterno: Switch box automatico VGA a 2 porte con commutazione per priorità e copia EDID; Tipo connettore interno: VGA;";Accessori > Adattatori;[113,190];Dispositivi elettronici > accessori
153||SS505B;153;Monclick;TD_MANAGER;SS505B;Sl-dsk001t - supporto per stampante con cabinet ss505b#eee;"Tipologia: Supporto per stampante con cabinet; Tipologia stampante: n.d.;";Consumabili > Kit immagini e contenitori di recupero toner;[113,192];Dispositivi elettronici > accessori stampanti
153||ST124HD4K;153;Monclick;TD_MANAGER;ST124HD4K;Hub Startech.com sdoppiatore splitter video hdmi 4k @ 30hz 1 ingresso 4 uscite 1x4;"Q.ta porte: n.d.; Colore: n.d.;";Networking e Wireless > Hub;[111,189];Casa e giardino > Sistemi di allarme
153||SS507A;153;Monclick;TD_MANAGER;SS507A;Sl-dsk003s - base per stampante ss507a#eee;"Tipologia: Base per stampante; Tipologia stampante: n.d.;";Consumabili > Kit immagini e contenitori di recupero toner;[113,192];Dispositivi elettronici > accessori stampanti
153||ST124HDMI2;153;Monclick;TD_MANAGER;ST124HDMI2;Hub Startech.com splitter hdmi a 4 porte e amplificatore di segnale st124hdmi2;"Q.ta porte: n.d.; Colore: n.d.;";Networking e Wireless > Hub;[111,189];Casa e giardino > Sistemi di allarme
153||SS515A;153;Monclick;TD_MANAGER;SS515A;Sl-mem0020 - ddr3 - modulo - 2 gb - so dimm 204-pin - senza buffer ss515a#eee;"Tipologia: n.d.; Tipologia stampante: n.d.;";Consumabili > Kit immagini e contenitori di recupero toner;[113,192];Dispositivi elettronici > accessori stampanti
153||ST128HD20;153;Monclick;TD_MANAGER;ST128HD20;Hub Startech.com splitter hdmi a 8-porte 4k 60hz - supporto hdr st128hd20;"Tipologia: n.d.; Q.ta porte: n.d.; Colore: n.d.;";Networking e Wireless > Hub;[111,189];Casa e giardino > Sistemi di allarme
153||SS517A;153;Monclick;TD_MANAGER;SS517A;Cassetto carta Sl-pmk002k - kit di manutenzione ss517a;"Tipologia: Kit di manutenzione;";Accessori > Accessori per stampanti;[113,192];Dispositivi elettronici > accessori stampanti
153||ST12MHDLAN;153;Monclick;TD_MANAGER;ST12MHDLAN;Hub Startech.com kit di estensione ethernet lan gigabit video hdmi over ip st12mhdl;"Tipologia: n.d.; Q.ta porte: n.d.; Colore: n.d.;";Networking e Wireless > Hub;[111,189];Casa e giardino > Sistemi di allarme
153||ST12MHDLAN4K;153;Monclick;TD_MANAGER;ST12MHDLAN4K;Startech.com kit extender hdmi via ip con supporto per video murale st12mhdlan4k;Startech.com kit extender hdmi via ip con supporto per video murale st12mhdlan4k;Accessori > Accessori video;[113,205];Dispositivi elettronici > video
153||ST12MHDLAN4R;153;Monclick;TD_MANAGER;ST12MHDLAN4R;Startech.com ricevitore hdmi via ip 4k per st12mhdlan4k st12mhdlan4r;Startech.com ricevitore hdmi via ip 4k per st12mhdlan4k st12mhdlan4r;Accessori > Accessori video;[113,205];Dispositivi elettronici > video
153||SS531A;153;Monclick;TD_MANAGER;SS531A;Toner Clt-c6062s - ciano - originale - cartuccia toner (ss531a) ss531a;"Tipologia: Toner; Colore: Ciano; Quantità per confezione: Confezione da 1;";Consumabili > Cartucce e toner;[113,192];Dispositivi elettronici > accessori stampanti
153||ST12MHDLANU;153;Monclick;TD_MANAGER;ST12MHDLANU;Startech.com kit extender hdmi e usb su ip con supporto videowall st12mhdlanu;Startech.com kit extender hdmi e usb su ip con supporto videowall st12mhdlanu;Accessori > Accessori video;[113,205];Dispositivi elettronici > video
153||SS546A;153;Monclick;TD_MANAGER;SS546A;Toner Clt-c804s - ciano - originale - cartuccia toner (ss546a) ss546a;"Tipologia: Toner; Colore: Ciano; Quantità per confezione: Confezione da 1;";Consumabili > Cartucce e toner;[113,192];Dispositivi elettronici > accessori stampanti
153||ST20000SPEXI;153;Monclick;TD_MANAGER;ST20000SPEXI;Adattatore di rete Startech.com scheda di rete pci express a 2 porte 10 gbase-t ethernet con chips;"Tipologia: Adattatore di rete; Tipologia interfaccia PC: PCI Express 2.0 x8; Velocità di trasferimento dati: 10 Gbps; Tipologia cablaggio: Ethernet 1000Base-T, Ethernet 100Base-TX, Ethernet 10GBase-T;";Networking e Wireless > Adattatori di rete ethernet;[111,189];Casa e giardino > Sistemi di allarme
153||SS560A;153;Monclick;TD_MANAGER;SS560A;Toner Clt-c808s - ciano - originale - cartuccia toner (ss560a) ss560a;"Tipologia: Toner; Colore: Ciano; Quantità per confezione: Confezione da 1;";Consumabili > Cartucce e toner;[113,192];Dispositivi elettronici > accessori stampanti
153||SS567A;153;Monclick;TD_MANAGER;SS567A;Toner Clt-c809s - ciano - originale - cartuccia toner (ss567a) ss567a;"Tipologia: Toner; Colore: Ciano; Quantità per confezione: Confezione da 1;";Consumabili > Cartucce e toner;[113,192];Dispositivi elettronici > accessori stampanti
153||SS577A;153;Monclick;TD_MANAGER;SS577A;Toner Clt-k6062s - nero - originale - cartuccia toner (ss577a) ss577a;"Tipologia: Toner; Colore: Nero; Quantità per confezione: Confezione da 1;";Consumabili > Cartucce e toner;[113,192];Dispositivi elettronici > accessori stampanti
153||SS586A;153;Monclick;TD_MANAGER;SS586A;Toner Clt-k804s - nero - originale - cartuccia toner (ss586a) ss586a;"Tipologia: Toner; Colore: Nero; Quantità per confezione: Confezione da 1;";Consumabili > Cartucce e toner;[113,192];Dispositivi elettronici > accessori stampanti
153||SS593A;153;Monclick;TD_MANAGER;SS593A;Toner Clt-k806s - nero - originale - cartuccia toner (ss593a) ss593a;"Tipologia: Toner; Colore: Nero; Quantità per confezione: Confezione da 1;";Consumabili > Cartucce e toner;[113,192];Dispositivi elettronici > accessori stampanti
153||SS600A;153;Monclick;TD_MANAGER;SS600A;Toner Clt-k808s - nero - originale - cartuccia toner (ss600a) ss600a;"Tipologia: Toner; Colore: Nero; Quantità per confezione: Confezione da 1;";Consumabili > Cartucce e toner;[113,192];Dispositivi elettronici > accessori stampanti
153||ST2000NX0273;153;Monclick;TD_MANAGER;ST2000NX0273;Hard disk interno Exos 7e2000 - hdd - 2 tb - sas 12gb/s st2000nx0273;"Capacità: 2 TB; Formato: 2.5''; Interfaccia: Serial Attached SCSI 3; Velocità di rotazione: 7200 rpm; Velocità di trasferimento dati: 136 GBps;";HDD e Componenti PC > Hard disk interni;[113,191];Dispositivi elettronici > accessori computer e tablet
153||SS613A;153;Monclick;TD_MANAGER;SS613A;Toner Clt-m6062s - magenta - originale - cartuccia toner (ss613a) ss613a;"Tipologia: Toner; Colore: Magenta; Quantità per confezione: Confezione da 1;";Consumabili > Cartucce e toner;[113,192];Dispositivi elettronici > accessori stampanti
153||ST2000NX0433;153;Monclick;TD_MANAGER;ST2000NX0433;Hard disk interno Exos 7e2000 - hdd - 2 tb - sas 12gb/s st2000nx0433;"Capacità: 2 TB; Formato: 2.5''; Interfaccia: Serial Attached SCSI 3; Velocità di rotazione: 7200 rpm; Velocità di trasferimento dati: 1.2 GBps;";HDD e Componenti PC > Hard disk interni;[113,191];Dispositivi elettronici > accessori computer e tablet
153||SS628A;153;Monclick;TD_MANAGER;SS628A;Toner Clt-m804s - magenta - originale - cartuccia toner (ss628a) ss628a;"Tipologia: Toner; Colore: Magenta; Quantità per confezione: Confezione da 1;";Consumabili > Cartucce e toner;[113,192];Dispositivi elettronici > accessori stampanti
153||ST2000SPEXI;153;Monclick;TD_MANAGER;ST2000SPEXI;Adattatore di rete Startech.com scheda adattatore server di rete gigabit ethernet pci express (pci;"Tipologia: Scheda plug-in; Tipologia interfaccia PC: PCI Express 2.1 x4; Velocità di trasferimento dati: 1 Gbps; Tipologia cablaggio: Ethernet 1000Base-T, Ethernet 100Base-TX, Ethernet 10Base-T;";Networking e Wireless > Adattatori di rete ethernet;[111,189];Casa e giardino > Sistemi di allarme
153||ST2000VN004;153;Monclick;TD_MANAGER;ST2000VN004;Hard disk interno Ironwolf - hdd - 2 tb - sata 6gb/s st2000vn004;"Capacità: 2 TB; Formato: 3.5''; Interfaccia: Serial ATA-600; Velocità di rotazione: 5900 rpm; Velocità di trasferimento dati: 600 MBps;";HDD e Componenti PC > Hard disk interni;[113,191];Dispositivi elettronici > accessori computer e tablet
153||SS649A;153;Monclick;TD_MANAGER;SS649A;Toner Clt-m809s - magenta - originale - cartuccia toner (ss649a) ss649a;"Tipologia: Toner; Colore: Magenta; Quantità per confezione: Confezione da 1;";Consumabili > Cartucce e toner;[113,192];Dispositivi elettronici > accessori stampanti
153||ST_201T;153;Monclick;TD_MANAGER;ST_201T;Supporto st-201t;"Tipologia: Supporto;";Accessori > Supporti e accessori per monitor;[113,193];Dispositivi elettronici > accessori telefoni cellulari
153||SS660A;153;Monclick;TD_MANAGER;SS660A;Clt-r607k - nero - originale - unità imaging per stampante ss660a;"Tipologia: Tamburo;";Consumabili > Cinghie e tamburi;[125,234];Ufficio > Forniture per ufficio
153||ST3000DM007;153;Monclick;TD_MANAGER;ST3000DM007;Hard disk interno Hdd - 3 tb - sata 6gb/s st3000dm007;"Capacità: 3 TB; Formato: 3.5; Interfaccia: Serial ATA-600; Velocità di rotazione: 7200 rpm; Velocità di trasferimento dati: 600 MBps;";HDD e Componenti PC > Hard disk interni;[113,191];Dispositivi elettronici > accessori computer e tablet
153||SS668A;153;Monclick;TD_MANAGER;SS668A;Clt-r607y - giallo - originale - unità imaging per stampante ss668a;"Tipologia: Tamburo;";Consumabili > Cinghie e tamburi;[125,234];Ufficio > Forniture per ufficio
153||ST3000VX009;153;Monclick;TD_MANAGER;ST3000VX009;Hard disk interno Skyhawk surveillance hdd - hdd - 3 tb - sata 6gb/s st3000vx009;"Capacità: 3 TB; Formato: 3.5''; Interfaccia: Serial ATA-600; Velocità di rotazione: n.d.; Velocità di trasferimento dati: 600 MBps;";HDD e Componenti PC > Hard disk interni;[113,191];Dispositivi elettronici > accessori computer e tablet
153||SS678A;153;Monclick;TD_MANAGER;SS678A;Clt-r806k/see ss678a;"Tipologia: Tamburo;";Consumabili > Cinghie e tamburi;[125,234];Ufficio > Forniture per ufficio
153||ST300MP0106;153;Monclick;TD_MANAGER;ST300MP0106;Hard disk interno Exos 15e900 - hdd - 300 gb - sas 12gb/s st300mp0106;Exos 15e900 - hdd - 300 gb - sas 12gb/s st300mp0106;HDD e Componenti PC > Hard disk interni;[113,191];Dispositivi elettronici > accessori computer e tablet
153||SS686A;153;Monclick;TD_MANAGER;SS686A;Clt-r808 - nero, giallo, ciano, magenta - originale ss686a;"Tipologia: Tamburo;";Consumabili > Cinghie e tamburi;[125,234];Ufficio > Forniture per ufficio
153||ST3300G3UA;153;Monclick;TD_MANAGER;ST3300G3UA;Adattatore bluetooth Startech.com hub usb 3.0 a 3 porte con adattatore nic ethernet gigabit gbe in a;"Protocollo di connessione wireless: IEEE 802.11a, IEEE 802.11ac, IEEE 802.11b, IEEE 802.11g, IEEE 802.11n; Tipologia: Esterno; Tipologia connessione: Cablato, Wireless; Tipologia interfaccia PC: USB 3.0; Velocità trasferimento dati: Dato non disponibile;";Networking e Wireless > Adattatori bluetooth e wireless;[111,189];Casa e giardino > Sistemi di allarme
153||SS694A;153;Monclick;TD_MANAGER;SS694A;Clt-w606 ss694a;"Tipologia: Raccoglitore toner disperso; Tipologia stampante: Laser;";Consumabili > Kit immagini e contenitori di recupero toner;[113,192];Dispositivi elettronici > accessori stampanti
153||ST3300U3S;153;Monclick;TD_MANAGER;ST3300U3S;Hub Startech.com adattatore di rete nic usb 3.0 a ethernet gigabit con 3 porte hub;"Tipologia: Hub; Q.ta porte: 3; Colore: Bianco;";Networking e Wireless > Hub;[111,189];Casa e giardino > Sistemi di allarme
153||SS701A;153;Monclick;TD_MANAGER;SS701A;Clt-w808 - nero, giallo, ciano, magenta - raccoglitore toner disperso ss701a;"Tipologia: Vaschetta di recupero; Tipologia stampante: Laser;";Consumabili > Kit immagini e contenitori di recupero toner;[113,192];Dispositivi elettronici > accessori stampanti
153||ST4000DM004_HDD;153;Monclick;TD_MANAGER;ST4000DM004_HDD;Hard disk interno Hdd - 4 tb - sata 6gb/s st4000dm004;"Capacità: 4 TB; Formato: 3.5''; Interfaccia: Serial ATA-600; Velocità di rotazione: 5400 rpm; Velocità di trasferimento dati: 190 MBps;";HDD e Componenti PC > Hard disk interni;[113,191];Dispositivi elettronici > accessori computer e tablet
153||SS706A;153;Monclick;TD_MANAGER;SS706A;Toner Clt-y6062s - giallo - originale - cartuccia toner (ss706a) ss706a;"Tipologia: Toner; Colore: Giallo; Quantità per confezione: Confezione da 1;";Consumabili > Cartucce e toner;[113,192];Dispositivi elettronici > accessori stampanti
153||ST4000PEXPSE;153;Monclick;TD_MANAGER;ST4000PEXPSE;Adattatore di rete Startech.com scheda di rete pcie gigabit power over ethernet a 4 porte st4000pe;"Tipologia: Adattatore di rete; Tipologia interfaccia PC: PCI Express x4; Velocità di trasferimento dati: 1 Gbps; Tipologia cablaggio: Ethernet 1000Base-T, Ethernet 100Base-TX, Ethernet 10Base-T;";Networking e Wireless > Adattatori di rete ethernet;[111,189];Casa e giardino > Sistemi di allarme
153||SS721A;153;Monclick;TD_MANAGER;SS721A;Toner Clt-y804s - giallo - originale - cartuccia toner (ss721a) ss721a;"Tipologia: Toner; Colore: Giallo; Quantità per confezione: Confezione da 1;";Consumabili > Cartucce e toner;[113,192];Dispositivi elettronici > accessori stampanti
153||SURT013;153;Monclick;TD_MANAGER;SURT013;Carrello ups surt013;"Tipologia: Carrello UPS;";Accessori > Accessori server e networking;[113,191];Dispositivi elettronici > accessori computer e tablet
153||SURT019;153;Monclick;TD_MANAGER;SURT019;Smart-ups rt extension cable - cavo di alimentazione - 3.5 m surt019;"Tipologia: Cavo di alimentazione;";Accessori > Accessori server e networking;[113,191];Dispositivi elettronici > accessori computer e tablet
153||SURT1000RMXLI;153;Monclick;TD_MANAGER;SURT1000RMXLI;Gruppo di continuità Smart-ups rt 1000va rm - ups - 700 watt - 1000 va surt1000rmxli;"Potenza erogata: 700 Watt; Capacità di alimentazione: 1000 VA; Durata batteria: 10.2 min; N spine connettibili: 6;";Networking e Wireless > Gruppi di continuità;[111,189];Casa e giardino > Sistemi di allarme
153||SURT1000XLI;153;Monclick;TD_MANAGER;SURT1000XLI;Gruppo di continuità Smart-ups rt 1000 - ups - 700 watt - 1000 va surt1000xli;"Potenza erogata: 700 Watt; Capacità di alimentazione: 1000 VA; Durata batteria: 10.2 min; N spine connettibili: 6;";Networking e Wireless > Gruppi di continuità;[111,189];Casa e giardino > Sistemi di allarme
153||SURT1000XLIM;153;Monclick;TD_MANAGER;SURT1000XLIM;Gruppo di continuità Smart-ups rt 1000 - marine - ups - 700 watt - 1000 va surt1000xlim;"Potenza erogata: 700 Watt; Capacità di alimentazione: 1000 VA; Durata batteria: 14 min; N spine connettibili: 6;";Networking e Wireless > Gruppi di continuità;[111,189];Casa e giardino > Sistemi di allarme
153||SURT15KRMXLI;153;Monclick;TD_MANAGER;SURT15KRMXLI;Gruppo di continuità Smart-ups rt - ups - 12 kw - 15000 va surt15krmxli;"Potenza erogata: 12000 Watt; Capacità di alimentazione: 15000 VA; Durata batteria: 8.3 min; N spine connettibili: 10;";Networking e Wireless > Gruppi di continuità;[111,189];Casa e giardino > Sistemi di allarme
153||SURT192RMXLBP;153;Monclick;TD_MANAGER;SURT192RMXLBP;Batteria Smart-ups rt 192v rm battery pack - batteria ups - piombo surt192rmxlbp;"Tipologia: Batteria UPS;";Accessori > Batterie;[113,190];Dispositivi elettronici > accessori
153||SURT192RMXLBP2;153;Monclick;TD_MANAGER;SURT192RMXLBP2;Batteria Smart-ups rt 192v rm battery pack - contenitore batterie - piombo surt192rmxlbp2;"Tipologia: Contenitore batterie;";Accessori > Batterie;[113,190];Dispositivi elettronici > accessori
153||SURT192XLBP;153;Monclick;TD_MANAGER;SURT192XLBP;Batteria Smart-ups rt 192v battery pack - contenitore batterie - piombo surt192xlbp;"Tipologia: Contenitore batterie;";Accessori > Batterie;[113,190];Dispositivi elettronici > accessori
153||SURT20KRMXLI;153;Monclick;TD_MANAGER;SURT20KRMXLI;Gruppo di continuità Smart-ups rt - ups - 16 kw - 20000 va surt20krmxli;"Potenza erogata: 16000 Watt; Capacità di alimentazione: 20000 VA; Durata batteria: 4.9 min; N spine connettibili: 10;";Networking e Wireless > Gruppi di continuità;[111,189];Casa e giardino > Sistemi di allarme
153||SURT48RMXLBP;153;Monclick;TD_MANAGER;SURT48RMXLBP;Batteria Smart-ups rt 48v rm battery pack - batteria ups - piombo surt48rmxlbp;"Tipologia: Batteria UPS;";Accessori > Batterie;[113,190];Dispositivi elettronici > accessori
153||SURT48XLBP;153;Monclick;TD_MANAGER;SURT48XLBP;Batteria Smart-ups rt 48v battery pack - batteria ups - piombo surt48xlbp;"Tipologia: Batteria UPS;";Accessori > Batterie;[113,190];Dispositivi elettronici > accessori
153||SURTD2200XLIM;153;Monclick;TD_MANAGER;SURTD2200XLIM;Gruppo di continuità Smart-ups rt 2200 marine - ups - 1.54 kw - 2200 va surtd2200xlim;"Potenza erogata: 1540 Watt; Capacità di alimentazione: 2200 VA; Durata batteria: 21 min; N spine connettibili: 10;";Networking e Wireless > Gruppi di continuità;[111,189];Casa e giardino > Sistemi di allarme
153||SURTD3000XLIM;153;Monclick;TD_MANAGER;SURTD3000XLIM;Gruppo di continuità Smart-ups rt 3000 - marine - ups - 2.1 kw - 3000 va surtd3000xlim;"Potenza erogata: 2100 Watt; Capacità di alimentazione: 3000 VA; Durata batteria: 14.1 min; N spine connettibili: 10;";Networking e Wireless > Gruppi di continuità;[111,189];Casa e giardino > Sistemi di allarme
153||SURTRK;153;Monclick;TD_MANAGER;SURTRK;Staffa Kit rack rail surtrk;"Tipologia: Kit rack rail;";Accessori > Accessori server e networking;[113,191];Dispositivi elettronici > accessori computer e tablet
