Identification;EshopId;EshopName;ManagerClassName;ProductItemId;Name;Description;SearchCategoryKey;CategoryId;CategoryDesc
153||MK_000000155496;153;Monclick;TD_MANAGER;MK_000000155496;Trio - pastello colorato 203/11-15;"Tipologia: Pastello colorato; Colore: Arancione, Blu cielo, Blu oltremare, Blu violaceo, Giallo, Grigio, Marrone chiaro, Nero, Rosa, Rosa incarnato, Rosso ciliegia, Rosso STABILO, Verde, Verde giallo, Viola rosso; Quantità per confezione: 15;";Prodotti per scuola e ufficio > Pastelli e pennarelli;[111,188];Casa e giardino > sicurezza
153||MK_000000155503;153;Monclick;TD_MANAGER;MK_000000155503;Penna Cf3stabilo point 88 nero blister b-14828-10;"Quantità per confezione: n.d.; Tipologia: n.d.; Colore: Nero; Tipo inchiostro: n.d.;";Prodotti per scuola e ufficio > Penne;[111,188];Casa e giardino > sicurezza
153||MK_000000155515;153;Monclick;TD_MANAGER;MK_000000155515;Tastiera Gaming Gaming g512 - tastiera - usa internazionale - carbonio 920-009370;"Connettività: Cablato; Interfaccia: USB; Layout: n.d.; Colore: Nero;";Monitor e Periferiche PC > Tastiere;[113,191];Dispositivi elettronici > accessori computer e tablet
153||MK_000000155521;153;Monclick;TD_MANAGER;MK_000000155521;Tastiera Gaming Gaming g513 - tastiera - usa internazionale - carbonio 920-009340;"Connettività: Cablato; Interfaccia: USB; Layout: Inglese U.S.A.; Colore: Nero;";Monitor e Periferiche PC > Tastiere;[113,191];Dispositivi elettronici > accessori computer e tablet
153||MK_000000155547;153;Monclick;TD_MANAGER;MK_000000155547;Tastiera Gaming Gaming g815 - tastiera - usa internazionale - nero 920-009008;"Connettività: Cablato; Interfaccia: USB; Layout: Inglese U.S.A.; Colore: Nero;";Monitor e Periferiche PC > Tastiere;[113,191];Dispositivi elettronici > accessori computer e tablet
153||MK_000000155561;153;Monclick;TD_MANAGER;MK_000000155561;Mouse Mouse - usb - nero mu200gs;"Connettività: Cablato; Interfaccia: USB; Tecnologia: Ottica; Colore: Nero;";Monitor e Periferiche PC > Mouse;[113,191];Dispositivi elettronici > accessori computer e tablet
153||MK_000000155584;153;Monclick;TD_MANAGER;MK_000000155584;Tastiera Gaming Gaming g513 - tastiera - usa internazionale - carbonio 920-009330;"Connettività: Cablato; Interfaccia: USB; Layout: Inglese U.S.A.; Colore: Nero;";Monitor e Periferiche PC > Tastiere;[113,191];Dispositivi elettronici > accessori computer e tablet
153||MK_000000155603;153;Monclick;TD_MANAGER;MK_000000155603;Mouse Mouse - usb - bianco mu200gs-wht;"Connettività: Cablato; Interfaccia: USB; Tecnologia: Ottica; Colore: Bianco;";Monitor e Periferiche PC > Mouse;[113,191];Dispositivi elettronici > accessori computer e tablet
153||MK_000000155647;153;Monclick;TD_MANAGER;MK_000000155647;Notebook 15s-eq0029nl 15,6'' Ryzen 5 RAM 8GB SSD 512GB 3A541EA;"Tipologia: Notebook; Dimensione schermo: 15,6''; Sistema operativo: Windows 10 Home; Tipo processore: AMD Ryzen 5; Serie scheda video: AMD Radeon; Scheda grafica dedicata: Integrata; Memoria RAM: 8 GB; Touchscreen: No; Modello processore: 3500U; Modello scheda grafica: AMD Radeon Vega 8; RAM massima: 8 GB; Tipo hard disk: SSD; Capacità hard disk: 512 GB; Peso: 1.7 kg; Risoluzione: 1920 x 1080 Pixels; Unità ottica installata: Nessuna Unità Ottica; Colore: Canna di fucile; Marchio processore: AMD;";PC Notebook e Tablet > Notebook;[113,197];Dispositivi elettronici > computer e tablet
153||MK_000000155653;153;Monclick;TD_MANAGER;MK_000000155653;Lavatrice WSD323 WCS PowerWash 8 Kg 64.3 cm Classe A;"Caricamento: Frontale; Capacità carico: 8 kg; Profondità: 64.3 cm; Efficienza energetica: Classe A; Velocità centrifuga: 1400 rpm; Motore inverter: Sì; Efficienza centrifuga: Classe B; Altezza: 85 cm; Larghezza: 59.6 cm; Connettività: Assente; Colore: Bianco; Modello: WSD323 WCS; Serie: PowerWash;";Grandi elettrodomestici > Lavatrici;[114,207];Elettrodomestici > accessori grandi elettrodomestici
153||MK_000000155655;153;Monclick;TD_MANAGER;MK_000000155655;Lavatrice WSI863 WCS PowerWash TwinDos 9 Kg 64.3 cm Classe A;"Caricamento: Frontale; Capacità carico: 9 kg; Profondità: 64.3 cm; Efficienza energetica: Classe A; Velocità centrifuga: 1600 rpm; Motore inverter: Sì; Efficienza centrifuga: Classe A; Altezza: 85 cm; Larghezza: 59.6 cm; Connettività: WiFi; Colore: Bianco; Modello: WSI863 WCS; Serie: PowerWash TwinDos;";Grandi elettrodomestici > Lavatrici;[114,207];Elettrodomestici > accessori grandi elettrodomestici
153||MK_000000155705;153;Monclick;TD_MANAGER;MK_000000155705;Nastro Tze-re34 - nastro - 1 cassetta(e) - rotolo (1,2 cm x 4 m) tzere34;"Tipologia: Nastro; Colore: Dorato su rosa; Dimensioni supporto: 1,2 cm x 4 m; Larghezza nastro: 12 mm; Quantità per confezione: 1 cassetta(e);";Consumabili > Nastri per etichettatrici;[125,234];Ufficio > Forniture per ufficio
153||MK_000000155931;153;Monclick;TD_MANAGER;MK_000000155931;Switch Nuclias cloud-managed - switch - 52 porte dbs-2000-52mp;"N porte LAN: 52; Gestibile: n.d.; Standard: Gigabit Ethernet; PoE: Sì; Formato: n.d.;";Networking e Wireless > Switch;[111,189];Casa e giardino > Sistemi di allarme
153||MK_000000155933;153;Monclick;TD_MANAGER;MK_000000155933;Scheda PCI Link - adattatore usb - pcie - usb 3.0 x 1 + usb-c 3.1 gen 1 x 1 lkros06;"Connettori: Adattatore USB; Bus: PCI Express x1; Velocità trasferimento dati: 5 Gbps;";HDD e Componenti PC > Schede PCI;[113,191];Dispositivi elettronici > accessori computer e tablet
153||MK_000000155937;153;Monclick;TD_MANAGER;MK_000000155937;Switch Nuclias cloud-managed - switch - 52 porte dbs-2000-52;"N porte LAN: 52; Gestibile: n.d.; Standard: Gigabit Ethernet; PoE: No; Formato: n.d.;";Networking e Wireless > Switch;[111,189];Casa e giardino > Sistemi di allarme
153||MK_000000155939;153;Monclick;TD_MANAGER;MK_000000155939;Switch Nuclias cloud-managed - switch - 10 porte dbs-2000-10mp;"N porte LAN: 10; Gestibile: n.d.; Standard: Gigabit Ethernet; PoE: Sì; Formato: n.d.;";Networking e Wireless > Switch;[111,189];Casa e giardino > Sistemi di allarme
153||MK_000000157124;153;Monclick;TD_MANAGER;MK_000000157124;Edigreen airbox - v3 - sensore multifunzione - 802.11b/g/n ai-1001w v3;"Tipologia: Sensore multifunzione;";Networking e Wireless > Sistemi domotici;[111,189];Casa e giardino > Sistemi di allarme
153||MK_000000157179;153;Monclick;TD_MANAGER;MK_000000157179;SSD Dell - ssd - 512 gb - pcie aa618641;"Tipologia: Disco fisso interno; Capacità: 512 GB; Formato: M.2 2280; Interfaccia: PCI Express;";HDD e Componenti PC > SSD;[113,191];Dispositivi elettronici > accessori computer e tablet
153||MK_000000157221;153;Monclick;TD_MANAGER;MK_000000157221;Cuffie MySound Speak Quiet con microfono Nero;"Tipologia: Cuffie; Connettività: Senza fili; Tecnologia wireless: Bluetooth; Colore: Nero; Serie: MySound; Modello: Speak Quiet;";Home Cinema e Audio > Cuffie e auricolari;[113,196];Dispositivi elettronici > audio
153||MK_000000157229;153;Monclick;TD_MANAGER;MK_000000157229;Penna Point 88 mini - penna punta in fibra 688/18-2;"Quantità per confezione: 18; Tipologia: Penna punta in fibra; Colore: Colori assortiti; Tipo inchiostro: Inchiostro base acqua;";Prodotti per scuola e ufficio > Penne;[111,188];Casa e giardino > sicurezza
153||MK_000000157287;153;Monclick;TD_MANAGER;MK_000000157287;Cassetto 250fg x dcopia 3524bf b3415-000;"Tipologia: n.d.; Tipologia stampante: n.d.;";Consumabili > Kit immagini e contenitori di recupero toner;[113,192];Dispositivi elettronici > accessori stampanti
153||MK_000000157329;153;Monclick;TD_MANAGER;MK_000000157329;Caricabatteria Alimentatore - usb-c - 25 watt achsmkitc2cpd25wk;"Tipologia: Caricabatterie;";Accessori > Caricabatterie;[113,190];Dispositivi elettronici > accessori
153||MK_000000157333;153;Monclick;TD_MANAGER;MK_000000157333;Cover CUSTODIA ECO BECOME IPHONE XR VERDE;"Tipologia: Cover posteriore; Compatibilità: n.d.; Colore: Verde;";Accessori > Cover;[113,193];Dispositivi elettronici > accessori telefoni cellulari
153||MK_000000157335;153;Monclick;TD_MANAGER;MK_000000157335;Cover CUSTODIA ECO BECOME IPHONE XR ROSA;"Tipologia: Cover posteriore; Compatibilità: n.d.; Colore: Rosa;";Accessori > Cover;[113,193];Dispositivi elettronici > accessori telefoni cellulari
153||MK_000000157336;153;Monclick;TD_MANAGER;MK_000000157336;Cover CUSTODIA ECO BECOME IPHONE 11 PRO V;"Tipologia: Cover posteriore; Compatibilità: n.d.; Colore: Verde;";Accessori > Cover;[113,193];Dispositivi elettronici > accessori telefoni cellulari
153||MK_000000157338;153;Monclick;TD_MANAGER;MK_000000157338;Cover CUSTODIA ECO BECOME IPHONE 11 VERDE;"Tipologia: Cover posteriore; Compatibilità: iPhone 11; Colore: Verde;";Accessori > Cover;[113,193];Dispositivi elettronici > accessori telefoni cellulari
153||MK_000000157340;153;Monclick;TD_MANAGER;MK_000000157340;Cover CUSTODIA ECO BECOME IPHONE 11 ROSA;"Tipologia: Cover posteriore; Compatibilità: iPhone 11; Colore: Rosa;";Accessori > Cover;[113,193];Dispositivi elettronici > accessori telefoni cellulari
153||MK_000000157345;153;Monclick;TD_MANAGER;MK_000000157345;Cover CUSTODIA GOMMA FINE GALAXY S20 TRAS;"Tipologia: Cover posteriore; Compatibilità: n.d.; Colore: Trasparente;";Accessori > Cover;[113,193];Dispositivi elettronici > accessori telefoni cellulari
153||MK_000000157347;153;Monclick;TD_MANAGER;MK_000000157347;Cavo USB Cavo usb 1m usb-c to usb-c bianco plcabc2c1mw;"Tipologia: n.d.; Genere connettore dx: Maschio; Genere connettore sx: Maschio; Tipo connettore dx: n.d.; Tipo connettore sx: n.d.;";Accessori > Cavi di rete, USB e periferiche;[113,194];Dispositivi elettronici > accessori telefonia
153||MK_000000157349;153;Monclick;TD_MANAGER;MK_000000157349;Caricabatteria Cavo usb 1m c-to-lightning bianco plcabc2lmfi1mw;"Tipologia: n.d.;";Accessori > Caricabatterie;[113,190];Dispositivi elettronici > accessori
153||MK_000000157354;153;Monclick;TD_MANAGER;MK_000000157354;Cavo USB Cavo micro usb 2m nero plcabmusb2mk;"Tipologia: n.d.; Genere connettore dx: Maschio; Genere connettore sx: Maschio; Tipo connettore dx: n.d.; Tipo connettore sx: n.d.;";Accessori > Cavi di rete, USB e periferiche;[113,194];Dispositivi elettronici > accessori telefonia
153||MK_000000157364;153;Monclick;TD_MANAGER;MK_000000157364;Caricabatteria Caricabatterie da auto usb 18w qc3 plccusb18wk;"Tipologia: n.d.;";Accessori > Caricabatterie;[113,190];Dispositivi elettronici > accessori
153||MK_000000157375;153;Monclick;TD_MANAGER;MK_000000157375;Caricabatteria Alimentatore - usb pltckit2amusbk;"Tipologia: Alimentatore;";Accessori > Caricabatterie;[113,190];Dispositivi elettronici > accessori
153||MK_000000157376;153;Monclick;TD_MANAGER;MK_000000157376;Caricabatteria Alimentatore - usb pltckit2atyck;"Tipologia: Alimentatore;";Accessori > Caricabatterie;[113,190];Dispositivi elettronici > accessori
153||MK_000000157379;153;Monclick;TD_MANAGER;MK_000000157379;Caricabatteria Alimentatore - usb pltcusb1ak;"Tipologia: Caricabatterie;";Accessori > Caricabatterie;[113,190];Dispositivi elettronici > accessori
153||MK_000000157382;153;Monclick;TD_MANAGER;MK_000000157382;Cover CUSTODIA PURE IPHONE 11 PRO MAX TRA;"Tipologia: Cover posteriore; Compatibilità: n.d.; Colore: Trasparente;";Accessori > Cover;[113,193];Dispositivi elettronici > accessori telefoni cellulari
153||MK_000000157384;153;Monclick;TD_MANAGER;MK_000000157384;Cover CUSTODIA PURE IPHONE 11 TRASP;"Tipologia: Cover posteriore; Compatibilità: iPhone 11; Colore: Trasparente;";Accessori > Cover;[113,193];Dispositivi elettronici > accessori telefoni cellulari
153||MK_000000157446;153;Monclick;TD_MANAGER;MK_000000157446;Toner 216a - magenta - originale - laserjet - cartuccia toner (w2413a) w2413a;"Tipologia: Toner; Colore: Magenta; Quantità per confezione: Confezione da 1;";Consumabili > Cartucce e toner;[113,192];Dispositivi elettronici > accessori stampanti
153||MK_000000157450;153;Monclick;TD_MANAGER;MK_000000157450;Toner 216a - ciano - originale - laserjet - cartuccia toner (w2411a) w2411a;"Tipologia: Toner; Colore: Ciano; Quantità per confezione: Confezione da 1;";Consumabili > Cartucce e toner;[113,192];Dispositivi elettronici > accessori stampanti
153||MK_000000157454;153;Monclick;TD_MANAGER;MK_000000157454;Toner 216a - nero - originale - laserjet - cartuccia toner (w2410a) w2410a;"Tipologia: Toner; Colore: Nero; Quantità per confezione: Confezione da 1;";Consumabili > Cartucce e toner;[113,192];Dispositivi elettronici > accessori stampanti
153||MK_000000157457;153;Monclick;TD_MANAGER;MK_000000157457;Toner 207a - nero - originale - laserjet - cartuccia toner (w2210a) w2210a;"Tipologia: Toner; Colore: Nero; Quantità per confezione: Confezione da 1;";Consumabili > Cartucce e toner;[113,192];Dispositivi elettronici > accessori stampanti
153||MK_000000157488;153;Monclick;TD_MANAGER;MK_000000157488;Nas Array unità disco rigido tl-r400s;"N dischi inclusi: 0; Capacità totale dischi inclusi: n.d.; Interfaccia: n.d.; Livello RAID: JBOD;";Networking e Wireless > NAS e storage di rete;[111,189];Casa e giardino > Sistemi di allarme
153||MK_000000157501;153;Monclick;TD_MANAGER;MK_000000157501;Nas Array unità disco rigido tl-r1200c-rp;"N dischi inclusi: 0; Capacità totale dischi inclusi: n.d.; Interfaccia: n.d.; Livello RAID: JBOD;";Networking e Wireless > NAS e storage di rete;[111,189];Casa e giardino > Sistemi di allarme
153||MK_000000157508;153;Monclick;TD_MANAGER;MK_000000157508;Rasoio elettrico Serie 3 300S Cordless Autonomia 30 minuti;"Batteria ricaricabile: Sì; Autonomia: 30 min; Utilizzo: Asciutto; Tipo rasoio: Lamina; Numero testine/lame: 3; Serie: Serie 3; Modello: 300S;";Salute e Bellezza > Rasoi elettrici;[122,216];Salute e bellezza > cura dei capelli
153||MK_000000157510;153;Monclick;TD_MANAGER;MK_000000157510;Epilatore Silk-épil 3 3-440 epilatore Rosa, Bianco 20 pinzette;"Metodo d'epilazione: 20 pinzette; Impulsi di luce: Non presenti; N. velocità: 2; Batteria ricaricabile: No;";Salute e Bellezza > Epilatori;[122,211];Salute e bellezza > Apparecchiature mediche
153||MK_000000157511;153;Monclick;TD_MANAGER;MK_000000157511;Epilatore Silk-épil 5 SE5610 Epilatore Wet & Dry;"Metodo d'epilazione: 28 pinzette; Impulsi di luce: Non presenti; N. velocità: 2; Batteria ricaricabile: Sì;";Salute e Bellezza > Epilatori;[122,211];Salute e bellezza > Apparecchiature mediche
153||MK_000000157513;153;Monclick;TD_MANAGER;MK_000000157513;Epilatore Silk-épil 5/820 Wet & Dry;"Metodo d'epilazione: Pinzette; Impulsi di luce: Non presenti; N. velocità: 2; Batteria ricaricabile: Sì;";Salute e Bellezza > Epilatori;[122,211];Salute e bellezza > Apparecchiature mediche
153||MK_000000157514;153;Monclick;TD_MANAGER;MK_000000157514;Epilatore Silk-épil 9 Flex 9-002 Wet & Dry;"Metodo d'epilazione: 40 pinzette; Impulsi di luce: Non presenti; N. velocità: 2; Batteria ricaricabile: Sì;";Salute e Bellezza > Epilatori;[122,211];Salute e bellezza > Apparecchiature mediche
153||MK_000000157516;153;Monclick;TD_MANAGER;MK_000000157516;Epilatore Silk-épil 9 Flex 9-300 Beauty Set;"Metodo d'epilazione: 40 pinzette; Impulsi di luce: Non presenti; N. velocità: 1; Batteria ricaricabile: Sì;";Salute e Bellezza > Epilatori;[122,211];Salute e bellezza > Apparecchiature mediche
153||MK_000000157533;153;Monclick;TD_MANAGER;MK_000000157533;Tagliere rettangolare in legno con 18287;"Tipologia: Tagliere;";Casalinghi > Accessori da cucina;[113,190];Dispositivi elettronici > accessori
153||MK_000000157555;153;Monclick;TD_MANAGER;MK_000000157555;Cover CLEAR COVER TRANSPARENT S20;"Tipologia: Cover posteriore; Compatibilità: n.d.; Colore: Trasparente;";Accessori > Cover;[113,193];Dispositivi elettronici > accessori telefoni cellulari
153||MK_000000157558;153;Monclick;TD_MANAGER;MK_000000157558;Cover KVADRAT COVER GREEN S20 PLUS;"Tipologia: Cover posteriore; Compatibilità: n.d.; Colore: Verde;";Accessori > Cover;[113,193];Dispositivi elettronici > accessori telefoni cellulari
153||MK_000000157560;153;Monclick;TD_MANAGER;MK_000000157560;Cover CLEAR VIEW COVER GRAY S20;"Tipologia: Cover posteriore; Compatibilità: n.d.; Colore: Grigio;";Accessori > Cover;[113,193];Dispositivi elettronici > accessori telefoni cellulari
153||MK_000000157564;153;Monclick;TD_MANAGER;MK_000000157564;Cover CLEAR VIEW COVER GRAY S20 ULTRA;"Tipologia: Cover posteriore; Compatibilità: n.d.; Colore: Grigio;";Accessori > Cover;[113,193];Dispositivi elettronici > accessori telefoni cellulari
153||MK_000000157571;153;Monclick;TD_MANAGER;MK_000000157571;Piano cottura a induzione SI2741D 4 Zone cottura Larghezza 75 cm;"N zone cottura: 4; Larghezza piano: 75 cm; Larghezza incasso: 56 cm; Profondità piano: 51.5 cm; Profondità incasso: 48 cm; Materiale piano: Vetroceramica; Colore: Nero; Modello: SI2741D;";Elettrodomestici da incasso > Piani cottura a induzione;[114,209];Elettrodomestici > Grandi elettrodomestici
153||MK_000000157584;153;Monclick;TD_MANAGER;MK_000000157584;Memoria RAM Hpe smartmemory - ddr4 - modulo - 64 gb - lrdimm a 288 pin p00926-b21;"Tecnologia: DDR4 SDRAM; Capacità: 64 GB; Clock: 2933 MHz; Tipo modulo: LRDIMM a 288 pin; Nome modulo: PC4-23400; Error checking: ECC; Ampiezza modulo: Load-Reduced;";HDD e Componenti PC > Memorie RAM;[113,191];Dispositivi elettronici > accessori computer e tablet
153||MK_000000157595;153;Monclick;TD_MANAGER;MK_000000157595;Led s-box snow-jmu - lettore di segnaletica digitale sbb-snowjmu/en;"Compatibilità: TV/Monitor; Tipologia: n.d.; Dimensione schermo: Non presente;";Accessori > Staffe e supporti;[113,193];Dispositivi elettronici > accessori telefoni cellulari
153||MK_000000157628;153;Monclick;TD_MANAGER;MK_000000157628;Cassetto carta Epsonnet ps107 - server di stampa - 10/100 ethernet 1620202;"Tipologia: Server di stampa;";Accessori > Accessori per stampanti;[113,192];Dispositivi elettronici > accessori stampanti
153||MK_000000157650;153;Monclick;TD_MANAGER;MK_000000157650;Prolunga alimentazione - iec 60320 c13 a iec 60320 c14 4l67a08371;"Tipologia: Prolunga alimentazione;";Accessori > Accessori server e networking;[113,191];Dispositivi elettronici > accessori computer e tablet
153||MK_000000157657;153;Monclick;TD_MANAGER;MK_000000157657;Videoproiettore X128HP 1024 x 768 pixels Proiettore DLP 3D 4000 Lumen;"Risoluzione nativa: 1024 x 768 pixels; Tecnologia: Proiettore DLP; 3D: Sì; Luminosità: 4000 lumen; Durata lampada: 6000 ore; Colore: Nero; Modello: X128HP;";TV LED e Video > Videoproiettori;[113,205];Dispositivi elettronici > video
153||MK_000000157666;153;Monclick;TD_MANAGER;MK_000000157666;Mouse Mouse - bluetooth 3.0 - nero nxmobt1001;"Connettività: Wireless; Interfaccia: Bluetooth 3.0; Tecnologia: Ottica; Colore: Nero;";Monitor e Periferiche PC > Mouse;[113,191];Dispositivi elettronici > accessori computer e tablet
153||MK_000000157675;153;Monclick;TD_MANAGER;MK_000000157675;Mouse Mouse - 2.4 ghz, wi-fi - nero nxmowi2002;"Connettività: Wireless; Interfaccia: 2.4 GHz, Wi-Fi; Tecnologia: Ottica; Colore: Nero, Rosso;";Monitor e Periferiche PC > Mouse;[113,191];Dispositivi elettronici > accessori computer e tablet
153||MK_000000157701;153;Monclick;TD_MANAGER;MK_000000157701;Switch Xgs1010-12 - switch - 12 porte xgs1010-12-zz0101f;"N porte LAN: 12; Gestibile: n.d.; Standard: 2.5 Gigabit Ethernet; PoE: No; Formato: Desktop, Montaggio a parete;";Networking e Wireless > Switch;[111,189];Casa e giardino > Sistemi di allarme
153||MK_000000157706;153;Monclick;TD_MANAGER;MK_000000157706;Cartuccia T02q - magenta - originale - cartuccia d'inchiostro c13t02q300;"Tipologia: Cartuccia inchiostro; Colore: Magenta; Quantità per confezione: Confezione da 1;";Consumabili > Cartucce e toner;[113,192];Dispositivi elettronici > accessori stampanti
153||MK_000000157718;153;Monclick;TD_MANAGER;MK_000000157718;Cartuccia T02q - giallo - originale - cartuccia d'inchiostro c13t02q400;"Tipologia: Cartuccia inchiostro; Colore: Giallo; Quantità per confezione: Confezione da 1;";Consumabili > Cartucce e toner;[113,192];Dispositivi elettronici > accessori stampanti
153||MK_000000153918;153;Monclick;TD_MANAGER;MK_000000153918;Hp yellow contract original cf332ah;"Tipologia: n.d.; Colore: n.d.; Quantità per confezione: Confezione da 1;";Consumabili > Cartucce e toner;[113,192];Dispositivi elettronici > accessori stampanti
153||MK_000000153922;153;Monclick;TD_MANAGER;MK_000000153922;Hp black contract original q7551xh;"Tipologia: n.d.; Colore: Nero; Quantità per confezione: Confezione da 1;";Consumabili > Cartucce e toner;[113,192];Dispositivi elettronici > accessori stampanti
153||MK_000000153931;153;Monclick;TD_MANAGER;MK_000000153931;Hp magenta contract origina ce403yh;"Tipologia: n.d.; Colore: n.d.; Quantità per confezione: Confezione da 1;";Consumabili > Cartucce e toner;[113,192];Dispositivi elettronici > accessori stampanti
153||MK_000000153945;153;Monclick;TD_MANAGER;MK_000000153945;Hp black contract original cf360xh;"Tipologia: n.d.; Colore: Nero; Quantità per confezione: Confezione da 1;";Consumabili > Cartucce e toner;[113,192];Dispositivi elettronici > accessori stampanti
153||MK_000000153959;153;Monclick;TD_MANAGER;MK_000000153959;Penna Pen - penna punta in fibra - morbido - marrone (pacchetto di 12) f830729;"Quantità per confezione: 12; Tipologia: Penna punta in fibra; Colore: Marrone; Tipo inchiostro: Inchiostro base acqua;";Prodotti per scuola e ufficio > Penne;[111,188];Casa e giardino > sicurezza
153||MK_000000153963;153;Monclick;TD_MANAGER;MK_000000153963;Princess 15 cm;"Età minima: 3; Linea prodotto: Bambola; Personaggio/Tema: Pincipesse; Numero pezzi: 1;";Giochi e Console > Giocattoli e Costruzioni;[113,206];Dispositivi elettronici > videogiochi
153||MK_000000153982;153;Monclick;TD_MANAGER;MK_000000153982;Gormiti - pupazzetto gre15000;"Età minima: 4 anni; Linea prodotto: Gormiti; Personaggio/Tema: n.d.; Numero pezzi: n.d.;";Giochi e Console > Giocattoli e Costruzioni;[113,206];Dispositivi elettronici > videogiochi
153||MK_000000153987;153;Monclick;TD_MANAGER;MK_000000153987;Amore Mio - Appena Nato;"Età minima: 3; Linea prodotto: Bambola; Personaggio/Tema: Amore Mio; Numero pezzi: n.d.;";Giochi e Console > Giocattoli e Costruzioni;[113,206];Dispositivi elettronici > videogiochi
153||MK_000000153992;153;Monclick;TD_MANAGER;MK_000000153992;Baby senses - fattoria numerica 977800;"Età minima: 6 mesi; Linea prodotto: Baby Senses; Personaggio/Tema: n.d.; Numero pezzi: n.d.;";Giochi e Console > Giocattoli e Costruzioni;[113,206];Dispositivi elettronici > videogiochi
153||MK_000000154051;153;Monclick;TD_MANAGER;MK_000000154051;Server Hpe proliant dl385 gen10 plus - montabile in rack - epyc 7702 2 ghz p07597-b21;"Formato: Montabile in rack; Processore: AMD; Modello Processore: 7702; N Core: 64 processori; N processori inclusi: 1; N processori max: 2; RAM installata: 32 GB; Livelli RAID supportati: 10ADM, 1ADM, RAID 0, RAID 1, RAID 10, RAID 5, RAID 50, RAID 6, RAID 60; Capacità hard disk: 0 GB; N dischi max: 24; Tipologia hard disk: Nessun HDD;";PC Notebook e Tablet > Server;[113,197];Dispositivi elettronici > computer e tablet
153||MK_000000154061;153;Monclick;TD_MANAGER;MK_000000154061;Hard disk interno Hpe enterprise - hdd - 900 gb - sas 12gb/s (pacchetto di 6) r0p89a;"Capacità: 900 GB; Formato: 2.5''; Interfaccia: Serial Attached SCSI 3; Velocità di rotazione: 15000 rpm; Velocità di trasferimento dati: 1.2 GBps;";HDD e Componenti PC > Hard disk interni;[113,191];Dispositivi elettronici > accessori computer e tablet
153||MK_000000154094;153;Monclick;TD_MANAGER;MK_000000154094;Gruppo di continuità Fan option kit - kit ventola del sistema del cabinet 4f17a12353;"Potenza erogata: n.d.; Capacità di alimentazione: n.d.; Durata batteria: n.d.; N spine connettibili: n.d.;";Networking e Wireless > Gruppi di continuità;[111,189];Casa e giardino > Sistemi di allarme
153||MK_000000154113;153;Monclick;TD_MANAGER;MK_000000154113;Pc All-In-One V241FAK-WA129T 23,8'' Core i5 RAM 8GB SSD 512GB;"Dimensione schermo: 23,8 ''; Tipo Processore: Intel Core i5; Sistema operativo: Windows 10 Home; Touchscreen: No; Scheda grafica: Intel UHD Graphics 620; Modello processore: i5-8265U; Scheda grafica dedicata: Integrata; Memoria RAM: 8 GB; Capacità hard disk: 512 GB; Tipo hard disk: SSD; Risoluzione: 1920 x 1080 Pixels; Peso: 5,1 Kg;";PC Notebook e Tablet > PC All-In-One;[113,197];Dispositivi elettronici > computer e tablet
153||MK_000000154121;153;Monclick;TD_MANAGER;MK_000000154121;Monitor LED Hl series - monitor a led - full hd (1080p) - 15.6'' hl161cgb;"Tipo display: Monitor LCD con retroilluminazione a LED; Pollici: 15,6 ''; Risoluzione: 1920 x 1080 Pixel; Formato: 4:3; Tecnologia pannello: ADS-IPS; Touchscreen: No; Uscita audio: Altoparlanti; Regolazione posizione: No; Wi-Fi: Nessuna; Luminosità: n.d.; Tempo di risposta: 15 ms;";Monitor e Periferiche PC > Monitor PC;[113,191];Dispositivi elettronici > accessori computer e tablet
153||MK_000000154170;153;Monclick;TD_MANAGER;MK_000000154170;Cf5marcat x lavagne e90 2-3mm ass e90/5s002;"Tipologia: n.d.; Colore: n.d.; Quantità per confezione: n.d.;";Prodotti per scuola e ufficio > Pastelli e pennarelli;[111,188];Casa e giardino > sicurezza
153||MK_000000154172;153;Monclick;TD_MANAGER;MK_000000154172;Bls marcatore x lavagne e90 nero e-90/1001;"Tipologia: n.d.; Colore: n.d.; Quantità per confezione: n.d.;";Prodotti per scuola e ufficio > Pastelli e pennarelli;[111,188];Casa e giardino > sicurezza
153||MK_000000154177;153;Monclick;TD_MANAGER;MK_000000154177;Bls marcatore lavagne e90 bianco e-90/1049;"Tipologia: n.d.; Colore: n.d.; Quantità per confezione: n.d.;";Prodotti per scuola e ufficio > Pastelli e pennarelli;[111,188];Casa e giardino > sicurezza
153||MK_000000154180;153;Monclick;TD_MANAGER;MK_000000154180;Easyoriginal - refill (pacchetto di 3) 6890/046;"Tipologia: n.d.; Quantità per confezione: 3;";Prodotti per scuola e ufficio > Colle e nastri adesivi;[111,188];Casa e giardino > sicurezza
