Identification;EshopId;EshopName;ManagerClassName;ProductItemId;Name;Description;SearchCategoryKey;CategoryId;CategoryDesc
153||EL379SB;153;Monclick;TD_MANAGER;EL379SB;Calcolatrice Elsi mate el-379sb - calcolatrice tascabile sh-el379sb;"Tipologia: Calcolatrice tascabile; Alimentazione: Batteria, Pannello solare; N cifre display: 12;";Prodotti per scuola e ufficio > Calcolatrici;[111,188];Casa e giardino > sicurezza
153||EL4530;153;Monclick;TD_MANAGER;EL4530;Squadra Elastika - squadra el4530;"Tipologia: Squadra; Quantità per confezione: 1;";Prodotti per scuola e ufficio > Strumenti per disegno tecnico;[111,188];Casa e giardino > sicurezza
153||EL50;153;Monclick;TD_MANAGER;EL50;Riga Elastika - righello el50;"Tipologia: Righello; Quantità per confezione: 1;";Prodotti per scuola e ufficio > Strumenti per disegno tecnico;[111,188];Casa e giardino > sicurezza
153||EL500DIN;153;Monclick;TD_MANAGER;EL500DIN;Gruppo di continuità Ellipse eco 500 din - ups - 300 watt - 500 va el500din;"Potenza erogata: 300 Watt; Capacità di alimentazione: 500 VA; Durata batteria: 9 min; N spine connettibili: 4;";Networking e Wireless > Gruppi di continuità;[111,189];Casa e giardino > Sistemi di allarme
153||EL500IEC;153;Monclick;TD_MANAGER;EL500IEC;Gruppo di continuità Ellipse eco 500 iec - ups - 300 watt - 500 va el500iec;"Potenza erogata: 300 Watt; Capacità di alimentazione: 500 VA; Durata batteria: 9 min; N spine connettibili: 4;";Networking e Wireless > Gruppi di continuità;[111,189];Casa e giardino > Sistemi di allarme
153||EL_501XBGR;153;Monclick;TD_MANAGER;EL_501XBGR;Calcolatrice El-501xbgr - calcolatrice scientifica sh-el501xbgr;"Tipologia: Calcolatrice scientifica; Alimentazione: Batteria; N cifre display: 10;";Prodotti per scuola e ufficio > Calcolatrici;[111,188];Casa e giardino > sicurezza
153||EL501XBWH;153;Monclick;TD_MANAGER;EL501XBWH;Calcolatrice El-501x - calcolatrice scientifica sh-el501xbwh;"Tipologia: Calcolatrice scientifica; Alimentazione: Batteria; N cifre display: 8;";Prodotti per scuola e ufficio > Calcolatrici;[111,188];Casa e giardino > sicurezza
153||EL509XB_VL;153;Monclick;TD_MANAGER;EL509XB_VL;Calcolatrice El-509xb - calcolatrice scientifica el509xb-vl;"Tipologia: Calcolatrice scientifica; Alimentazione: Batteria; N cifre display: 10;";Prodotti per scuola e ufficio > Calcolatrici;[111,188];Casa e giardino > sicurezza
153||EL510RNB;153;Monclick;TD_MANAGER;EL510RNB;Calcolatrice Sh-el510rnb;"Tipologia: n.d.; Alimentazione: n.d.; N cifre display: n.d.;";Prodotti per scuola e ufficio > Calcolatrici;[111,188];Casa e giardino > sicurezza
153||EL520XB_VL;153;Monclick;TD_MANAGER;EL520XB_VL;Calcolatrice El-520xb - calcolatrice scientifica el520xb-vl;"Tipologia: Calcolatrice scientifica; Alimentazione: Batteria, Pannello solare; N cifre display: 10;";Prodotti per scuola e ufficio > Calcolatrici;[111,188];Casa e giardino > sicurezza
153||EL520XB_WH;153;Monclick;TD_MANAGER;EL520XB_WH;Calcolatrice El-520xbwh - calcolatrice scientifica sh-el520xbwh;"Tipologia: Calcolatrice scientifica; Alimentazione: Batteria, Pannello solare; N cifre display: 12;";Prodotti per scuola e ufficio > Calcolatrici;[111,188];Casa e giardino > sicurezza
153||EL520XB_YL;153;Monclick;TD_MANAGER;EL520XB_YL;Calcolatrice El 520xb el520xb-yl;"Tipologia: n.d.; Alimentazione: n.d.; N cifre display: n.d.;";Prodotti per scuola e ufficio > Calcolatrici;[111,188];Casa e giardino > sicurezza
153||EL60;153;Monclick;TD_MANAGER;EL60;Riga Elastika - righello el60;"Tipologia: Righello; Quantità per confezione: 1;";Prodotti per scuola e ufficio > Strumenti per disegno tecnico;[111,188];Casa e giardino > sicurezza
153||EL6030;153;Monclick;TD_MANAGER;EL6030;Squadra Elastika - squadra el6030;"Tipologia: Squadra; Quantità per confezione: 1;";Prodotti per scuola e ufficio > Strumenti per disegno tecnico;[111,188];Casa e giardino > sicurezza
153||EL650DIN;153;Monclick;TD_MANAGER;EL650DIN;Gruppo di continuità Ellipse eco 650 din - ups - 400 watt - 650 va el650din;"Potenza erogata: 400 Watt; Capacità di alimentazione: 650 VA; Durata batteria: 9 min; N spine connettibili: 4;";Networking e Wireless > Gruppi di continuità;[111,189];Casa e giardino > Sistemi di allarme
153||EL650IEC;153;Monclick;TD_MANAGER;EL650IEC;Gruppo di continuità Ellipse eco 650 iec - ups - 400 watt - 650 va el650iec;"Potenza erogata: 400 Watt; Capacità di alimentazione: 650 VA; Durata batteria: 9 min; N spine connettibili: 4;";Networking e Wireless > Gruppi di continuità;[111,189];Casa e giardino > Sistemi di allarme
153||EL650USBDIN;153;Monclick;TD_MANAGER;EL650USBDIN;Gruppo di continuità Ellipse eco 650 usb din - ups - 400 watt - 650 va el650usbdin;"Potenza erogata: 400 Watt; Capacità di alimentazione: 650 VA; Durata batteria: 9 min; N spine connettibili: 4;";Networking e Wireless > Gruppi di continuità;[111,189];Casa e giardino > Sistemi di allarme
153||EL650USBIEC;153;Monclick;TD_MANAGER;EL650USBIEC;Gruppo di continuità Ellipse eco 650 usb iec - ups - 400 watt - 650 va el650usbiec;"Potenza erogata: 400 Watt; Capacità di alimentazione: 650 VA; Durata batteria: 9 min; N spine connettibili: 4;";Networking e Wireless > Gruppi di continuità;[111,189];Casa e giardino > Sistemi di allarme
153||EL800USBDIN;153;Monclick;TD_MANAGER;EL800USBDIN;Gruppo di continuità Ellipse eco 800 usb din - ups - 500 watt - 800 va el800usbdin;"Potenza erogata: 500 Watt; Capacità di alimentazione: 800 VA; Durata batteria: 11 min; N spine connettibili: 4;";Networking e Wireless > Gruppi di continuità;[111,189];Casa e giardino > Sistemi di allarme
153||EL800USBIEC;153;Monclick;TD_MANAGER;EL800USBIEC;Gruppo di continuità Ellipse eco 800 usb iec - ups - 500 watt - 800 va el800usbiec;"Potenza erogata: 500 Watt; Capacità di alimentazione: 800 VA; Durata batteria: 11 min; N spine connettibili: 4;";Networking e Wireless > Gruppi di continuità;[111,189];Casa e giardino > Sistemi di allarme
153||ELG_00006;153;Monclick;TD_MANAGER;ELG_00006;Mouse Arc mouse - mouse - bluetooth 4.1 le - nero elg-00006;"Connettività: Wireless; Interfaccia: Bluetooth 4.1 LE; Tecnologia: Ottica; Colore: Nero;";Monitor e Periferiche PC > Mouse;[113,191];Dispositivi elettronici > accessori computer e tablet
153||ELM332BBL;153;Monclick;TD_MANAGER;ELM332BBL;Calcolatrice Elsi mate el-m332bbl - calcolatrice da tavolo sh-elm332bbl;"Tipologia: Calcolatrice da tavolo; Alimentazione: Batteria, Pannello solare; N cifre display: 10;";Prodotti per scuola e ufficio > Calcolatrici;[111,188];Casa e giardino > sicurezza
153||ELM332BPK;153;Monclick;TD_MANAGER;ELM332BPK;Calcolatrice Elsi mate el-m332bpk - calcolatrice da tavolo sh-elm332bpk;"Tipologia: Calcolatrice da tavolo; Alimentazione: Batteria, Pannello solare; N cifre display: 10;";Prodotti per scuola e ufficio > Calcolatrici;[111,188];Casa e giardino > sicurezza
153||ELM332BWH;153;Monclick;TD_MANAGER;ELM332BWH;Calcolatrice Elsi mate el-m332bwh - calcolatrice da tavolo sh-elm332bwh;"Tipologia: Calcolatrice da tavolo; Alimentazione: Batteria, Pannello solare; N cifre display: 10;";Prodotti per scuola e ufficio > Calcolatrici;[111,188];Casa e giardino > sicurezza
153||ELM332BYL;153;Monclick;TD_MANAGER;ELM332BYL;Calcolatrice Elsi mate el-m332byl - calcolatrice da tavolo sh-elm332byl;"Tipologia: Calcolatrice da tavolo; Alimentazione: Batteria, Pannello solare; N cifre display: 10;";Prodotti per scuola e ufficio > Calcolatrici;[111,188];Casa e giardino > sicurezza
153||ELN0626CABINANE;153;Monclick;TD_MANAGER;ELN0626CABINANE;Trolley Cabina 36.5x22x55.5 cm semirigido ultra leggera Nero;"Tipologia: Trolley; Colore: Nero;";Tempo libero > Trolley e articoli da viaggio;[126];Veicoli elettrici
153||ELN0918CABINABL;153;Monclick;TD_MANAGER;ELN0918CABINABL;Trolley semi rigida cabina Blu Oltremare 54,5 x 37,5 x 24 cm;"Tipologia: Trolley; Colore: Blu;";Tempo libero > Trolley e articoli da viaggio;[126];Veicoli elettrici
153||ELN0918CABINANE;153;Monclick;TD_MANAGER;ELN0918CABINANE;Trolley Valigia trolley semi rigida cabina Nera 54,5 x 37,5 x 24 cm;"Tipologia: Trolley; Colore: Nero;";Tempo libero > Trolley e articoli da viaggio;[126];Veicoli elettrici
153||ELNA9280CABINAA;153;Monclick;TD_MANAGER;ELNA9280CABINAA;Valigia Trolley da Cabina Azzurro con combinazione 40 x 20 x 55 cm;"Tipologia: Trolley; Colore: Azzurro;";Tempo libero > Trolley e articoli da viaggio;[126];Veicoli elettrici
153||ELNA9280CABINAG;153;Monclick;TD_MANAGER;ELNA9280CABINAG;Valigia Trolley da cabina, colore giallo 40 x 20 x 55 cm;"Tipologia: Trolley; Colore: Giallo;";Tempo libero > Trolley e articoli da viaggio;[126];Veicoli elettrici
153||ELNA9280CABINAR;153;Monclick;TD_MANAGER;ELNA9280CABINAR;Trolley Cabina Rosso 40 x 20 x 55 cm;"Tipologia: Trolley; Colore: Corallo;";Tempo libero > Trolley e articoli da viaggio;[126];Veicoli elettrici
153||ELNA_9369GIRL;153;Monclick;TD_MANAGER;ELNA_9369GIRL;Borsa trolley A-9369 GIRL valigia Rosa Fantasia;"Tipologia: Trolley; Colore: Fantasia;";Tempo libero > Trolley e articoli da viaggio;[126];Veicoli elettrici
153||ELNA9369KID;153;Monclick;TD_MANAGER;ELNA9369KID;Borsa trolley A-9369 KID valigia Verde Trolley cavalcabile - per bambini - Fantasia;"Tipologia: Trolley; Colore: Fantasia;";Tempo libero > Trolley e articoli da viaggio;[126];Veicoli elettrici
153||ELNDUOA9123ACQU;153;Monclick;TD_MANAGER;ELNDUOA9123ACQU;Set 2 Trolley Rigidi Blu Valigia 2 67x45x25cm - Valigia 1 56x38x22.5cm;"Tipologia: Trolley; Colore: Blu;";Tempo libero > Trolley e articoli da viaggio;[126];Veicoli elettrici
153||ELNDUOTM0918BLU;153;Monclick;TD_MANAGER;ELNDUOTM0918BLU;Set 2 trolley 20'' e 24'' semi rigidi Blu;"Tipologia: Trolley; Colore: Blu;";Tempo libero > Trolley e articoli da viaggio;[126];Veicoli elettrici
153||ELP1200DIN;153;Monclick;TD_MANAGER;ELP1200DIN;Gruppo di continuità Ellipse pro 1200 - ups - 750 watt - 1200 va elp1200din;"Potenza erogata: 750 Watt; Capacità di alimentazione: 1200 VA; Durata batteria: 9 min; N spine connettibili: 8;";Networking e Wireless > Gruppi di continuità;[111,189];Casa e giardino > Sistemi di allarme
153||ELP1200IEC;153;Monclick;TD_MANAGER;ELP1200IEC;Gruppo di continuità Ellipse pro 1200 - ups - 750 watt - 1200 va elp1200iec;"Potenza erogata: 750 Watt; Capacità di alimentazione: 1200 VA; Durata batteria: 9 min; N spine connettibili: 8;";Networking e Wireless > Gruppi di continuità;[111,189];Casa e giardino > Sistemi di allarme
153||ELP1600DIN;153;Monclick;TD_MANAGER;ELP1600DIN;Gruppo di continuità Ellipse pro 1600 - ups - 1000 watt - 1600 va elp1600din;"Potenza erogata: 1000 Watt; Capacità di alimentazione: 1600 VA; Durata batteria: 9 min; N spine connettibili: 8;";Networking e Wireless > Gruppi di continuità;[111,189];Casa e giardino > Sistemi di allarme
153||ELP1600IEC;153;Monclick;TD_MANAGER;ELP1600IEC;Gruppo di continuità Ellipse pro 1600 - ups - 1000 watt - 1600 va elp1600iec;"Potenza erogata: 1000 Watt; Capacità di alimentazione: 1600 VA; Durata batteria: 9 min; N spine connettibili: 8;";Networking e Wireless > Gruppi di continuità;[111,189];Casa e giardino > Sistemi di allarme
153||ELP650DIN;153;Monclick;TD_MANAGER;ELP650DIN;Gruppo di continuità Ellipse pro 650 - ups - 400 watt - 650 va elp650din;"Potenza erogata: 400 Watt; Capacità di alimentazione: 650 VA; Durata batteria: 9 min; N spine connettibili: 4;";Networking e Wireless > Gruppi di continuità;[111,189];Casa e giardino > Sistemi di allarme
153||E530501;153;Monclick;TD_MANAGER;E530501;Raccoglitore RACCOLGITORE PRESTIGE 4R 22X30 BLU;"Tipologia: Quaderno ad anelli; Quantità per confezione: 1;";Prodotti per scuola e ufficio > Raccoglitori, classificatori e valigette;[111,188];Casa e giardino > sicurezza
153||E3000_002;153;Monclick;TD_MANAGER;E3000_002;Pennarello 3000 Permanent Marker Red CF 10pz;"Tipologia: Marcatori; Colore: Rosso; Quantità per confezione: 10;";Prodotti per scuola e ufficio > Pastelli e pennarelli;[111,188];Casa e giardino > sicurezza
153||E5350;153;Monclick;TD_MANAGER;E5350;Modulistica Modulo prima nota - 50 fogli - 220 x 300 mm - duplicato e5350;"Tipologia: Modulo prima nota; Quantità: 10;";Prodotti per scuola e ufficio > Modulistica;[111,188];Casa e giardino > sicurezza
153||E5356A;153;Monclick;TD_MANAGER;E5356A;Modulistica Modulo prima nota - 50 fogli - 210 x 310 mm - duplicato e5356a;"Tipologia: Modulo prima nota; Quantità: 10;";Prodotti per scuola e ufficio > Modulistica;[111,188];Casa e giardino > sicurezza
153||E5406NEW;153;Monclick;TD_MANAGER;E5406NEW;Modulistica Blocco numerazione - 100 fogli - 130 x 60 mm e5406new;"Tipologia: Blocco numerazione; Quantità: 50;";Prodotti per scuola e ufficio > Modulistica;[111,188];Casa e giardino > sicurezza
153||E550003;153;Monclick;TD_MANAGER;E550003;Marcatore 550 - marcatore - blu 4-550 003;"Tipologia: Marcatori; Colore: Blu; Quantità per confezione: 10;";Prodotti per scuola e ufficio > Pastelli e pennarelli;[111,188];Casa e giardino > sicurezza
153||E5504C;153;Monclick;TD_MANAGER;E5504C;Modulistica Blocco ricevuta d'affitto - 50 fogli - 170 x 99 mm - duplicato e5504c;"Tipologia: Blocco ricevuta d'affitto; Quantità: 10;";Prodotti per scuola e ufficio > Modulistica;[111,188];Casa e giardino > sicurezza
153||E5547CT;153;Monclick;TD_MANAGER;E5547CT;Modulistica Blocco ricevute condiminiali - 33 fogli - 99 x 170 mm - tripla e5547ct;"Tipologia: Blocco ricevute condiminiali; Quantità: 10;";Prodotti per scuola e ufficio > Modulistica;[111,188];Casa e giardino > sicurezza
153||E5561;153;Monclick;TD_MANAGER;E5561;Modulistica Cf20 blocco ric. generiche 50 fg e5561;"Tipologia: n.d.; Quantità: n.d.;";Prodotti per scuola e ufficio > Modulistica;[111,188];Casa e giardino > sicurezza
153||E5562;153;Monclick;TD_MANAGER;E5562;Modulistica Cf10 blocco ric. generiche 100 fg e5562;"Tipologia: n.d.; Quantità: 10;";Prodotti per scuola e ufficio > Modulistica;[111,188];Casa e giardino > sicurezza
153||E5564CT;153;Monclick;TD_MANAGER;E5564CT;Modulistica Modulo per ricetta generica - 33 fogli - 99 x 170 mm - tripla e5564ct;"Tipologia: Modulo per ricetta generica; Quantità: 10;";Prodotti per scuola e ufficio > Modulistica;[111,188];Casa e giardino > sicurezza
153||E5567C;153;Monclick;TD_MANAGER;E5567C;Modulistica Blocco ricevuta di pagamento delle attività sportive - 50 fogli e5567c;"Tipologia: Blocco ricevuta di pagamento delle attività sportive; Quantità: 10;";Prodotti per scuola e ufficio > Modulistica;[111,188];Casa e giardino > sicurezza
153||E_55_BLS2;153;Monclick;TD_MANAGER;E_55_BLS2;Timbro Cf2ricambio e/55 e55.bls;"Tipologia: n.d.; Quantità per confezione: 2;";Prodotti per scuola e ufficio > Timbri;[111,188];Casa e giardino > sicurezza
153||E5673A;153;Monclick;TD_MANAGER;E5673A;Modulistica Blocco ordini - 50 fogli - 170 x 99 mm - duplicato e5673a;"Tipologia: Blocco ordini; Quantità: 10;";Prodotti per scuola e ufficio > Modulistica;[111,188];Casa e giardino > sicurezza
153||E5777;153;Monclick;TD_MANAGER;E5777;Modulistica BLOCCO BUSTA NOTA SPESA 25 BUSTE;"Tipologia: Blocco nota spese; Quantità: 10;";Prodotti per scuola e ufficio > Modulistica;[111,188];Casa e giardino > sicurezza
153||E5853A;153;Monclick;TD_MANAGER;E5853A;Modulistica Cf10blocco prescrizioni mediche e5853a;"Tipologia: n.d.; Quantità: 10;";Prodotti per scuola e ufficio > Modulistica;[111,188];Casa e giardino > sicurezza
153||E5859A;153;Monclick;TD_MANAGER;E5859A;Modulistica Blocco rendiconto di costruzione - 50 fogli - 297 x 220 mm e5859a;"Tipologia: Blocco rendiconto di costruzione; Quantità: 10;";Prodotti per scuola e ufficio > Modulistica;[111,188];Casa e giardino > sicurezza
153||E5913;153;Monclick;TD_MANAGER;E5913;Modulistica Blocco di comando - 25 fogli - 99 x 170 mm - duplicato e5913;"Tipologia: Blocco di comando; Quantità: 1;";Prodotti per scuola e ufficio > Modulistica;[111,188];Casa e giardino > sicurezza
153||E5916BLISTER;153;Monclick;TD_MANAGER;E5916BLISTER;Modulistica E5916blister;"Tipologia: n.d.; Quantità: 10;";Prodotti per scuola e ufficio > Modulistica;[111,188];Casa e giardino > sicurezza
153||E5E78AA;153;Monclick;TD_MANAGER;E5E78AA;Tastiera K2500 - tastiera - italiana e5e78aa#abz;"Connettività: Senza fili; Interfaccia: 2.4 GHz; Layout: Italiano; Colore: Nero;";Monitor e Periferiche PC > Tastiere;[113,191];Dispositivi elettronici > accessori computer e tablet
153||E5E78AA_ABD;153;Monclick;TD_MANAGER;E5E78AA_ABD;Tastiera K2500 - tastiera - tedesca e5e78aa#abd;"Connettività: Senza fili; Interfaccia: 2.4 GHz; Layout: Tedesco; Colore: Nero;";Monitor e Periferiche PC > Tastiere;[113,191];Dispositivi elettronici > accessori computer e tablet
153||E6000RS;153;Monclick;TD_MANAGER;E6000RS;Modulistica Cf50 cart. dich. redditi rosasa e6000rs;"Tipologia: n.d.; Quantità: 50;";Prodotti per scuola e ufficio > Modulistica;[111,188];Casa e giardino > sicurezza
153||E6001BIS;153;Monclick;TD_MANAGER;E6001BIS;Modulistica Porta documenti - per 170 x 240 mm (pacchetto di 100) e6001bis;"Tipologia: Cartella matricolare; Quantità: 10;";Prodotti per scuola e ufficio > Modulistica;[111,188];Casa e giardino > sicurezza
153||E60_N;153;Monclick;TD_MANAGER;E60_N;Timbro E/60 - cartuccia d'inchiostro - nero e60.n;"Tipologia: Cartuccia d'inchiostro; Quantità per confezione: 1;";Prodotti per scuola e ufficio > Timbri;[111,188];Casa e giardino > sicurezza
153||E644A;153;Monclick;TD_MANAGER;E644A;Scatola Americane e644a;"Tipologia: n.d.; Materiale: n.d.; Quantità per confezione: n.d.; Altezza: n.d.; Larghezza: n.d.; Profondità: n.d.;";Prodotti per scuola e ufficio > Scatole;[111,188];Casa e giardino > sicurezza
153||E65BTNCBLK;153;Monclick;TD_MANAGER;E65BTNCBLK;Cuffie E65BTNC Nero;"Tipologia: Cuffie; Connettività: Senza fili; Tecnologia wireless: Bluetooth; Colore: Nero; Serie: n.d.; Modello: E65BTNC;";Home Cinema e Audio > Cuffie e auricolari;[113,196];Dispositivi elettronici > audio
153||E660004;153;Monclick;TD_MANAGER;E660004;660 - marcatore - verde 4-660 004;"Tipologia: Marcatori; Colore: n.d.; Quantità per confezione: n.d.;";Prodotti per scuola e ufficio > Pastelli e pennarelli;[111,188];Casa e giardino > sicurezza
153||E_7438;153;Monclick;TD_MANAGER;E_7438;Etichette Etichette - opaca - 60 etichette - 74 x 38 mm e-7438;"Tipologia: Etichette; Quantità inclusa: 60 etichette;";Consumabili > Etichette e rotoli;[125,234];Ufficio > Forniture per ufficio
153||E750002;153;Monclick;TD_MANAGER;E750002;Marcatore 750 paint - marcatore - rosso 4-750 002;"Tipologia: Marcatori; Colore: Rosso; Quantità per confezione: 10;";Prodotti per scuola e ufficio > Pastelli e pennarelli;[111,188];Casa e giardino > sicurezza
153||E750004;153;Monclick;TD_MANAGER;E750004;Marcatore 750 paint - marcatore - verde 4-750 004;"Tipologia: Marcatori; Colore: Verde; Quantità per confezione: 10;";Prodotti per scuola e ufficio > Pastelli e pennarelli;[111,188];Casa e giardino > sicurezza
153||E750005;153;Monclick;TD_MANAGER;E750005;Marcatore 10 Marcatori a vernice 750 Giallo;"Tipologia: Marcatori; Colore: Giallo; Quantità per confezione: 10;";Prodotti per scuola e ufficio > Pastelli e pennarelli;[111,188];Casa e giardino > sicurezza
153||E750053;153;Monclick;TD_MANAGER;E750053;Marcatore 750 paint - marcatore - oro 4-750053;"Tipologia: Marcatori; Colore: Oro; Quantità per confezione: 10;";Prodotti per scuola e ufficio > Pastelli e pennarelli;[111,188];Casa e giardino > sicurezza
153||E751001;153;Monclick;TD_MANAGER;E751001;Marcatore 751 paint - marcatore - nero 4-751 001;"Tipologia: Marcatori; Colore: Nero; Quantità per confezione: 10;";Prodotti per scuola e ufficio > Pastelli e pennarelli;[111,188];Casa e giardino > sicurezza
153||E751003;153;Monclick;TD_MANAGER;E751003;Marcatore 751 paint - marcatore - blu 4-751 003;"Tipologia: Marcatori; Colore: Blu; Quantità per confezione: 10;";Prodotti per scuola e ufficio > Pastelli e pennarelli;[111,188];Casa e giardino > sicurezza
153||E751005;153;Monclick;TD_MANAGER;E751005;10 Marcatori a vernice E 751 Giallo;"Tipologia: Marcatori; Colore: Giallo; Quantità per confezione: 10;";Prodotti per scuola e ufficio > Pastelli e pennarelli;[111,188];Casa e giardino > sicurezza
153||E751049;153;Monclick;TD_MANAGER;E751049;Marcatore 751 paint - marcatore - bianco 4-751 049;"Tipologia: Marcatori; Colore: Bianco; Quantità per confezione: 10;";Prodotti per scuola e ufficio > Pastelli e pennarelli;[111,188];Casa e giardino > sicurezza
153||E7V99A;153;Monclick;TD_MANAGER;E7V99A;Nas Hpe modular smart array 1040 dual controller lff storage e7v99a;"N dischi inclusi: 0; Capacità totale dischi inclusi: 0 TB; Interfaccia: Serial ata-600/sas; Livello RAID: RAID 0, RAID 1, RAID 10, RAID 3, RAID 5, RAID 50, RAID 6;";Networking e Wireless > NAS e storage di rete;[111,189];Casa e giardino > Sistemi di allarme
153||E7W43A;153;Monclick;TD_MANAGER;E7W43A;Hpe storeever msl2024 ultrium 6250 - biblioteca nastri - lto ultrium e7w43a;"Tipologia: Biblioteca nastri;";Accessori > Accessori server e networking;[113,191];Dispositivi elettronici > accessori computer e tablet
153||E7W46A;153;Monclick;TD_MANAGER;E7W46A;Hpe storeever 1/8 g2 ultrium 3000 - caricatore automatico nastri e7w46a;"Tipologia: Caricatore automatico nastri;";Accessori > Accessori server e networking;[113,191];Dispositivi elettronici > accessori computer e tablet
153||E800002;153;Monclick;TD_MANAGER;E800002;Marcatore 800 - marcatore - rosso 4-800 002;"Tipologia: Marcatori; Colore: Rosso; Quantità per confezione: 5;";Prodotti per scuola e ufficio > Pastelli e pennarelli;[111,188];Casa e giardino > sicurezza
153||E800003;153;Monclick;TD_MANAGER;E800003;Marcatore 800 - marcatore - blu 4-800 003;"Tipologia: Marcatori; Colore: Blu; Quantità per confezione: 5;";Prodotti per scuola e ufficio > Pastelli e pennarelli;[111,188];Casa e giardino > sicurezza
153||E803AZZ;153;Monclick;TD_MANAGER;E803AZZ;Portariviste Modula e803az;"Tipologia: n.d.;";Prodotti per scuola e ufficio > Arredo ufficio e accessori;[125,234];Ufficio > Forniture per ufficio
153||E300127701;153;Monclick;TD_MANAGER;E300127701;Pila Alkaline power batteria x 9v - alcalina e300127701;"Categoria: Batterie standard; Formato: 9V; Tipologia: Alcalina;";Consumabili > Pile;[113,199];Dispositivi elettronici > Pile
153||DN_93613_1;153;Monclick;TD_MANAGER;DN_93613_1;Adattatore Digitus professional accoppiatore di rete dn-93613-1;"Tipo connettore esterno: RJ-45; Tipo connettore interno: RJ-45;";Accessori > Adattatori;[113,190];Dispositivi elettronici > accessori
153||E300142700;153;Monclick;TD_MANAGER;E300142700;Pila Stilo Max AA Alcaline 4+4;"Categoria: Batterie standard; Formato: Tipo AA; Tipologia: Alcalina;";Consumabili > Pile;[113,199];Dispositivi elettronici > Pile
153||DN_95123;153;Monclick;TD_MANAGER;DN_95123;Digitus professional poe+ extender - ripetitore dn-95123;"Tipologia: Ripetitore;";Accessori > Accessori server e networking;[113,191];Dispositivi elettronici > accessori computer e tablet
153||E300152200;153;Monclick;TD_MANAGER;E300152200;Pila Alkaline power batteria - 2 x d - alcalina e300152200;"Categoria: Batterie standard; Formato: Tipo D; Tipologia: Alcalina;";Consumabili > Pile;[113,199];Dispositivi elettronici > Pile
153||DNHC05BK;153;Monclick;TD_MANAGER;DNHC05BK;Cartuccia Hc-05bk - alta resa - nero - originale - cartuccia d'inchiostro hc05bk;"Tipologia: Cartuccia inchiostro; Colore: Nero; Quantità per confezione: Confezione da 1;";Consumabili > Cartucce e toner;[113,192];Dispositivi elettronici > accessori stampanti
153||E300160100;153;Monclick;TD_MANAGER;E300160100;Pila Alkaline power batteria - 4 x tipo aa - alcalina e300160100;"Categoria: Batterie standard; Formato: Tipo AA; Tipologia: Alcalina;";Consumabili > Pile;[113,199];Dispositivi elettronici > Pile
153||DOCK180EUZ;153;Monclick;TD_MANAGER;DOCK180EUZ;Docking station Universal dv4k dock with power - docking station - usb-c dock180euz;"Tipologia: Docking station;";Accessori > Docking station;[113,191];Dispositivi elettronici > accessori computer e tablet
153||E300477600;153;Monclick;TD_MANAGER;E300477600;Torcia elettrica Booklite lampada per ebook reader e300477600;"Tipologia: n.d.;";Prodotti per scuola e ufficio > Torce elettriche e lenti d'ingrandimento;[111,188];Casa e giardino > sicurezza
153||DOCK412EUZ;153;Monclick;TD_MANAGER;DOCK412EUZ;Docking station Travel dock - docking station - usb-c / thunderbolt 3 dock412euz;"Tipologia: Docking station;";Accessori > Docking station;[113,191];Dispositivi elettronici > accessori computer e tablet
153||E300626500;153;Monclick;TD_MANAGER;E300626500;Pila Ministilo power plus ricaricabili 7 e300626500;"Categoria: n.d.; Formato: n.d.; Tipologia: n.d.;";Consumabili > Pile;[113,199];Dispositivi elettronici > Pile
153||DP2DVI2;153;Monclick;TD_MANAGER;DP2DVI2;Adattatore Startech.com adattatore displayport dvi dp2dvi2;"Tipo connettore esterno: DisplayPort a 20 pin; Tipo connettore interno: DVI combinato 24+5 pin;";Accessori > Adattatori;[113,190];Dispositivi elettronici > accessori
153||E300669300;153;Monclick;TD_MANAGER;E300669300;Torcia elettrica X-focus xfh21 - pila tascabile - led - luce bianca e300669300;"Tipologia: Pila tascabile;";Prodotti per scuola e ufficio > Torce elettriche e lenti d'ingrandimento;[111,188];Casa e giardino > sicurezza
153||DP2DVI2MM3;153;Monclick;TD_MANAGER;DP2DVI2MM3;Cavo DVI Startech.com cavo convertitore displayport a dvi da 91 cm dp2dvi2mm3;"Tipologia: Cavo dello schermo; Tipo connettore dx: DVI digitale 24+1 pin; Tipo connettore sx: DisplayPort a 20 pin; Lunghezza: 91.4 cm;";Accessori > Cavi audio video e HDMI;[113,205];Dispositivi elettronici > video
153||E301003900;153;Monclick;TD_MANAGER;E301003900;Pila Max e95 batteria - 2 x d - alcalina e301003900;"Categoria: Batterie standard; Formato: Tipo D; Tipologia: Alcalina;";Consumabili > Pile;[113,199];Dispositivi elettronici > Pile
153||DP2DVIADAP;153;Monclick;TD_MANAGER;DP2DVIADAP;Adattatore Startech.com adattatore displayport a dvi dp2dviadap;"Tipo connettore esterno: DisplayPort a 20 pin; Tipo connettore interno: DVI digitale 24+1 pin;";Accessori > Adattatori;[113,190];Dispositivi elettronici > accessori
