Identification;EshopId;EshopName;ManagerClassName;ProductItemId;Name;Description;SearchCategoryKey;CategoryId;CategoryDesc
174||701725902;174;Coop Online;TD_MANAGER;701725902;Set Outdoor Multisport;IlSet Outdoor MultisportfirmatoSport Oneè il set in sacca a tracolla contenente paletti, picchetti e delimitazione campo, sfruttabile per diversi giochi all'aperto come il beach volley, il beach tennis, il badminton e il tennis soccer.;Home-Outdoor e Tempo Libero-Fitness e altri sport-Sport di squadra-Volley e pallacanestro;[108,159];Articoli sportivi > Abbigliamento e accessori
174||304858301;174;Coop Online;TD_MANAGER;304858301;Lenzuolo piano 1P antracite;Lenzuolo piano dalla misura singola firmato Bassetti tinta unita antracite in 100% cotone tela 30/27. Dimensioni: 160x280 cm.;Home-Arredo e Tessile-Biancheria casa-Biancheria letto-Lenzuola;[111,172];Casa e giardino > Biancheria
174||457647501;174;Coop Online;TD_MANAGER;457647501;Piantana basket All Stars;All Stars è una piantana regolabile e trasportabile con ruote da basket. La base può essere riempita con sabbia per una portata di 70Kg e garantisce la massima stabilità. Il divertimento e la professionalità sono assicurati.;Home-Outdoor e Tempo Libero-Fitness e altri sport-Sport di squadra-Volley e pallacanestro;[108,159];Articoli sportivi > Abbigliamento e accessori
174||748899601;174;Coop Online;TD_MANAGER;748899601;Mini piantana basket Monster Slam;Con la piantana da basket per bambini Monster Slam qualsiasi luogo può diventare un campo da pallacanestro! Una volta smontata infatti la struttura può essere comodamente riposta nella base che si trasforma in una pratica valigetta per il trasporto!;Home-Outdoor e Tempo Libero-Fitness e altri sport-Sport di squadra-Volley e pallacanestro;[108,159];Articoli sportivi > Abbigliamento e accessori
174||304859801;174;Coop Online;TD_MANAGER;304859801;Lenzuolo piano 1P bianco;Lenzuolo piano dalla misura a una piazza e mezza firmato Bassetti tinta unita bianco in 100% cotone tela 30/27. Dimensioni: 180x280 cm.;Home-Arredo e Tessile-Biancheria casa-Biancheria letto-Lenzuola;[111,172];Casa e giardino > Biancheria
174||500548001;174;Coop Online;TD_MANAGER;500548001;Risiko!;Risiko! di Editrice Giochi è un classico tra i giochi da tavola. Affidarsi alla fortuna non basta: occorre strategia, intelligenza, tattica.;Home-Giochi, Infanzia e Cartoleria-Giochi per tutte le età-Giochi da tavolo e società-Per adulti;[125,234];Ufficio > Forniture per ufficio
174||304860201;174;Coop Online;TD_MANAGER;304860201;Lenzuolo piano 1P antracite;Lenzuolo piano dalla misura a una piazza e mezza firmato Bassetti tinta unita antracite in 100% cotone tela 30/27. Dimensioni: 180x280 cm.;Home-Arredo e Tessile-Biancheria casa-Biancheria letto-Lenzuola;[111,172];Casa e giardino > Biancheria
174||704009201;174;Coop Online;TD_MANAGER;704009201;Scotland Yard;Scotland Yard è il gioco Ravensburger sulle tracce di Mister X che si articola per le strade di Londra con grandi colpi di scena per unemozionante caccia al fuggitivo;Home-Giochi, Infanzia e Cartoleria-Giochi per tutte le età-Giochi da tavolo e società-Per adulti;[125,234];Ufficio > Forniture per ufficio
174||305466001;174;Coop Online;TD_MANAGER;305466001;Parure letto 2P Mash Blue moon;Parure letto matrimoniale a stampa digitale Blue Moon, composta da lenzuolo piano 240x280 cm e 2 federe 50x80 cm. Lavabile in lavatrice a max. 40.;Home-Arredo e Tessile-Biancheria casa-Biancheria letto-Lenzuola;[111,172];Casa e giardino > Biancheria
174||722358401;174;Coop Online;TD_MANAGER;722358401;Faraon;Sposta con astuzia le piramidi e trova il tesoro! Sotto le 47 maestose piramidi il Faraone ha nascosto i suoi tesori. Come trovarli?Muovi le piramidi, memorizza il percorso e trova i tesori preziosi...ma fai attenzione alla maledizione della mummia!;Home-Giochi, Infanzia e Cartoleria-Giochi per tutte le età-Giochi da tavolo e società-Per adulti;[125,234];Ufficio > Forniture per ufficio
174||303464901;174;Coop Online;TD_MANAGER;303464901;Lenzuolo con angoli Extra 1P Pesca;Lenzuolo con angoli Extra realizzato in 100% cotone nella misura singola dalle dimensioni di 90x200 cm. Colore: Pesca..;Home-Arredo e Tessile-Biancheria casa-Biancheria letto-Lenzuola;[111,172];Casa e giardino > Biancheria
174||754844401;174;Coop Online;TD_MANAGER;754844401;Trivial Pursuit;Il gioco di domande e risposte più famoso del mondo torna con un set di domande totalmente rinnovate: storia, geografia, arte, letteratura, scienze, spettacolo, natura, sport, hobby per stimolare la tua memoria e la tua curiosità!;Home-Giochi, Infanzia e Cartoleria-Giochi per tutte le età-Giochi da tavolo e società-Per adulti;[125,234];Ufficio > Forniture per ufficio
174||303465101;174;Coop Online;TD_MANAGER;303465101;Lenzuolo piano Extra a righe 1P Rosso/rosa/bianco;Lenzuolo piano Extra realizzato in 100% cotone a righe nella misura singola, dalle dimensioni di 160x280 cm. Colore: Rosso/rosa/bianco.;Home-Arredo e Tessile-Biancheria casa-Biancheria letto-Lenzuola;[111,172];Casa e giardino > Biancheria
174||252331001;174;Coop Online;TD_MANAGER;252331001;Mazzo 40 Carte da gioco Regionali Toscane;Carte Da Gioco Regionali Toscane Dal Negro- Scatola Verde Formata Da 40 Carte-Formato Mm 58X88- Realizzate In 100% Plastica;Home-Giochi, Infanzia e Cartoleria-Giochi per tutte le età-Giochi da tavolo e società-Per adulti;[125,234];Ufficio > Forniture per ufficio
174||303465401;174;Coop Online;TD_MANAGER;303465401;Lenzuolo con angoli Extra 2P Azzurro;Lenzuolo con angoli Extra realizzato in 100% cotone nella misura matrimoniale dalle dimensioni di 175x200 cm. Colore: Azzurro..;Home-Arredo e Tessile-Biancheria casa-Biancheria letto-Lenzuola;[111,172];Casa e giardino > Biancheria
174||255966002;174;Coop Online;TD_MANAGER;255966002;Mazzo 40 Carte da gioco Regionali Milanesi;Carte Da Gioco Regionali Milanesi Dal Negro- Scatola Rossa Formata Da 40 Carte - Formato Mm 51X91- Realizzate In 100% Plastica;Home-Giochi, Infanzia e Cartoleria-Giochi per tutte le età-Giochi da tavolo e società-Per adulti;[125,234];Ufficio > Forniture per ufficio
174||678155903;174;Coop Online;TD_MANAGER;678155903;Coprimaterasso in spugna con angoli elastici 2 piazze;Il coprimaterasso in spugna Coop è pensato per soddisfare le esigenze di igiene e comfort quotidiano. Grazie alle ampie misure si applica con pochi gesti al materasso proteggendolo dalla polvere e riducendo l'insorgere di possibili macchie nel tempo.;Home-Arredo e Tessile-Biancheria casa-Biancheria letto-Coprimaterasso;[111,172];Casa e giardino > Biancheria
174||750685601;174;Coop Online;TD_MANAGER;750685601;6 Giochi Riuniti in legno;Giochi Riuniti contiene ben 6 giochi classici in legno per tutta la famiglia: Dama, Scacchi, Dama Cinese, Domino, Shangai e Jumnling tower per un divertimento senza fine! Da 2 a 6 giocatori.;Home-Giochi, Infanzia e Cartoleria-Giochi per tutte le età-Giochi da tavolo e società-Per adulti;[125,234];Ufficio > Forniture per ufficio
174||477311001;174;Coop Online;TD_MANAGER;477311001;Coprimaterasso Ocean Recycle 1P;Coprimaterasso Ocean Recycle a una piazza e mezza in 100% poliestere dalle misure di 125x200x25 cm.;Home-Arredo e Tessile-Biancheria casa-Biancheria letto-Coprimaterasso;[111,172];Casa e giardino > Biancheria
174||445643601;174;Coop Online;TD_MANAGER;445643601;Tombola;La Tombola è un gioco da tavolo che non passa mai di moda per divertirsi con amici e parenti! La confezione contiene 48 cartelle, 1 tabellone e 90 numeri in legno.;Home-Giochi, Infanzia e Cartoleria-Giochi per tutte le età-Giochi da tavolo e società-Per adulti;[125,234];Ufficio > Forniture per ufficio
174||306028001;174;Coop Online;TD_MANAGER;306028001;Comprimaterasso 1P Ultrasonic 90x200 +25 cm;Questo coprimaterasso trapuntato singolo è l'ideale per garantire al tuo letto la protezione che desideri a casa tua. Caratterizzato da una lavorazione in microfibra, permette una maggiore morbidezza, traspirabilità e freschezza.;Home-Arredo e Tessile-Biancheria casa-Biancheria letto-Coprimaterasso;[111,172];Casa e giardino > Biancheria
174||750685801;174;Coop Online;TD_MANAGER;750685801;Impara gli Scacchi;Impara gli Scacchi è ideale per imparare a conoscere i nomi degli elementi base degli Scacchi, la scacchiera, lo schieramento iniziale, quali movimenti possono fare e in quale direzione.;Home-Giochi, Infanzia e Cartoleria-Giochi per tutte le età-Giochi da tavolo e società-Per adulti;[125,234];Ufficio > Forniture per ufficio
174||306028201;174;Coop Online;TD_MANAGER;306028201;Comprimaterasso 2P Ultrasonic 180x200 + 25 cm;Questo coprimaterasso trapuntato matrimoniale è l'ideale per garantire al tuo letto la protezione che desideri a casa tua. Caratterizzato da una lavorazione in microfibra, permette una maggiore morbidezza, traspirabilità e freschezza.;Home-Arredo e Tessile-Biancheria casa-Biancheria letto-Coprimaterasso;[111,172];Casa e giardino > Biancheria
174||477833801;174;Coop Online;TD_MANAGER;477833801;Gioco di società Pictionary Air Gioco;Disegna nell'aria e guarda il disegno sullo schermo! Alzati e muoviti con Pictionary Air, la versione più spassosa del classico gioco di disegni.;Home-Giochi, Infanzia e Cartoleria-Giochi per tutte le età-Giochi da tavolo e società-Per adulti;[125,234];Ufficio > Forniture per ufficio
174||756154501;174;Coop Online;TD_MANAGER;756154501;Guanciale ortocervicale Relax 50x80 cm;Relax è un guanciale ortocervicale realizzato con imbottitura in 100% poliestere vergine trattato a microsfere inserimento di sagoma in poliuretano indeformabile, soffice al primo appoggio ma portante, e fodera in 100% cotone munita di zip.;Home-Arredo e Tessile-Biancheria casa-Biancheria letto-Cuscini;[111,172];Casa e giardino > Biancheria
174||443844902;174;Coop Online;TD_MANAGER;443844902;Carte Burraco Pro;Scatola contenente due mazzi di carte burraco realizzate in 100% plastica con annesso regolamento.;Home-Giochi, Infanzia e Cartoleria-Giochi per tutte le età-Giochi da tavolo e società-Per adulti;[125,234];Ufficio > Forniture per ufficio
174||661443501;174;Coop Online;TD_MANAGER;661443501;Guanciale in fibra vergine Quattrocento 40x70;Il guanciale in fibra vergine sottovuoto è il supporto per il capo confortevole e resistente, ampio 70x40 cm.;Home-Arredo e Tessile-Biancheria casa-Biancheria letto-Cuscini;[111,172];Casa e giardino > Biancheria
174||252344001;174;Coop Online;TD_MANAGER;252344001;Carte da gioco Extra n. 35 Genovesi;Carte regionali genovesi, realizzate in cartoncino. Il mazzo è formato da 40 carte contenute in pratico astuccio di colore rosso.;Home-Giochi, Infanzia e Cartoleria-Giochi per tutte le età-Giochi da tavolo e società-Per adulti;[125,234];Ufficio > Forniture per ufficio
174||636379203;174;Coop Online;TD_MANAGER;636379203;Guanciale Fiocco di Lattice 47x77 cm;Il guanciale Fiocco di Lattice accompagna il tuo riposo garantendoti un sonno tranquillo e di qualità su un cuscino soffice e antibatterico.;Home-Arredo e Tessile-Biancheria casa-Biancheria letto-Cuscini;[111,172];Casa e giardino > Biancheria
174||443843502;174;Coop Online;TD_MANAGER;443843502;Carte da gioco Extra n. 109 Piacentine;Carte regionali piacentine, realizzate in cartoncino. Il mazzo è formato da 40 carte contenute in pratico astuccio di colore rosso.;Home-Giochi, Infanzia e Cartoleria-Giochi per tutte le età-Giochi da tavolo e società-Per adulti;[125,234];Ufficio > Forniture per ufficio
174||643883002;174;Coop Online;TD_MANAGER;643883002;Guanciale in fibra Eco 45x75 cm;Il guanciale in fibra Eco è il supporto con fodera in 100% cotone e imbottitura in falda di fibra poliestere ipoallergenica da 600 gr che consente di riposare in modo adeguato in posizione supina e sul fianco.;Home-Arredo e Tessile-Biancheria casa-Biancheria letto-Cuscini;[111,172];Casa e giardino > Biancheria
174||452383701;174;Coop Online;TD_MANAGER;452383701;Dobble;In Dobble cè sempre 1 solo simbolo in comune tra 2 carte. Trovalo per primo e vinci! Dobble comprende tanti mini-giochi basati sulla rapidità in cui tutti i giocatori agiscono allo stesso tempo.;Home-Giochi, Infanzia e Cartoleria-Giochi per tutte le età-Giochi da tavolo e società-Per adulti;[125,234];Ufficio > Forniture per ufficio
174||472781501;174;Coop Online;TD_MANAGER;472781501;Guanciale Memory saponetta Aloe Vera;Il guanciale Memory a saponetta Aloe Vera è rivestito in 100% poliestere trattamento certificato aloe, antibatterico ed anticaro ed ha l'anima in 100% viscoelastico memory forata da diverse portanze. Certificato Oekotex.;Home-Arredo e Tessile-Biancheria casa-Biancheria letto-Cuscini;[111,172];Casa e giardino > Biancheria
174||493345401;174;Coop Online;TD_MANAGER;493345401;Dixit;Dixit è un gioco di carte e di narrazione che mette al centro la fantasia! Adatto dagli 8 anni in su, è un gioco sorprendente, conviviale e divertente da giocare in famiglia e con gli amici.;Home-Giochi, Infanzia e Cartoleria-Giochi per tutte le età-Giochi da tavolo e società-Per adulti;[125,234];Ufficio > Forniture per ufficio
174||495362304;174;Coop Online;TD_MANAGER;495362304;Guanciale in fibra Sostegno Differenziato 77x47 cm;Il guanciale in fibra con sostegno differenziato Coop si modella ed accoglie perfettamente la testa. Mediante il calore e il peso del corpo il guanciale si adatta alla conformazione del capo in maniera tale che il collo possa assumere una posizione naturale.;Home-Arredo e Tessile-Biancheria casa-Biancheria letto-Cuscini;[111,172];Casa e giardino > Biancheria
174||444833702;174;Coop Online;TD_MANAGER;444833702;Cranium;Metti alla prova fantasia e creatività per far indovinare le parole misteriose ai tuoi compagni di squadra, arrivare primo al traguardo del tabellone e vincere la partita.;Home-Giochi, Infanzia e Cartoleria-Giochi per tutte le età-Giochi da tavolo e società-Per adulti;[125,234];Ufficio > Forniture per ufficio
174||495363004;174;Coop Online;TD_MANAGER;495363004;Guanciale in fibra Memory 70x41 cm;Il guanciale in fibra memory Coop si modella ed accoglie perfettamente la testa. Mediante il calore e il peso del corpo il guanciale si adatta alla conformazione del capo in maniera tale che il collo possa assumere una posizione naturale.;Home-Arredo e Tessile-Biancheria casa-Biancheria letto-Cuscini;[111,172];Casa e giardino > Biancheria
174||113333501;174;Coop Online;TD_MANAGER;113333501;Minecraft;Il famoso videogioco Minecraft in un'avvincente versione analogica: il gioco da tavolo Minecraft! Vince chi per primo riesce a completare il suo tabellone di gioco con le tessere-mondo dello stesso tipo.;Home-Giochi, Infanzia e Cartoleria-Giochi per tutte le età-Giochi da tavolo e società-Per adulti;[125,234];Ufficio > Forniture per ufficio
174||311822201;174;Coop Online;TD_MANAGER;311822201;Netflix Il gioco;Il più di tendenza tra i giochi da tavolo! Netflix Il gioco vi permette di create il vostro personalissimo spettacolo Netflix, combinando le carte Contenuti orignali Netflix nelle vostre mani con le esilaranti carte Colpo di scena e sperate di conquistare il favore del Giudice!;Home-Giochi, Infanzia e Cartoleria-Giochi per tutte le età-Giochi da tavolo e società-Per adulti;[125,234];Ufficio > Forniture per ufficio
174||499149201;174;Coop Online;TD_MANAGER;499149201;Guanciale Memory con fodera polipropilene antiacaro ed antibatterico;Guanciale Memory con fodera protettiva in polipropilene antiacaro ed antibatterico, certificato Oekotex, made in Italy. Dimensioni: 43x74x10 cm.;Home-Arredo e Tessile-Biancheria casa-Biancheria letto-Cuscini;[111,172];Casa e giardino > Biancheria
174||317572301;174;Coop Online;TD_MANAGER;317572301;Fantasmi in fuga;Gioco in scatola di precisione e fortuna! L'obiettivo è lanciare i fantasmini all'interno della cabina del drone.per vederli in fuga!;Home-Giochi, Infanzia e Cartoleria-Giochi per tutte le età-Giochi da tavolo e società-Per adulti;[125,234];Ufficio > Forniture per ufficio
174||678261402;174;Coop Online;TD_MANAGER;678261402;Guanciale doppia onda Memory Wave Coolmax EU 43x60 cm;Guanciale modello doppia onda Memory Wave Coolmax Dormir EU con lastra interna in memory e tessuto di rivestimento Coolmax traspirante e fresco. Sfoderabile. Dimensioni: 43x60 cm.;Home-Arredo e Tessile-Biancheria casa-Biancheria letto-Cuscini;[111,172];Casa e giardino > Biancheria
174||317572501;174;Coop Online;TD_MANAGER;317572501;Occhio al Fantasma;Una stanza buia, la pistola in mano e via a liberare la casa infestata! Vince chi riesce a catturare più fantasmi proiettati sulle pareti!;Home-Giochi, Infanzia e Cartoleria-Giochi per tutte le età-Giochi da tavolo e società-Per adulti;[125,234];Ufficio > Forniture per ufficio
174||685661101;174;Coop Online;TD_MANAGER;685661101;Guanciale doppia onda Memory Bamboo Viscos Wave GIT 42x67 cm;Guanciale modello doppia onda Memory Bamboo Viscos Wave con lastra interna in memory e tessuto di rivestimento con trattamento Bamboo che racchiude virtù termoregolatrici e salutari. Sfoderabile. Dimensioni: 42x67 cm.;Home-Arredo e Tessile-Biancheria casa-Biancheria letto-Cuscini;[111,172];Casa e giardino > Biancheria
174||317572801;174;Coop Online;TD_MANAGER;317572801;Citadels;Gioco di strategia e bluff in cui competerete tra voi per diventare il prossimo Mastro Costruttore del regno erigendo la città medievale più imponente.;Home-Giochi, Infanzia e Cartoleria-Giochi per tutte le età-Giochi da tavolo e società-Per adulti;[125,234];Ufficio > Forniture per ufficio
174||698870502;174;Coop Online;TD_MANAGER;698870502;Guanciale doppia onda Wave Memory Eco anti bacterial GIT 42x60 cm;Guanciale modello doppia onda Wave Memory Eco anti bacterial GIT con lastra interna in memory e tessuto di rivestimento con trattamento antibatterico. Sfoderabile. Dimensioni: 42x60 cm;Home-Arredo e Tessile-Biancheria casa-Biancheria letto-Cuscini;[111,172];Casa e giardino > Biancheria
174||317573101;174;Coop Online;TD_MANAGER;317573101;Unlock! Legendary Adventures;Un gioco di carte collaborativo ispirato alle Escape Room. Unlock! vi consente di vivere questa esperienza a casa vostra, seduti a un tavolo.;Home-Giochi, Infanzia e Cartoleria-Giochi per tutte le età-Giochi da tavolo e società-Per adulti;[125,234];Ufficio > Forniture per ufficio
174||305898501;174;Coop Online;TD_MANAGER;305898501;Guanciale Platinum memory saponetta forato 42x72x12 cm;Platinum è un guanciale dispositivo medico classe I a saponetta forata con fodera in jersey di cotone semipettinato con cerniera e imbottitura in memory viscoelastico. Antibatterico ed antiacaro, è certificato Oekotex.;Home-Arredo e Tessile-Biancheria casa-Biancheria letto-Cuscini;[111,172];Casa e giardino > Biancheria
174||317573301;174;Coop Online;TD_MANAGER;317573301;Unlock! The Escape Game Star Wars;Un gioco di carte collaborativo ispirato alle Escape Room. Unlock! vi consente di vivere questa esperienza a casa vostra, seduti a un tavolo.;Home-Giochi, Infanzia e Cartoleria-Giochi per tutte le età-Giochi da tavolo e società-Per adulti;[125,234];Ufficio > Forniture per ufficio
174||315773001;174;Coop Online;TD_MANAGER;315773001;Guanciale Comodity memory doppia onda forato 42x72 cm;Comodity è un guanciale dispositivo medico classe I doppia onda forato con fodera in jersey di cotone semipettinato con cerniera e imbottitura in memory viscoelastico. Antibatterico ed antiacaro, è certificato Oekotex.;Home-Arredo e Tessile-Biancheria casa-Biancheria letto-Cuscini;[111,172];Casa e giardino > Biancheria
174||317576201;174;Coop Online;TD_MANAGER;317576201;Il Trauma del Tram;Un party game di dilemmi morali e omicidi sui binari.;Home-Giochi, Infanzia e Cartoleria-Giochi per tutte le età-Giochi da tavolo e società-Per adulti;[125,234];Ufficio > Forniture per ufficio
174||317576401;174;Coop Online;TD_MANAGER;317576401;Ticket to Ride Primo Viaggio;Muovete i vostri primi passi nel fantastico mondo di Ticket to Ride con questa versione facilitata per i più piccini!;Home-Giochi, Infanzia e Cartoleria-Giochi per tutte le età-Giochi da tavolo e società-Per adulti;[125,234];Ufficio > Forniture per ufficio
174||317576801;174;Coop Online;TD_MANAGER;317576801;Ticket to Ride Europa;Ticket to Ride è il pluripremiato gioco di avventure ferroviarie che vi farà viaggiare in tutta l'Europa, senza spostarvi dalla sedia.;Home-Giochi, Infanzia e Cartoleria-Giochi per tutte le età-Giochi da tavolo e società-Per adulti;[125,234];Ufficio > Forniture per ufficio
174||317577001;174;Coop Online;TD_MANAGER;317577001;Picture Show;L'obbiettivo è far indovinare le parole sulle carte (nomi, situazioni, espressioni...) ai propri compagni di squadra. Ma come? Con le ombre cinesi! Non si utilizzano però le mani, quanto delle sagome magnetiche da muovere.;Home-Giochi, Infanzia e Cartoleria-Giochi per tutte le età-Giochi da tavolo e società-Per adulti;[125,234];Ufficio > Forniture per ufficio
174||317577301;174;Coop Online;TD_MANAGER;317577301;Time's Up Big Box Kids;Un divertentissimo party game per i più piccini dove dovete indovinare quante più parole possibili! Come? Parlando e mimando!;Home-Giochi, Infanzia e Cartoleria-Giochi per tutte le età-Giochi da tavolo e società-Per adulti;[125,234];Ufficio > Forniture per ufficio
174||317577501;174;Coop Online;TD_MANAGER;317577501;Jamaica nuovo formato;Issate le vele e partite per la tradizionale regata attorno allIsola di Jamaica, con questo family game piratesco!;Home-Giochi, Infanzia e Cartoleria-Giochi per tutte le età-Giochi da tavolo e società-Per adulti;[125,234];Ufficio > Forniture per ufficio
174||317577801;174;Coop Online;TD_MANAGER;317577801;La Casa dei Sogni;In questo gioco adatto a tutta la famiglia, avrete finalmente loccasione di costruire la casa dei vostri sogni, come meglio preferite, ottimizzando le vostre scelte per fare più punti possibile!;Home-Giochi, Infanzia e Cartoleria-Giochi per tutte le età-Giochi da tavolo e società-Per adulti;[125,234];Ufficio > Forniture per ufficio
174||111895202;174;Coop Online;TD_MANAGER;111895202;Gravitrax The Game Flow;Gravitrax The Game Flow include trenta sfide emozionanti guidate dalle carte sfida! Le 38 componenti del gioco tra cui 2 accessori Flextube, 11 blocchi verticali, 7 curve, 1 vortice, 1 biglia e tante altre possono essere utilizzate in tutte le piste GraviTrax!;Home-Giochi, Infanzia e Cartoleria-Giochi per tutte le età-Giochi da tavolo e società-Per bambini;[125,234];Ufficio > Forniture per ufficio
174||305320102;174;Coop Online;TD_MANAGER;305320102;Time's Up Big Box Party;Un divertentissimo party game per grandi e piccini dove, a squadre, dovete indovinare quante più parole possibili! Come? Parlando e mimando!;Home-Giochi, Infanzia e Cartoleria-Giochi per tutte le età-Giochi da tavolo e società-Per bambini;[125,234];Ufficio > Forniture per ufficio
174||459479502;174;Coop Online;TD_MANAGER;459479502;SPQRisiKo! Refresh;Questa versione è ambientata in un periodo dove Roma sta cadendo in anarchia militare e l'Impero è sull'orlo del collasso. Per vincere una partita a SPQRisiKo dovrete accumulare il maggior numero di Punti Vittoria!;Home-Giochi, Infanzia e Cartoleria-Giochi per tutte le età-Giochi da tavolo e società-Per bambini;[125,234];Ufficio > Forniture per ufficio
174||459578002;174;Coop Online;TD_MANAGER;459578002;Gioco da tavolo Il Collegio;Ispirato al grande successo della RAI, il gioco da tavolo Clementoni propone una sfida ambientata in un collegio in stile anni sessanta per conseguire il diploma di licenza media dell'epoca.;Home-Giochi, Infanzia e Cartoleria-Giochi per tutte le età-Giochi da tavolo e società-Per bambini;[125,234];Ufficio > Forniture per ufficio
174||305319902;174;Coop Online;TD_MANAGER;305319902;Time's Up Big Box Family;Un divertentissimo party game dove, a squadre, dovete indovinare quante più parole possibili! Come? Parlando e mimando!;Home-Giochi, Infanzia e Cartoleria-Giochi per tutte le età-Giochi da tavolo e società-Per bambini;[125,234];Ufficio > Forniture per ufficio
174||317336801;174;Coop Online;TD_MANAGER;317336801;Monopoly Edizione Star Wars The Mandalorian;Il Monopoly Edizione Star Wars The Mandalorian è la versione del famosissimo gioco in scatola ispirato alla serie tv The Mandalorian. Adatto da 16 anni in su.;Home-Giochi, Infanzia e Cartoleria-Giochi per tutte le età-Giochi da tavolo e società-Per bambini;[125,234];Ufficio > Forniture per ufficio
174||486584902;174;Coop Online;TD_MANAGER;486584902;Super Mario Labyrinth;Spostate con astuzia le tessere del Labirinto e andate alla ricerca di Mario, suo fratello Luigi, Yoshi, Peach, Donkey Kong e molti altri personaggi del videogioco Super Mario!;Home-Giochi, Infanzia e Cartoleria-Giochi per tutte le età-Giochi da tavolo e società-Per bambini;[125,234];Ufficio > Forniture per ufficio
174||318704501;174;Coop Online;TD_MANAGER;318704501;Canta Tu Topo Gigio;Macchina karaoke portatile che ti permette di cantare con Topo Gigioovunque! Puoi cantare anche senza smartphone e tablet grazie alle 3 canzoni originali complete pre registrate;Home-Giochi, Infanzia e Cartoleria-Giochi per tutte le età-Giochi da tavolo e società-Per bambini;[125,234];Ufficio > Forniture per ufficio
174||318704701;174;Coop Online;TD_MANAGER;318704701;Canta Tu Bing;Macchina karaoke portatile che ti permette di cantare con Bing...ovunque! Puoi cantare anche senza smartphone e tablet grazie alle 3 canzoni originali complete pre registrate.;Home-Giochi, Infanzia e Cartoleria-Giochi per tutte le età-Giochi da tavolo e società-Per bambini;[125,234];Ufficio > Forniture per ufficio
174||497571602;174;Coop Online;TD_MANAGER;497571602;Monopoly Animal Crossing New Horizons;Con questa versione di Monopoly, i giocatori possono godersi la vita su un'isola e immergersi nel colorato e creativo mondo di Animal Crossing New Horizons!;Home-Giochi, Infanzia e Cartoleria-Giochi per tutte le età-Giochi da tavolo e società-Per bambini;[125,234];Ufficio > Forniture per ufficio
