Identification;EshopId;EshopName;ManagerClassName;ProductItemId;Name;Description;SearchCategoryKey;CategoryId;CategoryDesc
153||MK_000000151411;153;Monclick;TD_MANAGER;MK_000000151411;Picnik concept adult - set di posate 870403;"Tipologia: Set posate;";Casalinghi > Posate e utensili da cucina;[111,170];Casa e giardino > Accessori cucina
153||MK_000000151628;153;Monclick;TD_MANAGER;MK_000000151628;Contenitore Picnik concept - contenitore per cibo - blu - 1.78 l 870017;"Capacità: n.d.;";Casalinghi > Contenitori;[111,185];Casa e giardino > Prodotti per la casa
153||MK_000000151419;153;Monclick;TD_MANAGER;MK_000000151419;Startech.com adattatore pcmcia a compact flash cb2cffcr;"Tipologia: Adattatore schede;";Accessori > Accessori server e networking;[113,191];Dispositivi elettronici > accessori computer e tablet
153||MK_000000151631;153;Monclick;TD_MANAGER;MK_000000151631;Contenitore Picnik concept adult - contenitore per cibo - blu tempesta 870203;"Capacità: n.d.;";Casalinghi > Contenitori;[111,185];Casa e giardino > Prodotti per la casa
153||MK_000000151634;153;Monclick;TD_MANAGER;MK_000000151634;Carta termica - 10 rotoli - rotolo (5,75 cm x 20 m) fsrtobpa57520;"Tipologia: Rotolo; Quantità inclusa: 10 rotoli;";Consumabili > Etichette e rotoli;[125,234];Ufficio > Forniture per ufficio
153||MK_000000151437;153;Monclick;TD_MANAGER;MK_000000151437;Memoria RAM Ddr4 - modulo - 16 gb - dimm 288-pin - 2933 mhz / pc4-23400 4x70v98061;"Tecnologia: DDR4 SDRAM; Capacità: 16 GB; Clock: 2933 MHz; Tipo modulo: DIMM 288-PIN; Nome modulo: PC4-23400; Error checking: ECC; Ampiezza modulo: Registrato;";HDD e Componenti PC > Memorie RAM;[113,191];Dispositivi elettronici > accessori computer e tablet
153||MK_000000151649;153;Monclick;TD_MANAGER;MK_000000151649;Telefono fisso Ct202 - telefono con filo con id chiamante 107ct202whiteit;"Tipologia: Telefono con filo; Segreteria telefonica: Non presente; Vivavoce: Sì; VoIP: No;";Telefoni cellulari e fissi > Telefoni fissi;[113,202];Dispositivi elettronici > telefoni cellulari
153||MK_000000151464;153;Monclick;TD_MANAGER;MK_000000151464;Cover CUSTODIA BOOK CLUTCH 2 GALAXY A51 N;"Tipologia: Cover posteriore; Compatibilità: n.d.; Colore: Nero;";Accessori > Cover;[113,193];Dispositivi elettronici > accessori telefoni cellulari
153||MK_000000151682;153;Monclick;TD_MANAGER;MK_000000151682;Startech.com cavo adattatore hdmi a mini displayport da 1 m hd2mdpmm1m;"Tipologia: n.d.; Quantità inclusa: n.d.;";Consumabili > Etichette e rotoli;[125,234];Ufficio > Forniture per ufficio
153||MK_000000151467;153;Monclick;TD_MANAGER;MK_000000151467;Cover CUSTODIA DI GOMMA FINE GALAXY A51 T;"Tipologia: Cover posteriore; Compatibilità: n.d.; Colore: Trasparente;";Accessori > Cover;[113,193];Dispositivi elettronici > accessori telefoni cellulari
153||MK_000000151735;153;Monclick;TD_MANAGER;MK_000000151735;Lampadina LED Hue White Kit, 2 Lampadine E27 Smart, luce calda e Bridge Hue;"Tipologia: Set per illuminazione wireless; Durata: 25000 ore; Consumo elettrico: 9 W; Potenza luminosa: 806 Lumen; Temperatura colore: 2700 K; Attacco: E27;";Casalinghi > Lampadine LED;[111,177];Casa e giardino > Illuminazione
153||MK_000000151475;153;Monclick;TD_MANAGER;MK_000000151475;Cover CUSTODIA SENSATION GALAXY A51 BLU;"Tipologia: Cover posteriore; Compatibilità: n.d.; Colore: Blu;";Accessori > Cover;[113,193];Dispositivi elettronici > accessori telefoni cellulari
153||MK_000000151740;153;Monclick;TD_MANAGER;MK_000000151740;Penna Gel-ocity stic - penna a sfera - nero (pacchetto di 30) cel1010266;"Quantità per confezione: 30; Tipologia: Penna a sfera; Colore: Nero; Tipo inchiostro: Inchiostro gel;";Prodotti per scuola e ufficio > Penne;[111,188];Casa e giardino > sicurezza
153||MK_000000151486;153;Monclick;TD_MANAGER;MK_000000151486;Proteggi schermo Impact glass - protezione per schermo per telefono cellulare tempglassxiaoren8t;"Materiale: Vetro temperato (9H); Compatibilità: n.d.;";Accessori > Proteggischermo;[113,191];Dispositivi elettronici > accessori computer e tablet
153||MK_000000151742;153;Monclick;TD_MANAGER;MK_000000151742;Blocco Pignastyl A4 Fogli - 70 Fogli Bianchi - Carta 80 gr/mq - Confezione 10 Pezzi;"Tipologia: Blocchetto; Formato: A4; Margini e rigatura: Bianco; Quantità per confezione: 10; Colore copertina: n.d.;";Prodotti per scuola e ufficio > Quaderni e blocchi;[111,188];Casa e giardino > sicurezza
153||MK_000000151489;153;Monclick;TD_MANAGER;MK_000000151489;Cover CUSTODIA TETRA GAL A91/S10 LITE TRA;"Tipologia: Cover posteriore; Compatibilità: n.d.; Colore: Nero, Trasparente;";Accessori > Cover;[113,193];Dispositivi elettronici > accessori telefoni cellulari
153||MK_000000151754;153;Monclick;TD_MANAGER;MK_000000151754;Penna Cristal exact - penna a sfera - blu (pacchetto di 20) 992605;"Quantità per confezione: 20; Tipologia: Penna a sfera; Colore: Blu; Tipo inchiostro: n.d.;";Prodotti per scuola e ufficio > Penne;[111,188];Casa e giardino > sicurezza
153||MK_000000151509;153;Monclick;TD_MANAGER;MK_000000151509;Pentola a pressione Itala Lagoeasy'up 7L;"Tipologia: Pentola a pressione;";Casalinghi > Pentole e coperchi;[111,170];Casa e giardino > Accessori cucina
153||MK_000000151759;153;Monclick;TD_MANAGER;MK_000000151759;Supporto storage Overland tandberg - lto ultrium 8 x 1 - 12 tb 434132;"Tipo nastro: Ultrium 8; Capacità dati nativi: 12 TB; Capacità dati compressi: 30 TB;";Consumabili > Supporti storage;[125,234];Ufficio > Forniture per ufficio
153||MK_000000151515;153;Monclick;TD_MANAGER;MK_000000151515;Cuffie TAPH805BK Nero;"Tipologia: Cuffie; Connettività: Senza fili; Tecnologia wireless: Bluetooth; Colore: Nero; Serie: n.d.; Modello: TAPH805BK;";Home Cinema e Audio > Cuffie e auricolari;[113,196];Dispositivi elettronici > audio
153||MK_000000151761;153;Monclick;TD_MANAGER;MK_000000151761;Creta - pasta modellante - 1 kg - rosso 272cwr;"Tipologia: Pasta modellante;";Tempo libero > Creatività bambini;[126];Veicoli elettrici
153||MK_000000151528;153;Monclick;TD_MANAGER;MK_000000151528;Monitor LFD 55vh7e-a vh7e - 55'' display lcd retroilluminato a led - full hd 55vh7e-a.aeu;"Pollici: 55 ''; Risoluzione: 1920 x 1080; Formato: 16:9; Tecnologia pannello: IPS; Uscita audio: n.d.; Interfacce: HDMI; Connettività: LAN; Destinazione d'uso: Segnaletica digitale; Luminosità: 700 cd/m2; Contrasto: n.d.; Tempo di risposta: n.d.;";Monitor e Periferiche PC > Monitor LFD;[113,191];Dispositivi elettronici > accessori computer e tablet
153||MK_000000151772;153;Monclick;TD_MANAGER;MK_000000151772;Telefono fisso O201;"Tipologia: Telefono cordless; Segreteria telefonica: Non presente; Vivavoce: Sì; VoIP: No;";Telefoni cellulari e fissi > Telefoni fissi;[113,202];Dispositivi elettronici > telefoni cellulari
153||MK_000000151532;153;Monclick;TD_MANAGER;MK_000000151532;Cf10 rot.reg cassa term 57.5mmx8 fsrtobpa57580;"Tipologia: n.d.; Quantità inclusa: 10;";Consumabili > Etichette e rotoli;[125,234];Ufficio > Forniture per ufficio
153||MK_000000151777;153;Monclick;TD_MANAGER;MK_000000151777;Telefono fisso Corded SIM;"Tipologia: Telefono con filo; Segreteria telefonica: Non presente; Vivavoce: Sì; VoIP: No;";Telefoni cellulari e fissi > Telefoni fissi;[113,202];Dispositivi elettronici > telefoni cellulari
153||MK_000000151534;153;Monclick;TD_MANAGER;MK_000000151534;Penna Cosmic teens - penna a sfera doppia punta a 4 colori 229443;"Quantità per confezione: 1; Tipologia: Penna a sfera; Colore: Blu, Nero, Rosso, Verde; Tipo inchiostro: n.d.;";Prodotti per scuola e ufficio > Penne;[111,188];Casa e giardino > sicurezza
153||MK_000000151797;153;Monclick;TD_MANAGER;MK_000000151797;Telefono fisso O2;"Tipologia: Telefono cordless; Segreteria telefonica: Non presente; Vivavoce: Sì; VoIP: No;";Telefoni cellulari e fissi > Telefoni fissi;[113,202];Dispositivi elettronici > telefoni cellulari
153||MK_000000151537;153;Monclick;TD_MANAGER;MK_000000151537;Contenitore Picnik origin - contenitore per cibo - blu, verde - 1.4 l 870104;"Capacità: n.d.;";Casalinghi > Contenitori;[111,185];Casa e giardino > Prodotti per la casa
153||MK_000000151811;153;Monclick;TD_MANAGER;MK_000000151811;Temperino Faber-castell animals ladybird - temperino 183526;"Quantità per confezione: 1;";Prodotti per scuola e ufficio > Temperini;[111,188];Casa e giardino > sicurezza
153||MK_000000151546;153;Monclick;TD_MANAGER;MK_000000151546;Color'peps oops! - pastello colorato 832824;"Tipologia: Pastello colorato; Colore: Arancione fruity, Blu bubble, Blu laguna, Blu oltremare, Blu reale, Blush, Dark black, Dune, Fragola, Fucsia, Gaia, Giada, Giallo fluo, Giallo sole, Grenadine, Grigio delicato, Kiwi, Marrone woody, Melanzana, Red kiss, Rosa lovely, Rosso chiaro, Verde mel; Quantità per confezione: 24;";Prodotti per scuola e ufficio > Pastelli e pennarelli;[111,188];Casa e giardino > sicurezza
153||MK_000000151816;153;Monclick;TD_MANAGER;MK_000000151816;Faber-castell jumbo - pastello colorato 116501;"Tipologia: Pastello colorato; Colore: Colori assortiti brillanti; Quantità per confezione: 12;";Prodotti per scuola e ufficio > Pastelli e pennarelli;[111,188];Casa e giardino > sicurezza
153||MK_000000151550;153;Monclick;TD_MANAGER;MK_000000151550;Temperino Galactic comfort - temperino con contenitore 037310;"Quantità per confezione: 1;";Prodotti per scuola e ufficio > Temperini;[111,188];Casa e giardino > sicurezza
153||MK_000000151829;153;Monclick;TD_MANAGER;MK_000000151829;Faber-castell pitt artist pen mangaka 167124;"Tipologia: Brush pen, fineliner and marker set;";Tempo libero > Creatività bambini;[126];Veicoli elettrici
153||MK_000000151552;153;Monclick;TD_MANAGER;MK_000000151552;PC Desktop Ideacentre 510-15ick - tower - core i5 9400f 2.9 ghz - 16 gb 90lu002yix;"Tipo processore: Intel Core i5; Sistema operativo: Windows 10 Home; Memoria RAM: 16 GB; Scheda grafica dedicata: Integrata; Tipologia hard disk: SSD; Modello scheda grafica: AMD Radeon RX 550X; Capacità hard disk: 2.128 TB; Modello processore: I5-9400F; Tipologia unità ottica: Masterizzatore DVD; Tipologia cabinet: Tower; Serie scheda video: AMD Radeon RX; Tipologia secondo hard disk: HDD;";PC Notebook e Tablet > PC Desktop;[113,197];Dispositivi elettronici > computer e tablet
153||MK_000000151839;153;Monclick;TD_MANAGER;MK_000000151839;Hard disk interno Hpe read intensive - ssd - 1.92 tb - sas 12gb/s r0q37a;"Capacità: 1.92 TB; Formato: 2.5'' SFF; Interfaccia: Serial Attached SCSI 3; Velocità di rotazione: n.d.; Velocità di trasferimento dati: 1.2 GBps;";HDD e Componenti PC > Hard disk interni;[113,191];Dispositivi elettronici > accessori computer e tablet
153||MK_000000151558;153;Monclick;TD_MANAGER;MK_000000151558;Color'peps animals - pastello colorato 832212;"Tipologia: Pastello colorato; Colore: Colori assortiti; Quantità per confezione: 12;";Prodotti per scuola e ufficio > Pastelli e pennarelli;[111,188];Casa e giardino > sicurezza
153||MK_000000151855;153;Monclick;TD_MANAGER;MK_000000151855;Keep colour pastel - vassoio per lettere - per a4, a4 plus 65510pasas;"Tipologia: n.d.;";Prodotti per scuola e ufficio > Arredo ufficio e accessori;[125,234];Ufficio > Forniture per ufficio
153||MK_000000151562;153;Monclick;TD_MANAGER;MK_000000151562;Color'peps animals - pastello colorato 832218;"Tipologia: Pastello colorato; Colore: Colori assortiti; Quantità per confezione: 18;";Prodotti per scuola e ufficio > Pastelli e pennarelli;[111,188];Casa e giardino > sicurezza
153||MK_000000151860;153;Monclick;TD_MANAGER;MK_000000151860;Matita Turner 4019 - portamina - b 4019bl6;"Tipologia: Portamina; Durezza: B; Quantità per confezione: 1;";Prodotti per scuola e ufficio > Matite;[111,188];Casa e giardino > sicurezza
153||MK_000000151567;153;Monclick;TD_MANAGER;MK_000000151567;Color'peps strong - pastello colorato 862712;"Tipologia: Pastello colorato; Colore: Colori assortiti; Quantità per confezione: 12;";Prodotti per scuola e ufficio > Pastelli e pennarelli;[111,188];Casa e giardino > sicurezza
153||MK_000000151869;153;Monclick;TD_MANAGER;MK_000000151869;Keep colour pastel - portariviste - per 266 x 278 mm - verde 7118pasv;"Tipologia: n.d.;";Prodotti per scuola e ufficio > Arredo ufficio e accessori;[125,234];Ufficio > Forniture per ufficio
153||MK_000000151570;153;Monclick;TD_MANAGER;MK_000000151570;Telefono fisso CT50 Black;"Tipologia: Telefono con filo; Segreteria telefonica: Non presente; Vivavoce: No; VoIP: No;";Telefoni cellulari e fissi > Telefoni fissi;[113,202];Dispositivi elettronici > telefoni cellulari
153||MK_000000151876;153;Monclick;TD_MANAGER;MK_000000151876;Aluminium profil - squadra - 25 cm - alluminio anodizzato 18126;"Tipologia: Squadra; Quantità per confezione: 1;";Prodotti per scuola e ufficio > Strumenti per disegno tecnico;[111,188];Casa e giardino > sicurezza
153||MK_000000151572;153;Monclick;TD_MANAGER;MK_000000151572;Contenitore Picnik origin - borsa termica - blu 872104;"Capacità: n.d.;";Casalinghi > Contenitori;[111,185];Casa e giardino > Prodotti per la casa
153||MK_000000151882;153;Monclick;TD_MANAGER;MK_000000151882;18040a;"Tipologia: n.d.; Quantità per confezione: 1;";Prodotti per scuola e ufficio > Strumenti per disegno tecnico;[111,188];Casa e giardino > sicurezza
153||MK_000000151578;153;Monclick;TD_MANAGER;MK_000000151578;Forbice Sensoft 3d - forbici 484213;"Quantità per confezione: 1;";Prodotti per scuola e ufficio > Forbici;[111,188];Casa e giardino > sicurezza
153||MK_000000151888;153;Monclick;TD_MANAGER;MK_000000151888;Elastika - squadra - 35 cm el6035;"Tipologia: Squadra; Quantità per confezione: 1;";Prodotti per scuola e ufficio > Strumenti per disegno tecnico;[111,188];Casa e giardino > sicurezza
153||MK_000000151582;153;Monclick;TD_MANAGER;MK_000000151582;Penna Cosmic teens - penna a sfera doppia punta a 4 colori 229444;"Quantità per confezione: 1; Tipologia: Penna a sfera; Colore: Blu, Nero, Rosso, Verde; Tipo inchiostro: n.d.;";Prodotti per scuola e ufficio > Penne;[111,188];Casa e giardino > sicurezza
153||MK_000000151893;153;Monclick;TD_MANAGER;MK_000000151893;Aluminium profil - squadra - 35 cm - alluminio anodizzato 18140;"Tipologia: Squadra; Quantità per confezione: 1;";Prodotti per scuola e ufficio > Strumenti per disegno tecnico;[111,188];Casa e giardino > sicurezza
153||MK_000000151584;153;Monclick;TD_MANAGER;MK_000000151584;Forbice Forbici cosmic kid 13cm col ass bls 464913;"Quantità per confezione: n.d.;";Prodotti per scuola e ufficio > Forbici;[111,188];Casa e giardino > sicurezza
153||MK_000000151899;153;Monclick;TD_MANAGER;MK_000000151899;Classic maxi - vassoio per lettere - per a4, 255 x 320 mm - cristallo tr18maxcr;"Tipologia: n.d.;";Prodotti per scuola e ufficio > Arredo ufficio e accessori;[125,234];Ufficio > Forniture per ufficio
153||MK_000000151591;153;Monclick;TD_MANAGER;MK_000000151591;Color'peps animals - pastello colorato 832224;"Tipologia: Pastello colorato; Colore: Colori assortiti; Quantità per confezione: 24;";Prodotti per scuola e ufficio > Pastelli e pennarelli;[111,188];Casa e giardino > sicurezza
153||MK_000000151904;153;Monclick;TD_MANAGER;MK_000000151904;Keep colour pastel - portariviste - per 266 x 278 mm - giallo 7118pasg;"Tipologia: n.d.;";Prodotti per scuola e ufficio > Arredo ufficio e accessori;[125,234];Ufficio > Forniture per ufficio
153||MK_000000151593;153;Monclick;TD_MANAGER;MK_000000151593;Color'peps strong jumbo - pastello colorato 863312;"Tipologia: Pastello colorato; Colore: Colori assortiti; Quantità per confezione: 12;";Prodotti per scuola e ufficio > Pastelli e pennarelli;[111,188];Casa e giardino > sicurezza
153||MK_000000151907;153;Monclick;TD_MANAGER;MK_000000151907;Elastika - squadra - 35 cm el4535;"Tipologia: Squadra; Quantità per confezione: 1;";Prodotti per scuola e ufficio > Strumenti per disegno tecnico;[111,188];Casa e giardino > sicurezza
153||MK_000000151595;153;Monclick;TD_MANAGER;MK_000000151595;Cosmic - gomma - disponibile in colori assortiti (pacchetto di 3) 119512;"Tipologia: Gomma; Quantità per confezione: 3;";Prodotti per scuola e ufficio > Correttori e gomme;[111,188];Casa e giardino > sicurezza
153||MK_000000151913;153;Monclick;TD_MANAGER;MK_000000151913;Cavo Cavo patch - 2 m - bianco 47794;"Tipologia: Cavo patch; Tipo connettore dx: RJ-45; Tipo connettore sx: RJ-45; Lunghezza: 2 m;";Accessori > Cavi audio video e HDMI;[113,205];Dispositivi elettronici > video
153||MK_000000151601;153;Monclick;TD_MANAGER;MK_000000151601;Bls 2 gomme cosmic teens 116112;"Tipologia: n.d.; Quantità per confezione: n.d.;";Prodotti per scuola e ufficio > Correttori e gomme;[111,188];Casa e giardino > sicurezza
153||MK_000000151932;153;Monclick;TD_MANAGER;MK_000000151932;PC Desktop Predator orion 3000 po3-600 - tower - core i5 9400f 2.9 ghz - 16 gb dg.e1cet.005;"Tipo processore: Intel Core i5; Sistema operativo: Windows 10 Home; Memoria RAM: 16 GB; Scheda grafica dedicata: Integrata; Tipologia hard disk: SSD; Modello scheda grafica: NVIDIA GeForce GTX 1660 Ti; Capacità hard disk: 1.256 TB; Modello processore: I5-9400F; Tipologia unità ottica: Masterizzatore DVD; Tipologia cabinet: Tower; Serie scheda video: NVIDIA GeForce GTX; Tipologia secondo hard disk: HDD;";PC Notebook e Tablet > PC Desktop;[113,197];Dispositivi elettronici > computer e tablet
153||MK_000000151975;153;Monclick;TD_MANAGER;MK_000000151975;Tablet Smart Tab M8 ZA5D - Android 9.0 (Pie) - 32 GB - 8'' - 4G;"Dimensione schermo: 8 ''; Connettività: 4G LTE; Ram: 2 GB; Capacità memoria: 32 GB; Sistema operativo: Android; Versione sistema operativo: Android 9.0 (Pie) o successivo; Risoluzione: 1280 x 800 Pixel; Tipo processore: Helio A22; Peso: 305 g;";PC Notebook e Tablet > Tablet;[113,197];Dispositivi elettronici > computer e tablet
153||MK_000000151976;153;Monclick;TD_MANAGER;MK_000000151976;Tagliere Tagliere in legno di mango rettangolare con manico 25x40x1.5 cm;"Tipologia: Tagliere;";Casalinghi > Accessori da cucina;[113,190];Dispositivi elettronici > accessori
153||MK_000000151977;153;Monclick;TD_MANAGER;MK_000000151977;Tagliere Tagliere in legno di mango con manico 25x40 cm;"Tipologia: Tagliere;";Casalinghi > Accessori da cucina;[113,190];Dispositivi elettronici > accessori
153||MK_000000151978;153;Monclick;TD_MANAGER;MK_000000151978;Tagliere Tagliere in legno di mango 35 cm;"Tipologia: Tagliere;";Casalinghi > Accessori da cucina;[113,190];Dispositivi elettronici > accessori
153||MK_000000151980;153;Monclick;TD_MANAGER;MK_000000151980;Tastiera Surface pro x signature keyboard with slim pen bundle - tastiera qsw-00010;"Connettività: n.d.; Interfaccia: n.d.; Layout: n.d.; Colore: Nero;";Monitor e Periferiche PC > Tastiere;[113,191];Dispositivi elettronici > accessori computer e tablet
153||MK_000000151992;153;Monclick;TD_MANAGER;MK_000000151992;Cover posteriore Wally - flip cover per cellulare wally890wh;"Tipologia: Cover posteriore; Adatta per: Per cellulare; Dimensione monitor: Non applicabile; Colore: Bianco;";Accessori > Borse e custodie;[113,190];Dispositivi elettronici > accessori
153||MK_000000151993;153;Monclick;TD_MANAGER;MK_000000151993;Q1798-le - telecamera di sorveglianza connessa in rete 01702-001;"Tipologia: Telecamera di videosorveglianza; Movimento: Fisso; Uso notturno: Sì; Collocazione: n.d.; Interfaccia di rete: Ethernet 10Base-T/100Base-TX/1000Base-T; Supporto audio: Sì;";Networking e Wireless > Videosorveglianza;[111,189];Casa e giardino > Sistemi di allarme
153||MK_000000151994;153;Monclick;TD_MANAGER;MK_000000151994;Videogioco Tokyo mirage sessions #fe encore - nintendo switch 10002097;"Piattaforma: Nintendo Switch; Genere: Gioco di ruolo (RPG) - RPG stile console; PEGI rating >: 12; Publisher: Nintendo;";Giochi e Console > Videogiochi;[113,206];Dispositivi elettronici > videogiochi
153||MK_000000151996;153;Monclick;TD_MANAGER;MK_000000151996;Toner Tk 5345y - giallo - originale - cartuccia toner 1t02zlanl0;"Tipologia: Toner; Colore: Giallo; Quantità per confezione: Confezione da 1;";Consumabili > Cartucce e toner;[113,192];Dispositivi elettronici > accessori stampanti
153||MK_000000151999;153;Monclick;TD_MANAGER;MK_000000151999;Toner Tk 5345c - ciano - originale - cartuccia toner 1t02zlcnl0;"Tipologia: Toner; Colore: Ciano; Quantità per confezione: Confezione da 1;";Consumabili > Cartucce e toner;[113,192];Dispositivi elettronici > accessori stampanti
153||MK_000000152005;153;Monclick;TD_MANAGER;MK_000000152005;Toner Tk 5345m - magenta - originale - cartuccia toner 1t02zlbnl0;"Tipologia: Toner; Colore: Magenta; Quantità per confezione: Confezione da 1;";Consumabili > Cartucce e toner;[113,192];Dispositivi elettronici > accessori stampanti
153||MK_000000152007;153;Monclick;TD_MANAGER;MK_000000152007;Toner Tk 5345k - nero - originale - cartuccia toner 1t02zl0nl0;"Tipologia: Toner; Colore: Nero; Quantità per confezione: Confezione da 1;";Consumabili > Cartucce e toner;[113,192];Dispositivi elettronici > accessori stampanti
153||MK_000000152012;153;Monclick;TD_MANAGER;MK_000000152012;Cartelletta CF10CARTELLE 3LEMBI C/ELAST VERDE C;"Tipologia: n.d.; Colore: n.d.; Quantità per confezione: 10;";Prodotti per scuola e ufficio > Cartellette;[111,188];Casa e giardino > sicurezza
153||MK_000000152022;153;Monclick;TD_MANAGER;MK_000000152022;Bottiglia termica Picnik concept kids - tazza termica - 460 ml 871901;"Capacità: 460 ml; Materiale: Cartone;";Casalinghi > Bottiglie termiche;[111,170];Casa e giardino > Accessori cucina
153||MK_000000152025;153;Monclick;TD_MANAGER;MK_000000152025;Bottiglia termica Picnik concept adults - tazza termica - blu - 320 ml 871903;"Capacità: 320 ml; Materiale: Acciaio inossidabile;";Casalinghi > Bottiglie termiche;[111,170];Casa e giardino > Accessori cucina
153||MK_000000152028;153;Monclick;TD_MANAGER;MK_000000152028;Contenitore Lunch box in Vetro Blu;"Capacità: 1.2 litri;";Casalinghi > Contenitori;[111,185];Casa e giardino > Prodotti per la casa
153||MK_000000152040;153;Monclick;TD_MANAGER;MK_000000152040;Contenitore Lunch box in Vetro Rosa;"Capacità: 1.2 litri;";Casalinghi > Contenitori;[111,185];Casa e giardino > Prodotti per la casa
153||MK_000000152042;153;Monclick;TD_MANAGER;MK_000000152042;Notebook Vivobook s15 s532fl-bn239t - 15.6'' - core i7 10510u - 8 gb ram 90nb0mj1-m04090;"Tipologia: Notebook; Dimensione schermo: 15,6 ''; Sistema operativo: Windows 10 Home; Tipo processore: Intel Core i7; Serie scheda video: NVIDIA GeForce MX; Scheda grafica dedicata: 2 GB; Memoria RAM: 8 GB; Touchscreen: No; Modello processore: I7-10510U; Modello scheda grafica: NVIDIA GeForce MX250; RAM massima: 8; Tipo hard disk: SSD; Capacità hard disk: 512 GB; Peso: 1.8 kg; Risoluzione: 1920 x 1080 Pixels; Unità ottica installata: Nessuna unità ottica; Colore: Verde; Marchio processore: Intel;";PC Notebook e Tablet > Notebook;[113,197];Dispositivi elettronici > computer e tablet
153||MK_000000152046;153;Monclick;TD_MANAGER;MK_000000152046;Telefono cellulare Riff 3 plus - bianco - telefono con funzionalità - gsm wikrifpluwb24whist;"Dual Sim: Sì; Fotocamera: 0.3 Megapixel; Interfaccia wireless: Bluetooth 2.1; Dimensione schermo: 2.4 ''; Memoria interna: 0 Mb; Scheda di memoria: microSD; Colore: Bianco;";Telefoni cellulari e fissi > Telefoni cellulari;[113,202];Dispositivi elettronici > telefoni cellulari
153||MK_000000152049;153;Monclick;TD_MANAGER;MK_000000152049;Adattatore Startech.com cavo adattatore usb-c a displayport 1.2 da 2 m cdp2dp2mbd;"Tipo connettore esterno: USB-C 24 pin; Tipo connettore interno: DisplayPort a 20 pin;";Accessori > Adattatori;[113,190];Dispositivi elettronici > accessori
153||MK_000000152060;153;Monclick;TD_MANAGER;MK_000000152060;Smartphone View 4 Blue 64 GB Dual Sim Fotocamera 13 MP;"Sistema operativo: Android 10; Dual sim: Sì; Fotocamera: 13 MP; Memoria interna: 64 GB; Display: 6,52 ''; Rete: 4G; RAM: 3 GB; N core processore: Octa-core; Colore: Blue; Modello: View 4; Serie: View;";Telefoni cellulari e fissi > Smartphone;[113,202];Dispositivi elettronici > telefoni cellulari
153||MK_000000152061;153;Monclick;TD_MANAGER;MK_000000152061;Adattatore Startech.com cavo adattatore usb-c a displayport 1.2 da 1 m cdp2dp1mbd;"Tipo connettore esterno: USB-C 24 pin; Tipo connettore interno: DisplayPort a 20 pin;";Accessori > Adattatori;[113,190];Dispositivi elettronici > accessori
153||MK_000000152068;153;Monclick;TD_MANAGER;MK_000000152068;Smartphone View 4 Lite Deep Green 32 GB Dual Sim Fotocamera 13 MP;"Sistema operativo: Android 10; Dual sim: Sì; Fotocamera: 13 MP; Memoria interna: 32 GB; Display: 6,5 ''; Rete: 4G; RAM: 2 GB; N core processore: Octa-core; Colore: Deep Green; Modello: View 4 Lite; Serie: View;";Telefoni cellulari e fissi > Smartphone;[113,202];Dispositivi elettronici > telefoni cellulari
153||MK_000000152104;153;Monclick;TD_MANAGER;MK_000000152104;Cappa KPL90PLAG1NEA A parete 90 cm 600 m3/h Nero opaco/acciaio inox;"Tipologia: A parete; Capacità max aspirazione: 600 m3/h; N. velocità: 4; Larghezza: 90 cm; Profondità: 46 cm; Colore: Nero opaco/acciaio inox; Modello: KPL90PLAG1NEA;";Elettrodomestici da incasso > Cappe;[114,209];Elettrodomestici > Grandi elettrodomestici
153||MK_000000152105;153;Monclick;TD_MANAGER;MK_000000152105;Cappa KPL90PLAG1VIA A parete 90 cm 600 m3/h Rosso;"Tipologia: A parete; Capacità max aspirazione: 600 m3/h; N. velocità: 4; Larghezza: 90 cm; Profondità: 46 cm; Colore: Rosso; Modello: KPL90PLAG1VIA;";Elettrodomestici da incasso > Cappe;[114,209];Elettrodomestici > Grandi elettrodomestici
153||MK_000000152115;153;Monclick;TD_MANAGER;MK_000000152115;Termoventilatore Efh 6030 - termoventilatore efh6030;"Tipologia: Termoventilatore; Funzioni: Riscaldamento; Potenza: n.d.;";Climatizzazione > Riscaldamento;[111,173];Casa e giardino > Climatizzazione
153||MK_000000152176;153;Monclick;TD_MANAGER;MK_000000152176;Docking station Travel hub g2 - duplicatore di porte - usb-c - vga, hdmi 7pj38aa;"Tipologia: Duplicatore di porte;";Accessori > Docking station;[113,191];Dispositivi elettronici > accessori computer e tablet
