Identification;EshopId;EshopName;ManagerClassName;ProductItemId;Name;Description;SearchCategoryKey;CategoryId;CategoryDesc
153||MK_000000166014;153;Monclick;TD_MANAGER;MK_000000166014;Cartelletta CF10SEPARATORI DIVIDERELLO.ASS A5;"Tipologia: Divisorio; Colore: Assortiti; Quantità per confezione: 10;";Prodotti per scuola e ufficio > Cartellette;[111,188];Casa e giardino > sicurezza
153||MK_000000166019;153;Monclick;TD_MANAGER;MK_000000166019;Bicicletta E-BIKE J5 - Ruote 26'' - Velocità massima 25 Km/h - Autonomia 55 Km - Nero;"Tipologia: Bicicletta elettrica; Dimensione ruote: 26''; Tipo freni: Freno a V; Materiale telaio: Acciaio; Colore: Nero;";Tempo libero > Biciclette;[126];Veicoli elettrici
153||MK_000000166023;153;Monclick;TD_MANAGER;MK_000000166023;Toner Magenta - originale - cartuccia toner - lrp 73b20m0;"Tipologia: Toner; Colore: Magenta; Quantità per confezione: Confezione da 1;";Consumabili > Cartucce e toner;[113,192];Dispositivi elettronici > accessori stampanti
153||MK_000000166025;153;Monclick;TD_MANAGER;MK_000000166025;Toner Alta resa - ciano - originale - cartuccia toner - lccp, lrp c332hc0;"Tipologia: Toner; Colore: Ciano; Quantità per confezione: Confezione da 1;";Consumabili > Cartucce e toner;[113,192];Dispositivi elettronici > accessori stampanti
153||MK_000000166027;153;Monclick;TD_MANAGER;MK_000000166027;Toner Alta resa - nero - originale - cartuccia toner - lccp, lrp c332hk0;"Tipologia: Toner; Colore: Nero; Quantità per confezione: Confezione da 1;";Consumabili > Cartucce e toner;[113,192];Dispositivi elettronici > accessori stampanti
153||MK_000000166034;153;Monclick;TD_MANAGER;MK_000000166034;Toner Alta resa - giallo - originale - cartuccia toner - lccp, lrp c332hy0;"Tipologia: Toner; Colore: Giallo; Quantità per confezione: Confezione da 1;";Consumabili > Cartucce e toner;[113,192];Dispositivi elettronici > accessori stampanti
153||MK_000000166036;153;Monclick;TD_MANAGER;MK_000000166036;Toner Alta resa - magenta - originale - cartuccia toner - lccp, lrp c332hm0;"Tipologia: Toner; Colore: Magenta; Quantità per confezione: Confezione da 1;";Consumabili > Cartucce e toner;[113,192];Dispositivi elettronici > accessori stampanti
153||MK_000000166041;153;Monclick;TD_MANAGER;MK_000000166041;Multifunzione inkjet WF-C878RDWF A3 Quadricromia 4800 x 1200 dpi C11CH60401;"Formato massimo: A3; Interfaccia: Gigabit LAN, Host USB 2.0, USB 3.0, Wi-Fi(n); Funzioni: Copiatrice, Fax, Scanner, Stampante; Risoluzione max colore: 4800 x 1200 dpi; Fronte-retro: Sì; Cromia: Quadricromia; Velocità di stampa colore: 35 ppm; Velocità di stampa B/N: 35 ppm; Duty cycle: 75000 pagine; Capacità fogli standard: 335 fogli; Alimentazione: ADF; Modello: WF-C878RDWF;";Stampanti e Scanner > Multifunzione inkjet;[113,201];Dispositivi elettronici > stampanti
153||MK_000000166048;153;Monclick;TD_MANAGER;MK_000000166048;Raccoglitore RACC.PERS.STELVIO TI 100 4Q BLU;"Tipologia: Raccoglitore ad anelli; Quantità per confezione: 1;";Prodotti per scuola e ufficio > Raccoglitori, classificatori e valigette;[111,188];Casa e giardino > sicurezza
153||MK_000000166057;153;Monclick;TD_MANAGER;MK_000000166057;Raccoglitore P/LISTINO PERS. ASSO TI 100 B. BLU;"Tipologia: Portalistini per presentazione; Quantità per confezione: 1;";Prodotti per scuola e ufficio > Raccoglitori, classificatori e valigette;[111,188];Casa e giardino > sicurezza
153||MK_000000166067;153;Monclick;TD_MANAGER;MK_000000166067;Raccoglitore P/LISTINO PERS. ASSO TI 30 B. BLU;"Tipologia: Portalistini per presentazione; Quantità per confezione: 1;";Prodotti per scuola e ufficio > Raccoglitori, classificatori e valigette;[111,188];Casa e giardino > sicurezza
153||MK_000000166069;153;Monclick;TD_MANAGER;MK_000000166069;Cartelletta CF10 BUSTE CON FORAT. ATLA PRIVACY;"Tipologia: Busta trasparente; Colore: Bianco opaco; Quantità per confezione: 10;";Prodotti per scuola e ufficio > Cartellette;[111,188];Casa e giardino > sicurezza
153||MK_000000166071;153;Monclick;TD_MANAGER;MK_000000166071;Raccoglitore P/LISTINO PERS. ASSO TI 40 B. BIAN;"Tipologia: Porta listini; Quantità per confezione: 1;";Prodotti per scuola e ufficio > Raccoglitori, classificatori e valigette;[111,188];Casa e giardino > sicurezza
153||MK_000000166073;153;Monclick;TD_MANAGER;MK_000000166073;Raccoglitore P/LISTINO PERS. ASSO TI 30 B. BIAN;"Tipologia: Porta listini; Quantità per confezione: 1;";Prodotti per scuola e ufficio > Raccoglitori, classificatori e valigette;[111,188];Casa e giardino > sicurezza
153||MK_000000166084;153;Monclick;TD_MANAGER;MK_000000166084;Raccoglitore CF15 P/LIST.PERS. ASSO TI 40 B. ASS;"Tipologia: Portalistini per presentazione; Quantità per confezione: 1;";Prodotti per scuola e ufficio > Raccoglitori, classificatori e valigette;[111,188];Casa e giardino > sicurezza
153||MK_000000166089;153;Monclick;TD_MANAGER;MK_000000166089;Raccoglitore P/LISTINO PERS. ASSO TI 100 B. BIAN;"Tipologia: Portalistini per presentazione; Quantità per confezione: 1;";Prodotti per scuola e ufficio > Raccoglitori, classificatori e valigette;[111,188];Casa e giardino > sicurezza
153||MK_000000166093;153;Monclick;TD_MANAGER;MK_000000166093;Raccoglitore P/LISTINO PERS. ASSO TI 80 B. BIAN;"Tipologia: Porta listini; Quantità per confezione: 1;";Prodotti per scuola e ufficio > Raccoglitori, classificatori e valigette;[111,188];Casa e giardino > sicurezza
153||MK_000000167557;153;Monclick;TD_MANAGER;MK_000000167557;Monitor LED Gaming - monitor a led - 27'' q27g2u/bk;"Tipo display: Monitor LCD con retroilluminazione a LED; Pollici: 27 ''; Risoluzione: 2560 x 1440 Pixel; Formato: 16:9; Tecnologia pannello: VA; Touchscreen: No; Uscita audio: Nessuno; Regolazione posizione: Altezza, Inclinazione, Piano girevole, Snodo (rotazione); Wi-Fi: Nessuna; Luminosità: 250 cd/m; Tempo di risposta: 1 ms;";Monitor e Periferiche PC > Monitor PC;[113,191];Dispositivi elettronici > accessori computer e tablet
153||MK_000000167560;153;Monclick;TD_MANAGER;MK_000000167560;Monitor LED Monitor 27 16.9 agon 2560 ag273qz;"Tipo display: n.d.; Pollici: n.d.; Risoluzione: n.d.; Formato: 4:3; Tecnologia pannello: LED; Touchscreen: No; Uscita audio: Nessuno; Regolazione posizione: No; Wi-Fi: Nessuna; Luminosità: n.d.; Tempo di risposta: n.d.;";Monitor e Periferiche PC > Monitor PC;[113,191];Dispositivi elettronici > accessori computer e tablet
153||MK_000000167563;153;Monclick;TD_MANAGER;MK_000000167563;Monitor LED Gaming - agon series - monitor a led - curvato - 35'' - hdr ag353ucg;"Tipo display: Monitor curvo; Pollici: 35 ''; Risoluzione: 3440 x 1440 Pixel; Formato: 21:9; Tecnologia pannello: LED; Touchscreen: No; Uscita audio: Altoparlanti; Regolazione posizione: Altezza, Inclinazione, Piano girevole; Wi-Fi: Nessuna; Luminosità: 1000 cd/m; Tempo di risposta: 2 ms;";Monitor e Periferiche PC > Monitor PC;[113,191];Dispositivi elettronici > accessori computer e tablet
153||MK_000000167565;153;Monclick;TD_MANAGER;MK_000000167565;Monitor LED Gaming - monitor a led - curvato - 34'' cu34g2x/bk;"Tipo display: Monitor curvo; Pollici: 34 ''; Risoluzione: 3440 x 1440 Pixel; Formato: 21:9; Tecnologia pannello: VA; Touchscreen: No; Uscita audio: Nessuno; Regolazione posizione: Altezza, Inclinazione, Piano girevole; Wi-Fi: Nessuna; Luminosità: 300 cd/m; Tempo di risposta: 1 ms;";Monitor e Periferiche PC > Monitor PC;[113,191];Dispositivi elettronici > accessori computer e tablet
153||MK_000000167569;153;Monclick;TD_MANAGER;MK_000000167569;Monitor LED Gaming - monitor a led - curvato - 27'' cq27g2u/bk;"Tipo display: Monitor curvo; Pollici: 27 ''; Risoluzione: 2560 x 1440 Pixel; Formato: 16:9; Tecnologia pannello: VA; Touchscreen: No; Uscita audio: Altoparlanti; Regolazione posizione: Altezza, Inclinazione, Piano girevole, Snodo (rotazione); Wi-Fi: Nessuna; Luminosità: 250 cd/m; Tempo di risposta: 1 ms;";Monitor e Periferiche PC > Monitor PC;[113,191];Dispositivi elettronici > accessori computer e tablet
153||MK_000000167571;153;Monclick;TD_MANAGER;MK_000000167571;Monitor LED Gaming - monitor a led - curvato - 34'' cu34g2/bk;"Tipo display: Monitor curvo; Pollici: 34 ''; Risoluzione: 3440 x 1440 Pixel; Formato: 21:9; Tecnologia pannello: VA; Touchscreen: No; Uscita audio: Nessuno; Regolazione posizione: Altezza, Inclinazione, Piano girevole; Wi-Fi: Nessuna; Luminosità: 300 cd/m; Tempo di risposta: 1 ms;";Monitor e Periferiche PC > Monitor PC;[113,191];Dispositivi elettronici > accessori computer e tablet
153||MK_000000167576;153;Monclick;TD_MANAGER;MK_000000167576;Zaino Driftertrek with usb power pass-thru - zaino porta computer tsb956gl;"Tipologia: Zaino; Adatta per: Notebook; Dimensione monitor: 15.6 pollici; Colore: Nero;";Accessori > Borse e custodie;[113,190];Dispositivi elettronici > accessori
153||MK_000000167580;153;Monclick;TD_MANAGER;MK_000000167580;Memoria RAM Hpe smartmemory - ddr4 - modulo - 8 gb - dimm 288-pin p00918-b21;"Tecnologia: DDR4 SDRAM; Capacità: 8 GB; Clock: 2933 MHz; Tipo modulo: DIMM 288-PIN; Nome modulo: PC4-23400; Error checking: ECC; Ampiezza modulo: Registrato;";HDD e Componenti PC > Memorie RAM;[113,191];Dispositivi elettronici > accessori computer e tablet
153||MK_000000167599;153;Monclick;TD_MANAGER;MK_000000167599;Notebook Pavilion Gaming 17-cd0013nl 17,3'' Core i7 RAM 16GB HDD+SSD 1TB+256GB;"Tipologia: Notebook; Dimensione schermo: 17,3 ''; Sistema operativo: Windows 10 Home; Tipo processore: Intel Core i7; Serie scheda video: NVIDIA GeForce; Scheda grafica dedicata: 4 GB; Memoria RAM: 16 GB; Touchscreen: No; Modello processore: i7-9750H; Modello scheda grafica: NVIDIA GeForce GTX 1650; RAM massima: 16 GB; Tipo hard disk: SSD; Capacità hard disk: 256 GB; Peso: 2,7 kg; Risoluzione: 1920 x 1080 Pixels; Unità ottica installata: Nessuna Unità Ottica; Colore: Argento e nero; Marchio processore: Intel;";PC Notebook e Tablet > Notebook;[113,197];Dispositivi elettronici > computer e tablet
153||MK_000000167601;153;Monclick;TD_MANAGER;MK_000000167601;Notebook OMEN 17-cb0029nl 17,3'' Core i7 RAM 16GB HDD+SSD 1TB+256GB;"Tipologia: Notebook; Dimensione schermo: 17,3 ''; Sistema operativo: Windows 10 Home; Tipo processore: Intel Core i7; Serie scheda video: NVIDIA Geforce; Scheda grafica dedicata: 6 GB; Memoria RAM: 16 GB; Touchscreen: No; Modello processore: i7-9750H; Modello scheda grafica: NVIDIA GeForce RTX 2060; RAM massima: 16 GB; Tipo hard disk: HDD + SSD; Capacità hard disk: 1000+256; Peso: 3.3 kg; Risoluzione: 1920 x 1080 Pixels; Unità ottica installata: Nessuna Unità Ottica; Colore: Nero; Marchio processore: Intel;";PC Notebook e Tablet > Notebook;[113,197];Dispositivi elettronici > computer e tablet
153||MK_000000167603;153;Monclick;TD_MANAGER;MK_000000167603;Termometro Ft 85 - termometro 79506;"Tipologia: Termometro; Colore: Bianco;";Salute e Bellezza > Termometri;[122,211];Salute e bellezza > Apparecchiature mediche
153||MK_000000167637;153;Monclick;TD_MANAGER;MK_000000167637;Notebook Aspire 5 A514-53-524K 14'' Core i5 RAM 8GB SSD 512GB;"Tipologia: Notebook; Dimensione schermo: 14 ''; Sistema operativo: Windows 10 Home; Tipo processore: Intel Core i5; Serie scheda video: Intel UHD; Scheda grafica dedicata: Integrata; Memoria RAM: 8 GB; Touchscreen: No; Modello processore: i5-1035G1; Modello scheda grafica: Intel UHD Graphics; RAM massima: 8 GB; Tipo hard disk: SSD; Capacità hard disk: 512 GB; Peso: 1.7 kg; Risoluzione: 1920 x 1080 Pixels; Unità ottica installata: Nessuna Unità Ottica; Colore: Argento e nero; Marchio processore: Intel;";PC Notebook e Tablet > Notebook;[113,197];Dispositivi elettronici > computer e tablet
153||MK_000000167649;153;Monclick;TD_MANAGER;MK_000000167649;Lavatrice da incasso BI WMHG 81284 EU 8 Kg Classe C;"Capacità carico: 8 kg; Profondità: 54.5 cm; Efficienza energetica: Classe C; Velocità centrifuga: 1200 rpm; Motore inverter: Sì; Profondità incasso: 57 cm; Altezza: 82 cm; Altezza incasso: 82 cm; Larghezza: 59.5 cm; Larghezza incasso: 60 cm; Colore: Bianco; Modello: BI WMHG 81284 EU;";Elettrodomestici da incasso > Lavatrici da incasso;[114,209];Elettrodomestici > Grandi elettrodomestici
153||MK_000000167651;153;Monclick;TD_MANAGER;MK_000000167651;Regolabarba BeardTrimmer 3 BT3240 Cordless Autonomia 80 minuti;"Cordless: Sì; Autonomia: 80 min; Serie: BeardTrimmer 3; Modello: BT3240;";Salute e Bellezza > Regolabarba;[122,211];Salute e bellezza > Apparecchiature mediche
153||MK_000000167652;153;Monclick;TD_MANAGER;MK_000000167652;Regolabarba BT5240 Cordless Autonomia 100 minuti;"Cordless: Sì; Autonomia: 100 min; Serie: n.d.; Modello: BT5240;";Salute e Bellezza > Regolabarba;[122,211];Salute e bellezza > Apparecchiature mediche
153||MK_000000167654;153;Monclick;TD_MANAGER;MK_000000167654;Regolabarba All-in-One Trimmer 3 MGK3220 Cordless Autonomia 50 minuti;"Cordless: Sì; Autonomia: 50 min; Serie: All-in-One Trimmer 3; Modello: MGK3220;";Salute e Bellezza > Regolabarba;[122,211];Salute e bellezza > Apparecchiature mediche
153||MK_000000167656;153;Monclick;TD_MANAGER;MK_000000167656;Rifinitore All-in-one 7-In-1 MGK5245 Cordless Autonomia 100 minuti;"Cordless: Sì; Autonomia: 100 min; Serie: All-in-one 7-In-1; Modello: MGK5245;";Salute e Bellezza > Regolabarba;[122,211];Salute e bellezza > Apparecchiature mediche
153||MK_000000167657;153;Monclick;TD_MANAGER;MK_000000167657;Regolabarba MGK5260 8-in-1 Cordless Autonomia 100 minuti;"Cordless: Sì; Autonomia: 100 min; Serie: n.d.; Modello: MGK5260 8-in-1;";Salute e Bellezza > Regolabarba;[122,211];Salute e bellezza > Apparecchiature mediche
153||MK_000000167664;153;Monclick;TD_MANAGER;MK_000000167664;Videogioco MotoGP 20 PS4;"Piattaforma: Sony PlayStation 4; Genere: Corsa / guida - motocross motocicli; PEGI rating >: 3; Publisher: Milestone S.r.l.;";Giochi e Console > Videogiochi;[113,206];Dispositivi elettronici > videogiochi
153||MK_000000167668;153;Monclick;TD_MANAGER;MK_000000167668;Evolve2 65 ms stereo - cuffie con microfono 26599-999-999;"Tipologia: Cuffie con microfono; Connettività: Senza fili; Tecnologia wireless: Bluetooth; Colore: Nero; Serie: Evolve2; Modello: 65 MS Stereo;";Home Cinema e Audio > Cuffie e auricolari;[113,196];Dispositivi elettronici > audio
153||MK_000000167670;153;Monclick;TD_MANAGER;MK_000000167670;Penna Safari 317 - penna a sfera - blu 1214117;"Quantità per confezione: 1; Tipologia: Penna a sfera; Colore: Blu; Tipo inchiostro: n.d.;";Prodotti per scuola e ufficio > Penne;[111,188];Casa e giardino > sicurezza
153||MK_000000167673;153;Monclick;TD_MANAGER;MK_000000167673;Zaino Citygear 3 convertable - zaino porta computer tcg661gl;"Tipologia: Zaino; Adatta per: Notebook; Dimensione monitor: 15.6 pollici; Colore: Nero;";Accessori > Borse e custodie;[113,190];Dispositivi elettronici > accessori
153||MK_000000167674;153;Monclick;TD_MANAGER;MK_000000167674;Videogioco Motogp 20 - microsoft xbox one 1052280;"Piattaforma: Microsoft Xbox One; Genere: Corsa / guida - motocross motocicli; PEGI rating >: 3; Publisher: Milestone S.r.l.;";Giochi e Console > Videogiochi;[113,206];Dispositivi elettronici > videogiochi
153||MK_000000167683;153;Monclick;TD_MANAGER;MK_000000167683;Cuffie con microfono Evolve2 65 UC Stereo Nero;"Tipologia: Cuffie con microfono; Connettività: Senza fili; Tecnologia wireless: Bluetooth; Colore: Nero; Serie: Evolve2; Modello: 65 UC Stereo;";Home Cinema e Audio > Cuffie e auricolari;[113,196];Dispositivi elettronici > audio
153||MK_000000167689;153;Monclick;TD_MANAGER;MK_000000167689;Dispenser easy soap manuale bianco 247-s;"Tipologia: n.d.; Q.tà per confezione: n.d.;";Prodotti per scuola e ufficio > Prodotti per la pulizia;[111,188];Casa e giardino > sicurezza
153||MK_000000167694;153;Monclick;TD_MANAGER;MK_000000167694;Dispenser easy soap automat bianco 249-s;"Tipologia: n.d.; Q.tà per confezione: n.d.;";Prodotti per scuola e ufficio > Prodotti per la pulizia;[111,188];Casa e giardino > sicurezza
153||MK_000000167695;153;Monclick;TD_MANAGER;MK_000000167695;Dispenser Dispenser automatico gel igienizzante/Sapone liquido Nero;"Tipologia: Dispenser gel igienizzante;";Salute e Bellezza > Salute e igiene;[122,211];Salute e bellezza > Apparecchiature mediche
153||MK_000000167697;153;Monclick;TD_MANAGER;MK_000000167697;Scopa elettrica H-Free 100 HF122RH 011 Senza fili Senza sacco Argento, Rosso;"Alimentazione: Senza fili; Tipologia: Senza sacco; Potenza: n.d.; Colore: Argento, Rosso; Serie: H-Free 100; Modello: HF122RH 011;";Piccoli elettrodomestici > Scope elettriche;[114,208];Elettrodomestici > accessori piccoli elettrodomestici
153||MK_000000167698;153;Monclick;TD_MANAGER;MK_000000167698;Pulsiossimetro PO 30;"Tipologia: Pulsiossimetro;";Salute e Bellezza > Salute e igiene;[122,211];Salute e bellezza > Apparecchiature mediche
153||MK_000000167704;153;Monclick;TD_MANAGER;MK_000000167704;Hub Docking station - usb-c / thunderbolt 3 - hdmi - gige dub-m520;"Tipologia: Docking station; Q.ta porte: n.d.; Colore: Grigio;";Networking e Wireless > Hub;[111,189];Casa e giardino > Sistemi di allarme
153||MK_000000167705;153;Monclick;TD_MANAGER;MK_000000167705;Pulsiossimetro Misuratore di saturazione e frequenza cardiaca 45440;"Tipologia: Pulsiossimetro;";Salute e Bellezza > Salute e igiene;[122,211];Salute e bellezza > Apparecchiature mediche
153||MK_000000167727;153;Monclick;TD_MANAGER;MK_000000167727;Forno per pizza Pizza Express Delizia 1200 W Blu;"Tipologia: Forno per pizza;";Piccoli elettrodomestici > Conviviali;[114,208];Elettrodomestici > accessori piccoli elettrodomestici
153||MK_000000167728;153;Monclick;TD_MANAGER;MK_000000167728;Forno elettrico Copper Delizia Non dichiarata Litri 1.2 W;"Capacità: Non dichiarata; Larghezza: 33.5 cm; Potenza: 1.2 kW; Serie: Delizia; Modello: Copper;";Piccoli elettrodomestici > Forni elettrici;[114,208];Elettrodomestici > accessori piccoli elettrodomestici
153||MK_000000167729;153;Monclick;TD_MANAGER;MK_000000167729;Forno per pizza Pizza Express Delizia 1200 W Verde;"Tipologia: Forno per pizza;";Piccoli elettrodomestici > Conviviali;[114,208];Elettrodomestici > accessori piccoli elettrodomestici
153||MK_000000167730;153;Monclick;TD_MANAGER;MK_000000167730;Forno elettrico Silver Delizia Non dichiarata Litri 1.2 W;"Capacità: Non dichiarata; Larghezza: 33.5 cm; Potenza: 1.2 kW; Serie: Delizia; Modello: Silver;";Piccoli elettrodomestici > Forni elettrici;[114,208];Elettrodomestici > accessori piccoli elettrodomestici
153||MK_000000167731;153;Monclick;TD_MANAGER;MK_000000167731;Forno per pizza Pizza Express Delizia 1200 W Giallo;"Tipologia: Forno per pizza;";Piccoli elettrodomestici > Conviviali;[114,208];Elettrodomestici > accessori piccoli elettrodomestici
153||MK_000000167733;153;Monclick;TD_MANAGER;MK_000000167733;Coperta Babbo natale con plaid 90x75 14245;"Profondità: n.d.; Linea: n.d.;";Casalinghi > Coperte;[111,172];Casa e giardino > Biancheria
153||MK_000000167737;153;Monclick;TD_MANAGER;MK_000000167737;Coperta Coperta Cagnolino 44915;"Profondità: 90 cm; Linea: Peluche coperta;";Casalinghi > Coperte;[111,172];Casa e giardino > Biancheria
153||MK_000000167738;153;Monclick;TD_MANAGER;MK_000000167738;Coperta Coperta Cagnolino 44922;"Profondità: 90 cm; Linea: Peluche coperta;";Casalinghi > Coperte;[111,172];Casa e giardino > Biancheria
153||MK_000000167739;153;Monclick;TD_MANAGER;MK_000000167739;Coperta Coperta 90x75 con renna grigia 44939;"Profondità: n.d.; Linea: n.d.;";Casalinghi > Coperte;[111,172];Casa e giardino > Biancheria
153||MK_000000167742;153;Monclick;TD_MANAGER;MK_000000167742;Coperta Renna natalizia con plaid 90x75 44960;"Profondità: n.d.; Linea: n.d.;";Casalinghi > Coperte;[111,172];Casa e giardino > Biancheria
153||MK_000000167745;153;Monclick;TD_MANAGER;MK_000000167745;Graffatrice - 15 fogli - plastica, metallo - blu metallizzato 55450033;"Tipologia: Graffatrice; Capacità di cucitura: 15 fogli; Quantità per confezione: 1;";Prodotti per scuola e ufficio > Cucitrici e levapunti;[111,188];Casa e giardino > sicurezza
153||MK_000000167746;153;Monclick;TD_MANAGER;MK_000000167746;Notebook V14-iil - 14'' - core i5 1035g1 - 8 gb ram - 256 gb ssd - italiana 82c40019ix;"Tipologia: Notebook; Dimensione schermo: 14 ''; Sistema operativo: Windows 10 Pro; Tipo processore: Intel Core i5; Serie scheda video: Intel UHD; Scheda grafica dedicata: Integrata; Memoria RAM: 8 GB; Touchscreen: No; Modello processore: I5-1035G1; Modello scheda grafica: Intel UHD Graphics; RAM massima: 12 GB; Tipo hard disk: SSD; Capacità hard disk: 256 GB; Peso: 1.6 kg; Risoluzione: 1920 x 1080 Pixels; Unità ottica installata: Nessuna unità ottica; Colore: Grigio; Marchio processore: Intel;";PC Notebook e Tablet > Notebook;[113,197];Dispositivi elettronici > computer e tablet
153||MK_000000167749;153;Monclick;TD_MANAGER;MK_000000167749;Scanner Dsmobile - scanner con alimentatore di fogli - portatile - usb 3.0 ds-640;"Formato massimo: Altro; Documenti supportati: Bigliettini da visita, Carta comune, Foto, Ricevute, Scheda in plastica; Interfaccia: USB 3.0; Alimentazione documenti: Manuale; Compatibilità: Apple macOS 10.12.x, Apple macOS 10.13.x, Apple macOS Mojave 10.14.x, Linux, Microsoft Windows 7 SP1, Microsoft Windows Server 2012, Microsoft Windows Server 2012 R2, Microsoft Windows Server 2016, Microsoft Windows Server 2019, Windows 10, Windows 8.1;";Stampanti e Scanner > Scanner;[113,201];Dispositivi elettronici > stampanti
153||MK_000000167751;153;Monclick;TD_MANAGER;MK_000000167751;Tempera Pittura - tempera - colori assortiti - 250 ml (pacchetto di 6) 3926;"Colore: n.d.; Q.tà per confezione: n.d.;";Prodotti per scuola e ufficio > Tempere;[111,188];Casa e giardino > sicurezza
153||MK_000000167763;153;Monclick;TD_MANAGER;MK_000000167763;Hpe aruba ap-mnt-e - kit di montaggio per dispositivo di rete r3j19a;"Tipologia: Kit di montaggio per dispositivo di rete;";Accessori > Accessori server e networking;[113,191];Dispositivi elettronici > accessori computer e tablet
153||MK_000000167771;153;Monclick;TD_MANAGER;MK_000000167771;Videogioco Predator Hunting Grounds PS4;"Piattaforma: Sony PlayStation 4; Genere: Azione - sparatutto in prima persona, Azione - sparatutto in terza persona; PEGI rating >: 18; Publisher: Sony Interactive Entertainment Europe;";Giochi e Console > Videogiochi;[113,206];Dispositivi elettronici > videogiochi
153||MK_000000167782;153;Monclick;TD_MANAGER;MK_000000167782;Smartphone Motorola Edge 5G Midnight Black 128 GB Dual Sim Fotocamera 64 MP;"Sistema operativo: Android 10; Dual sim: Sì; Fotocamera: 64 MP; Memoria interna: 128 GB; Display: 6,7 ''; Rete: 5G; RAM: 6 GB; N core processore: Octa-core; Colore: Midnight Black; Modello: Motorola Edge 5G; Serie: Edge;";Telefoni cellulari e fissi > Smartphone;[113,202];Dispositivi elettronici > telefoni cellulari
153||MK_000000167790;153;Monclick;TD_MANAGER;MK_000000167790;Purificatore d'aria Series 1000 AC1215/10;"Tipologia: Purificazione; Colore: Bianco/nero;";Climatizzazione > Purificatori d'aria;[111,173];Casa e giardino > Climatizzazione
153||MK_000000167801;153;Monclick;TD_MANAGER;MK_000000167801;Monitor LFD Sl6502k smart signage series 9h.f68pk.na6;"Pollici: 65 ''; Risoluzione: 3840 x 2160; Formato: 16:9; Tecnologia pannello: LED; Uscita audio: 2 altoparlanti; Interfacce: HDMI; Connettività: LAN; Destinazione d'uso: Segnaletica digitale; Luminosità: 500 cd/m2; Contrasto: 1200:1; Tempo di risposta: 8 ms;";Monitor e Periferiche PC > Monitor LFD;[113,191];Dispositivi elettronici > accessori computer e tablet
153||MK_000000167807;153;Monclick;TD_MANAGER;MK_000000167807;Controller Xbox wireless controller - cyberpunk 2077 limited edition - game pad wl3-00142;"Compatibilità: Android, iOS, Microsoft Xbox One, Microsoft Xbox One S, Microsoft Xbox One X, Microsoft Xbox Series S, Microsoft Xbox Series X, PC; Tipologia: Gamepad; Tecnologia di connessione: Senza fili; Colore: Argento, Nero;";Giochi e Console > Controller e joystick;[113,206];Dispositivi elettronici > videogiochi
153||MK_000000167846;153;Monclick;TD_MANAGER;MK_000000167846;Forno da incasso FCPS615X/1/E Smart Steam Idrolitico 70 Litri Classe A;"Tipologia: Elettrico; Efficienza energetica: Classe A; Potenza: 2700 W; Capacità: 70 l; Larghezza: 59.5 cm; Altezza: 59.5 cm; Profondità: 56.8 cm; Sistema di autopulizia: Idrolitico; Larghezza incasso: 59 cm; Profondità incasso: 56 cm; Altezza incasso: 59 cm; Colore: Argento, Nero; Modello: FCPS615X/1/E Smart Steam;";Elettrodomestici da incasso > Forni da incasso;[114,209];Elettrodomestici > Grandi elettrodomestici
153||MK_000000167853;153;Monclick;TD_MANAGER;MK_000000167853;Dispenser automatico mousse bianco 266-s;"Tipologia: n.d.; Q.tà per confezione: n.d.;";Prodotti per scuola e ufficio > Prodotti per la pulizia;[111,188];Casa e giardino > sicurezza
153||MK_000000167855;153;Monclick;TD_MANAGER;MK_000000167855;Penna Al-star 028 - penna stilografica - blu 1220158;"Quantità per confezione: 1; Tipologia: Penna stilografica; Colore: Blu; Tipo inchiostro: n.d.;";Prodotti per scuola e ufficio > Penne;[111,188];Casa e giardino > sicurezza
153||MK_000000167863;153;Monclick;TD_MANAGER;MK_000000167863;Notebook Nauta 02 15,6'' Core i7 RAM 16GB SSD 500GB I510210U8GBW10P;"Tipologia: Notebook; Dimensione schermo: 14 ''; Sistema operativo: Windows 10 Pro; Tipo processore: Intel Core i5; Serie scheda video: Intel UHD; Scheda grafica dedicata: Integrata; Memoria RAM: 8 GB; Touchscreen: No; Modello processore: i5-10210U; Modello scheda grafica: Intel UHD Graphics 630; RAM massima: 16 GB; Tipo hard disk: SSD; Capacità hard disk: 500 GB; Peso: 1 kg; Risoluzione: 1920 x 1080 Pixels; Unità ottica installata: Nessuna Unità Ottica; Colore: Grigio; Marchio processore: Intel;";PC Notebook e Tablet > Notebook;[113,197];Dispositivi elettronici > computer e tablet
153||MK_000000167870;153;Monclick;TD_MANAGER;MK_000000167870;Notebag 15.6 pro mouse usb nxmos5156bk;"Tipologia: Borsa; Adatta per: n.d.; Dimensione monitor: Non applicabile; Colore: n.d.;";Accessori > Borse e custodie;[113,190];Dispositivi elettronici > accessori
